CPU: ID 0x906ea, Processor Type 0x0, Family 0x6, Model 0x9e, Stepping 0xa
Northbridge: 8086:3ec4 (unknown)
Southbridge: 8086:a2ca (H310C)
Trying to reveal Primary to Sideband Bridge (P2SB),
let's hope the OS doesn't mind... done.
SBREG_BAR = 0xfd000000 (MEM)

Hiding Primary to Sideband Bridge (P2SB).

============= GPIOS =============

------- GPIO Community 0 -------

PCR Port ID: 0xaf0000

------- GPIO Group GPP_A -------
0x0400: 0x0000001884000502 GPP_A0       RCIN#               
0x0408: 0x0000301984000402 GPP_A1       LAD0                
0x0410: 0x0000301a84000402 GPP_A2       LAD1                
0x0418: 0x0000301b84000402 GPP_A3       LAD2                
0x0420: 0x0000301c84000402 GPP_A4       LAD3                
0x0428: 0x0000001d84000600 GPP_A5       LFRAME#             
0x0430: 0x0000001e84000402 GPP_A6       SERIRQ              
0x0438: 0x0000001f84000102 GPP_A7       GPIO                
0x0440: 0x0000002084000500 GPP_A8       CLKRUN#             
0x0448: 0x0000102184000600 GPP_A9       CLKOUT_LPC0         
0x0450: 0x0000002284000200 GPP_A10      GPIO                
0x0458: 0x0000002384000602 GPP_A11      PME#                
0x0460: 0x0000002484000200 GPP_A12      GPIO                
0x0468: 0x0000002544000600 GPP_A13      SUSWARN#/SUSPWRDNACK
0x0470: 0x0000002684000200 GPP_A14      GPIO                
0x0478: 0x0000302744000500 GPP_A15      SUS_ACK#            
0x0480: 0x0000002884000200 GPP_A16      GPIO                
0x0488: 0x0000002984000200 GPP_A17      GPIO                
0x0490: 0x0000002a84000200 GPP_A18      GPIO                
0x0498: 0x0000002b84000200 GPP_A19      GPIO                
0x04a0: 0x0000002c84000200 GPP_A20      GPIO                
0x04a8: 0x0000002d84000200 GPP_A21      GPIO                
0x04b0: 0x0000002e84000200 GPP_A22      GPIO                
0x04b8: 0x0000002f84000200 GPP_A23      GPIO                
------- GPIO Group GPP_B -------
0x04c0: 0x0000003084000200 GPP_B0       GPIO                
0x04c8: 0x0000003184000200 GPP_B1       GPIO                
0x04d0: 0x0000003284000102 GPP_B2       GPIO                
0x04d8: 0x0000003384000200 GPP_B3       GPIO                
0x04e0: 0x0000003484000200 GPP_B4       GPIO                
0x04e8: 0x0000003584000200 GPP_B5       GPIO                
0x04f0: 0x0000003684000200 GPP_B6       GPIO                
0x04f8: 0x0000003744000700 GPP_B7       SRCCLKREQ2#         
0x0500: 0x0000003884000200 GPP_B8       GPIO                
0x0508: 0x0000003984000200 GPP_B9       GPIO                
0x0510: 0x0000003a84000200 GPP_B10      GPIO                
0x0518: 0x0000003b04000200 GPP_B11      GPIO                
0x0520: 0x0000003c84000200 GPP_B12      GPIO                
0x0528: 0x0000003d44000600 GPP_B13      PLTRST#             
0x0530: 0x0000103e84000600 GPP_B14      SPKR                
0x0538: 0x0000003f84000200 GPP_B15      GPIO                
0x0540: 0x0000004084000200 GPP_B16      GPIO                
0x0548: 0x0000004184000200 GPP_B17      GPIO                
0x0550: 0x0000004284000200 GPP_B18      GPIO                
0x0558: 0x0000004384000200 GPP_B19      GPIO                
0x0560: 0x0000004484000200 GPP_B20      GPIO                
0x0568: 0x0000004584000200 GPP_B21      GPIO                
0x0570: 0x0000004684000200 GPP_B22      GPIO                
0x0578: 0x0000004784000200 GPP_B23      GPIO                
------- GPIO Community 1 -------

PCR Port ID: 0xae0000

------- GPIO Group GPP_C -------
0x0400: 0x0000004844000502 GPP_C0       SMBCLK              
0x0408: 0x0000004944000502 GPP_C1       SMBDATA             
0x0410: 0x0000004a84000200 GPP_C2       GPIO                
0x0418: 0x0000004b44000502 GPP_C3       SML0CLK             
0x0420: 0x0000004c44000502 GPP_C4       SML0DATA            
0x0428: 0x0000004d84000200 GPP_C5       GPIO                
0x0430: 0xffffffffffffffff GPP_C6       RESERVED            
0x0438: 0xffffffffffffffff GPP_C7       RESERVED            
0x0440: 0x0000005084000200 GPP_C8       GPIO                
0x0448: 0x0000005184000200 GPP_C9       GPIO                
0x0450: 0x0000005284000200 GPP_C10      GPIO                
0x0458: 0x0000005384000200 GPP_C11      GPIO                
0x0460: 0x0000005484000200 GPP_C12      GPIO                
0x0468: 0x0000005584000200 GPP_C13      GPIO                
0x0470: 0x0000005684000200 GPP_C14      GPIO                
0x0478: 0x0000005784000200 GPP_C15      GPIO                
0x0480: 0x0000005884000200 GPP_C16      GPIO                
0x0488: 0x0000005984000200 GPP_C17      GPIO                
0x0490: 0x0000005a84000100 GPP_C18      GPIO                
0x0498: 0x0000005b84000200 GPP_C19      GPIO                
0x04a0: 0x0000005c84000100 GPP_C20      GPIO                
0x04a8: 0x0000005d84000200 GPP_C21      GPIO                
0x04b0: 0x0000005e84000100 GPP_C22      GPIO                
0x04b8: 0x0000005f84000200 GPP_C23      GPIO                
------- GPIO Group GPP_D -------
0x04c0: 0x0000006084000200 GPP_D0       GPIO                
0x04c8: 0x0000006184000200 GPP_D1       GPIO                
0x04d0: 0x0000006284000200 GPP_D2       GPIO                
0x04d8: 0x0000006384000200 GPP_D3       GPIO                
0x04e0: 0x0000006484000200 GPP_D4       GPIO                
0x04e8: 0x0000006584000200 GPP_D5       GPIO                
0x04f0: 0x0000006684000200 GPP_D6       GPIO                
0x04f8: 0x0000006784000200 GPP_D7       GPIO                
0x0500: 0x0000006884000200 GPP_D8       GPIO                
0x0508: 0x0000006984000200 GPP_D9       GPIO                
0x0510: 0x0000006a84000200 GPP_D10      GPIO                
0x0518: 0x0000006b84000200 GPP_D11      GPIO                
0x0520: 0x0000006c84000200 GPP_D12      GPIO                
0x0528: 0x0000006d84000200 GPP_D13      GPIO                
0x0530: 0x0000006e84000200 GPP_D14      GPIO                
0x0538: 0x0000006f84000200 GPP_D15      GPIO                
0x0540: 0x0000007084000200 GPP_D16      GPIO                
0x0548: 0x0000007184000200 GPP_D17      GPIO                
0x0550: 0x0000007284000200 GPP_D18      GPIO                
0x0558: 0x0000007384000200 GPP_D19      GPIO                
0x0560: 0x0000007484000200 GPP_D20      GPIO                
0x0568: 0x0000007584000200 GPP_D21      GPIO                
0x0570: 0x0000007684000200 GPP_D22      GPIO                
0x0578: 0x0000007784000200 GPP_D23      GPIO                
------- GPIO Group GPP_E -------
0x0580: 0x0000301884000200 GPP_E0       GPIO                
0x0588: 0x0000301984000200 GPP_E1       GPIO                
0x0590: 0x0000301a84000200 GPP_E2       GPIO                
0x0598: 0x0000001b84000200 GPP_E3       GPIO                
0x05a0: 0x0000001c84000200 GPP_E4       GPIO                
0x05a8: 0x0000001d84000200 GPP_E5       GPIO                
0x05b0: 0x0000001e84000200 GPP_E6       GPIO                
0x05b8: 0x0000001f84000200 GPP_E7       GPIO                
0x05c0: 0x0000002084000600 GPP_E8       SATA_LED#           
0x05c8: 0x0000002184000102 GPP_E9       GPIO                
0x05d0: 0x0000002284000102 GPP_E10      GPIO                
0x05d8: 0x0000002384000102 GPP_E11      GPIO                
0x05e0: 0x0000002484000102 GPP_E12      GPIO                
------- GPIO Group GPP_F -------
0x05e8: 0x0000002584000200 GPP_F0       GPIO                
0x05f0: 0x0000002684000200 GPP_F1       GPIO                
0x05f8: 0x0000002784000200 GPP_F2       GPIO                
0x0600: 0x0000002884000200 GPP_F3       GPIO                
0x0608: 0x0000002984000200 GPP_F4       GPIO                
0x0610: 0x0000002a84000102 GPP_F5       GPIO                
0x0618: 0x0000002b84000200 GPP_F6       GPIO                
0x0620: 0x0000002c84000200 GPP_F7       GPIO                
0x0628: 0x0000002d84000200 GPP_F8       GPIO                
0x0630: 0x0000002e84000200 GPP_F9       GPIO                
0x0638: 0x0000002f84000200 GPP_F10      GPIO                
0x0640: 0x0000003084000200 GPP_F11      GPIO                
0x0648: 0x0000003184000200 GPP_F12      GPIO                
0x0650: 0x0000003284000200 GPP_F13      GPIO                
0x0658: 0x0000003384000200 GPP_F14      GPIO                
0x0660: 0x0000003484000102 GPP_F15      GPIO                
0x0668: 0x0000003584000102 GPP_F16      GPIO                
0x0670: 0x0000003684000102 GPP_F17      GPIO                
0x0678: 0x0000003784000102 GPP_F18      GPIO                
0x0680: 0x0000003884000200 GPP_F19      GPIO                
0x0688: 0x0000003984000200 GPP_F20      GPIO                
0x0690: 0x0000003a84000200 GPP_F21      GPIO                
0x0698: 0x0000003b84000200 GPP_F22      GPIO                
0x06a0: 0x0000003c84000200 GPP_F23      GPIO                
------- GPIO Group GPP_G -------
0x06a8: 0x0000003d84000200 GPP_G0       GPIO                
0x06b0: 0x0000003e84000200 GPP_G1       GPIO                
0x06b8: 0x0000003f84000200 GPP_G2       GPIO                
0x06c0: 0x0000004084000200 GPP_G3       GPIO                
0x06c8: 0x0000004184000200 GPP_G4       GPIO                
0x06d0: 0x0000004284000200 GPP_G5       GPIO                
0x06d8: 0x0000004384000200 GPP_G6       GPIO                
0x06e0: 0x0000004484000200 GPP_G7       GPIO                
0x06e8: 0x0000004584000200 GPP_G8       GPIO                
0x06f0: 0x0000004684000200 GPP_G9       GPIO                
0x06f8: 0x0000004784000200 GPP_G10      GPIO                
0x0700: 0x0000004884000200 GPP_G11      GPIO                
0x0708: 0x0000004984000200 GPP_G12      GPIO                
0x0710: 0x0000004a84000200 GPP_G13      GPIO                
0x0718: 0x0000004b84000200 GPP_G14      GPIO                
0x0720: 0x0000004c84000200 GPP_G15      GPIO                
0x0728: 0x0000004d84000200 GPP_G16      GPIO                
0x0730: 0x0000004e84000200 GPP_G17      GPIO                
0x0738: 0x0000004f80100102 GPP_G18      GPIO                
0x0740: 0x0000005084000500 GPP_G19      SMI#                
0x0748: 0x0000005184000200 GPP_G20      GPIO                
0x0750: 0x0000005242880102 GPP_G21      GPIO                
0x0758: 0x0000005384000200 GPP_G22      GPIO                
0x0760: 0x0000005484000200 GPP_G23      GPIO                
------- GPIO Group GPP_H -------
0x0768: 0x0000005584000200 GPP_H0       GPIO                
0x0770: 0x0000005684000200 GPP_H1       GPIO                
0x0778: 0x0000005784000200 GPP_H2       GPIO                
0x0780: 0x0000005884000200 GPP_H3       GPIO                
0x0788: 0x0000005984000200 GPP_H4       GPIO                
0x0790: 0x0000005a84000200 GPP_H5       GPIO                
0x0798: 0x0000005b84000200 GPP_H6       GPIO                
0x07a0: 0x0000005c84000200 GPP_H7       GPIO                
0x07a8: 0x0000005d84000200 GPP_H8       GPIO                
0x07b0: 0x0000005e84000200 GPP_H9       GPIO                
0x07b8: 0x0000005f84000200 GPP_H10      GPIO                
0x07c0: 0x0000006084000200 GPP_H11      GPIO                
0x07c8: 0x0000006184000200 GPP_H12      GPIO                
0x07d0: 0x0000006284000200 GPP_H13      GPIO                
0x07d8: 0x0000006384000200 GPP_H14      GPIO                
0x07e0: 0x0000006484000200 GPP_H15      GPIO                
0x07e8: 0x0000006584000200 GPP_H16      GPIO                
0x07f0: 0x0000006684000200 GPP_H17      GPIO                
0x07f8: 0x0000006784000200 GPP_H18      GPIO                
0x0800: 0x0000006884000200 GPP_H19      GPIO                
0x0808: 0x0000006984000200 GPP_H20      GPIO                
0x0810: 0x0000006a84000200 GPP_H21      GPIO                
0x0818: 0x0000006b84000200 GPP_H22      GPIO                
0x0820: 0x0000006c84000200 GPP_H23      GPIO                
------- GPIO Community 2 -------

PCR Port ID: 0xad0000

-------- GPIO Group GPD --------
0x0400: 0x0000001884000602 GPD0         BATLOW#             
0x0408: 0x0000001984000602 GPD1         ACPRESENT           
0x0410: 0x0000001a00880102 GPD2         GPIO                
0x0418: 0x0000301b04000502 GPD3         PWRBTN#             
0x0420: 0x0000001c04000600 GPD4         SLP_S3#             
0x0428: 0x0000001d04000600 GPD5         SLP_S4#             
0x0430: 0x0000001e04000600 GPD6         SLP_A#              
0x0438: 0x0000001f84000201 GPD7         GPIO                
0x0440: 0x0000002004000600 GPD8         SUSCLK              
0x0448: 0x0000002104000200 GPD9         GPIO                
0x0450: 0x0000002204000600 GPD10        SLP_S5#             
0x0458: 0x0000002384000200 GPD11        GPIO                
------- GPIO Community 3 -------

PCR Port ID: 0xac0000

------- GPIO Group GPP_I -------
0x0400: 0x0000006d84000500 GPP_I0       DDPB_HPD0           
0x0408: 0x0000006e84000200 GPP_I1       GPIO                
0x0410: 0x0000006f84000500 GPP_I2       DDPD_HPD2           
0x0418: 0x0000007084000500 GPP_I3       DDPE_HPD3           
0x0420: 0x0000007184000500 GPP_I4       EDP_HPD             
0x0428: 0x0000007284000500 GPP_I5       DDPB_CTRLCLK        
0x0430: 0x0000107384000500 GPP_I6       DDPB_CTRLDATA       
0x0438: 0x0000007484000500 GPP_I7       DDPC_CTRLCLK        
0x0440: 0x0000107584000500 GPP_I8       DDPC_CTRLDATA       
0x0448: 0x0000007684000500 GPP_I9       DDPD_CTRLCLK        
0x0450: 0x0000107784000500 GPP_I10      DDPD_CTRLDATA       



============= RCBA ==============

Error: Dumping RCBA on this southbridge is not (yet) supported.



========== ACPI/PMC =========

Error: Dumping PMBASE on this southbridge is not (yet) supported.



========== LPC/eSPI =========

Error: Dumping LPC/eSPI on this southbridge is not (yet) supported.



============= MCHBAR ============

Error: Dumping MCHBAR on this northbridge is not (yet) supported.
Error: Unknown PCI id: 00008086/00003ec4



============= EPBAR =============

Error: Dumping EPBAR on this northbridge is not (yet) supported.



============= DMIBAR ============

Error: Dumping DMIBAR on this northbridge is not (yet) supported.


========= PCIEXBAR ========

Error: Dumping PCIEXBAR on this northbridge is not (yet) supported.



===================== SHARED MSRs (All Cores) =====================
 MSR 0x00000017 = 0x00140000:0x00000000 (IA32_PLATFORM_ID)
 MSR 0x00000080 = 0x00000000:0x00000000 (MSR_TRACE_HUB_STH_ACPIBAR_BASE)
 MSR 0x000000CE = 0x0808083B:0xF9011800 (MSR_PLATFORM_INFO)
 MSR 0x00000198 = 0x00002477:0x00002400 (IA32_PERF_STATUS)
 MSR 0x000001A2 = 0x00000000:0x00640000 (MSR_TEMPERATURE_TARGET)
 MSR 0x000001AD = 0x00002122:0x23242428 (MSR_TURBO_RATIO_LIMIT)
 MSR 0x00000284 = 0x00000000:0x00000000 (IA32_MC4_CTL2)
 MSR 0x000002F4 = 0x00000000:0x00000000 (MSR_UNCORE_PRMRR_PHYS_BASE)
 MSR 0x000002F5 = 0x00000000:0x00000400 (MSR_UNCORE_PRMRR_PHYS_MASK)
 MSR 0x00000394 = 0x00000000:0x00000000 (MSR_UNC_PERF_FIXED_CTRL)
 MSR 0x00000395 = 0x00000000:0x00000000 (MSR_UNC_PERF_FIXED_CTR)
 MSR 0x0000060A = 0x00000000:0x0000884E (MSR_PKGC3_IRTL)
 MSR 0x0000060B = 0x00000000:0x00008876 (MSR_PKGC6_IRTL)
 MSR 0x0000060D = 0x00000016:0x57E26EC8 (MSR_PKG_C2_RESIDENCY)
 MSR 0x00000610 = 0x004282D0:0x00DD8208 (MSR_PKG_POWER_LIMIT)
 MSR 0x00000614 = 0x00000000:0x00000168 (MSR_PKG_POWER_INFO)
 MSR 0x00000620 = 0x00000000:0x00000821 (MSR_RING_RATIO_LIMIT)
 MSR 0x00000638 = 0x00000000:0x00000000 (MSR_PP0_POWER_LIMIT)
 MSR 0x0000064F = 0x00000000:0x34000000 (MSR_CORE_PERF_LIMIT_REASONS)
 MSR 0x00000652 = 0x00000000:0x00000002 (MSR_PKG_HDC_CONFIG)
 MSR 0x0000065C = 0x00000000:0x00DD0000 (MSR_PLATFORM_POWER_LIMIT)
 MSR 0x000006B0 = 0x00000000:0x00000000 (MSR_GRAPHICS_PERF_LIMIT_REASONS)
 MSR 0x000006B1 = 0x00000000:0x01000000 (MSR_RING_PERF_LIMIT_REASONS)
 MSR 0x00000770 = 0x00000000:0x00000001 (IA32_PM_ENABLE)
 MSR 0x00000DB0 = 0x00000000:0x00000001 (IA32_PKG_HDC_CTL)
 MSR 0x000003B0 = 0x00000000:0x00000000 (MSR_UNC_ARB_PERFCTR0)
 MSR 0x000003B1 = 0x00000000:0x00000000 (MSR_UNC_ARB_PERFCTR1)
 MSR 0x000003B2 = 0x00000000:0x00000000 (MSR_UNC_ARB_PERFEVTSEL0)
 MSR 0x000003B3 = 0x00000000:0x00000000 (MSR_UNC_ARB_PERFEVTSEL1)
 MSR 0x00000700 = 0x00000000:0x00000000 (MSR_UNC_CBO_0_PERFCTR0)
 MSR 0x00000701 = 0x00000000:0x00000000 (MSR_UNC_CBO_0_PERFCTR1)
 MSR 0x00000706 = 0x00000000:0x00000000 (MSR_UNC_CBO_0_PERFEVTSEL0)
 MSR 0x00000707 = 0x00000000:0x00000000 (MSR_UNC_CBO_0_PERFEVTSEL1)
 MSR 0x00000710 = 0x00000000:0x00000000 (MSR_UNC_CBO_1_PERFCTR0)
 MSR 0x00000711 = 0x00000000:0x00000000 (MSR_UNC_CBO_1_PERFCTR1)
 MSR 0x00000716 = 0x00000000:0x00000000 (MSR_UNC_CBO_1_PERFEVTSEL0)
 MSR 0x00000717 = 0x00000000:0x00000000 (MSR_UNC_CBO_1_PERFEVTSEL1)
 MSR 0x00000720 = 0x00000000:0x00000000 (MSR_UNC_CBO_2_PERFCTR0)
 MSR 0x00000721 = 0x00000000:0x00000000 (MSR_UNC_CBO_2_PERFCTR1)
 MSR 0x00000726 = 0x00000000:0x00000000 (MSR_UNC_CBO_2_PERFEVTSEL0)
 MSR 0x00000727 = 0x00000000:0x00000000 (MSR_UNC_CBO_2_PERFEVTSEL1)
 MSR 0x00000730 = 0x00000000:0x00000000 (MSR_UNC_CBO_3_PERFCTR0)
 MSR 0x00000731 = 0x00000000:0x00000000 (MSR_UNC_CBO_3_PERFCTR1)
 MSR 0x00000736 = 0x00000000:0x00000000 (MSR_UNC_CBO_3_PERFEVTSEL0)
 MSR 0x00000737 = 0x00000000:0x00000000 (MSR_UNC_CBO_3_PERFEVTSEL1)
 MSR 0x00000E01 = 0x00000000:0x2000001F (MSR_UNC_PERF_GLOBAL_CTRL)
 MSR 0x00000E02 = 0x00000000:0x00000000 (MSR_UNC_PERF_GLOBAL_STATUS)

====================== UNIQUE MSRs  (core 0) ======================
 MSR 0x00000000 = 0x00000000:0x00000FFF (IA32_P5_MC_ADDR)
 MSR 0x00000001 = 0x00000000:0x00000000 (IA32_P5_MC_TYPE)
 MSR 0x00000006 = 0x00000000:0x00000040 (IA32_MONITOR_FILTER_SIZE)
 MSR 0x00000010 = 0x00000039:0x4AA44EF2 (IA32_TIME_STAMP_COUNTER)
 MSR 0x0000001B = 0x00000000:0xFEE00D00 (IA32_APIC_BASE)
 MSR 0x00000034 = 0x00000000:0x000001DD (MSR_SMI_COUNT)
 MSR 0x0000003A = 0x00000000:0x00000005 (IA32_FEATURE_CONTROL)
 MSR 0x0000008B = 0x000000F4:0x00000000 (IA32_BIOS_SIGN_ID)
 MSR 0x000000C1 = 0x00000000:0x00000000 (IA32_PMC0)
 MSR 0x000000C2 = 0x00000000:0x00000000 (IA32_PMC1)
 MSR 0x000000C3 = 0x00000000:0x00000000 (IA32_PMC2)
 MSR 0x000000C4 = 0x00000000:0x0000FFFF (IA32_PMC3)
 MSR 0x000000E2 = 0x00000000:0x1E008008 (MSR_PKG_CST_CONFIG_CONTROL)
 MSR 0x000000E4 = 0x00000000:0x00051814 (MSR_PMG_IO_CAPTURE_BASE)
 MSR 0x000000E7 = 0x0000000B:0x8E8E13E1 (IA32_MPERF)
 MSR 0x000000E8 = 0x0000000F:0xD6FCA839 (IA32_APERF)
 MSR 0x000000FE = 0x00000000:0x00001D0A (IA32_MTRRCAP)
 MSR 0x0000013C = 0x00000000:0x00000001 (MSR_FEATURE_CONFIG)
 MSR 0x00000174 = 0x00000000:0x00000010 (IA32_SYSENTER_CS)
 MSR 0x00000175 = 0xFFFFFE00:0x00003000 (IA32_SYSENTER_ESP)
 MSR 0x00000176 = 0xFFFFFFFF:0x8D6018A0 (IA32_SYSENTER_EIP)
 MSR 0x00000179 = 0x00000000:0x00000C0C (IA32_MCG_CAP)
 MSR 0x0000017A = 0x00000000:0x00000000 (IA32_MCG_STATUS)
 MSR 0x00000186 = 0x00000000:0x00000000 (IA32_PERFEVTSEL0)
 MSR 0x00000187 = 0x00000000:0x00000000 (IA32_PERFEVTSEL1)
 MSR 0x00000188 = 0x00000000:0x00000000 (IA32_PERFEVTSEL2)
 MSR 0x00000189 = 0x00000000:0x00000000 (IA32_PERFEVTSEL3)
 MSR 0x00000199 = 0x00000000:0x00000800 (IA32_PERF_CTL)
 MSR 0x0000019A = 0x00000000:0x00000000 (IA32_CLOCK_MODULATION)
 MSR 0x0000019B = 0x00000000:0x00000013 (IA32_THERM_INTERRUPT)
 MSR 0x0000019C = 0x00000000:0x88470800 (IA32_THERM_STATUS)
 MSR 0x000001A0 = 0x00000000:0x00850089 (IA32_MISC_ENABLE)
 MSR 0x000001A4 = 0x00000000:0x00000000 (IA32_MISC_FEATURE_CONTROL)
 MSR 0x000001A6 = 0x00000000:0x00000000 (MSR_OFFCORE_RSP_0)
 MSR 0x000001A7 = 0x00000000:0x00000000 (MSR_OFFCORE_RSP_1)
 MSR 0x000001C8 = 0x00000000:0x00000000 (MSR_LBR_SELECT)
 MSR 0x000001C9 = 0x00000000:0x00000000 (MSR_LASTBRANCH_TOS)
 MSR 0x000001D9 = 0x00000000:0x00004000 (IA32_DEBUGCTL)
 MSR 0x000001DD = 0x00000000:0x00000000 (MSR_LER_FROM_LIP)
 MSR 0x000001DE = 0x00000000:0x00000000 (MSR_LER_TO_LIP)
 MSR 0x000001F2 = 0x00000000:0xBF800006 (IA32_SMRR_PHYSBASE)
 MSR 0x000001F3 = 0x00000000:0xFF800800 (IA32_SMRR_PHYSMASK)
 MSR 0x000001F4 = 0x00000000:0x00000000 (MSR_PRMRR_PHYS_BASE)
 MSR 0x000001F5 = 0x00000000:0x00000000 (MSR_PRMRR_PHYS_MASK)
 MSR 0x000001FB = 0x00000000:0x000000E1 (MSR_PRMRR_VALID_CONFIG)
 MSR 0x000001FC = 0x00000000:0x002C005D (MSR_POWER_CTL)
 MSR 0x00000200 = 0x00000000:0xC0000000 (IA32_MTRR_PHYSBASE0)
 MSR 0x00000201 = 0x0000007F:0xC0000800 (IA32_MTRR_PHYSBASE0)
 MSR 0x00000202 = 0x00000000:0x00000000 (IA32_MTRR_PHYSBASE1)
 MSR 0x00000203 = 0x00000000:0x00000000 (IA32_MTRR_PHYSBASE1)
 MSR 0x00000204 = 0x00000000:0x00000000 (IA32_MTRR_PHYSBASE2)
 MSR 0x00000205 = 0x00000000:0x00000000 (IA32_MTRR_PHYSBASE2)
 MSR 0x00000206 = 0x00000000:0x00000000 (IA32_MTRR_PHYSBASE3)
 MSR 0x00000207 = 0x00000000:0x00000000 (IA32_MTRR_PHYSBASE3)
 MSR 0x00000208 = 0x00000000:0x00000000 (IA32_MTRR_PHYSBASE4)
 MSR 0x00000209 = 0x00000000:0x00000000 (IA32_MTRR_PHYSBASE4)
 MSR 0x0000020A = 0x00000000:0x00000000 (IA32_MTRR_PHYSBASE5)
 MSR 0x0000020B = 0x00000000:0x00000000 (IA32_MTRR_PHYSBASE5)
 MSR 0x0000020C = 0x00000000:0x00000000 (IA32_MTRR_PHYSBASE6)
 MSR 0x0000020D = 0x00000000:0x00000000 (IA32_MTRR_PHYSBASE6)
 MSR 0x0000020E = 0x00000000:0x00000000 (IA32_MTRR_PHYSBASE7)
 MSR 0x0000020F = 0x00000000:0x00000000 (IA32_MTRR_PHYSBASE7)
 MSR 0x00000210 = 0x00000000:0x00000000 (IA32_MTRR_PHYSBASE8)
 MSR 0x00000211 = 0x00000000:0x00000000 (IA32_MTRR_PHYSBASE8)
 MSR 0x00000212 = 0x00000000:0x00000000 (IA32_MTRR_PHYSBASE9)
 MSR 0x00000213 = 0x00000000:0x00000000 (IA32_MTRR_PHYSBASE9)
 MSR 0x00000250 = 0x06060606:0x06060606 (IA32_MTRR_FIX64K_00000)
 MSR 0x00000258 = 0x06060606:0x06060606 (IA32_MTRR_FIX16K_80000)
 MSR 0x00000259 = 0x00000000:0x00000000 (IA32_MTRR_FIX16K_A0000)
 MSR 0x00000268 = 0x05050505:0x05050505 (IA32_MTRR_FIX4K_C0000)
 MSR 0x00000269 = 0x05050505:0x05050505 (IA32_MTRR_FIX4K_C8000)
 MSR 0x0000026A = 0x05050505:0x05050505 (IA32_MTRR_FIX4K_D0000)
 MSR 0x0000026B = 0x05050505:0x05050505 (IA32_MTRR_FIX4K_D8000)
 MSR 0x0000026C = 0x05050505:0x05050505 (IA32_MTRR_FIX4K_E0000)
 MSR 0x0000026D = 0x05050505:0x05050505 (IA32_MTRR_FIX4K_E8000)
 MSR 0x0000026E = 0x05050505:0x05050505 (IA32_MTRR_FIX4K_F0000)
 MSR 0x0000026F = 0x05050505:0x05050505 (IA32_MTRR_FIX4K_F8000)
 MSR 0x00000277 = 0x04070506:0x00070106 (IA32_PAT)
 MSR 0x00000280 = 0x00000000:0x40000001 (IA32_MC0_CTL2)
 MSR 0x00000281 = 0x00000000:0x40000001 (IA32_MC1_CTL2)
 MSR 0x00000282 = 0x00000000:0x40000001 (IA32_MC2_CTL2)
 MSR 0x00000283 = 0x00000000:0x40000001 (IA32_MC3_CTL2)
 MSR 0x000002FF = 0x00000000:0x00000C06 (IA32_MTRR_DEF_TYPE)
 MSR 0x00000309 = 0x00000000:0x00000000 (IA32_FIXED_CTR0)
 MSR 0x0000030A = 0x0000FFFE:0xC11FE456 (IA32_FIXED_CTR1)
 MSR 0x0000030B = 0x00000000:0x00000000 (IA32_FIXED_CTR2)
 MSR 0x00000345 = 0x00000000:0x000033C5 (IA32_PERF_CAPABILITIES)
 MSR 0x0000038D = 0x00000000:0x000000B0 (IA32_FIXED_CTR_CTRL)
 MSR 0x0000038E = 0x00000000:0x00000000 (IA32_PERF_GLOBAL_STATUS)
 MSR 0x0000038F = 0x00000007:0x0000000F (IA32_PERF_GLOBAL_CTRL)
 MSR 0x00000390 = 0x00000000:0x00000000 (IA32_PERF_GLOBAL_STATUS_RESET)
 MSR 0x00000391 = 0x00000000:0x00000000 (IA32_PERF_GLOBAL_STATUS_SET)
 MSR 0x000003F1 = 0x00000000:0x00000000 (MSR_PEBS_ENABLE)
 MSR 0x000003F6 = 0x00000000:0x0000FFFF (MSR_PEBS_LD_LAT)
 MSR 0x000003F7 = 0x00000000:0x00000800 (MSR_PEBS_FRONTEND)
 MSR 0x000003FC = 0x00000000:0x314253A8 (MSR_CORE_C3_RESIDENCY)
 MSR 0x000003FD = 0x00000001:0x0EACAF88 (MSR_CORE_C6_RESIDENCY)
 MSR 0x000003FE = 0x00000027:0x3790F938 (MSR_CORE_C7_RESIDENCY)
 MSR 0x00000400 = 0x00000000:0x00000FFF (IA32_MC0_CTL)
 MSR 0x00000401 = 0x00000000:0x00000000 (IA32_MC0_STATUS)
 MSR 0x00000402 = 0x00000000:0x00000000 (IA32_MC0_ADDR)
 MSR 0x00000403 = 0x00000000:0x00000000 (IA32_MC0_MISC)
 MSR 0x00000404 = 0x00000000:0x0000000F (IA32_MC1_CTL)
 MSR 0x00000405 = 0x00000000:0x00000000 (IA32_MC1_STATUS)
 MSR 0x00000406 = 0x00000000:0x00000000 (IA32_MC1_ADDR)
 MSR 0x00000407 = 0x00000000:0x00000000 (IA32_MC1_MISC)
 MSR 0x00000408 = 0x00000000:0x0000000F (IA32_MC2_CTL)
 MSR 0x00000409 = 0x00000000:0x00000000 (IA32_MC2_STATUS)
 MSR 0x0000040A = 0x00000000:0x00000000 (IA32_MC2_ADDR)
 MSR 0x0000040C = 0x00000000:0x0000001F (IA32_MC3_CTL)
 MSR 0x0000040D = 0x00000000:0x00000000 (IA32_MC3_STATUS)
 MSR 0x0000040E = 0x00000000:0x00000000 (IA32_MC3_ADDR)
 MSR 0x00000410 = 0x00000000:0x0000003F (IA32_MC4_CTL)
 MSR 0x00000411 = 0x00000000:0x00000000 (IA32_MC4_STATUS)
 MSR 0x00000480 = 0x00DA0400:0x00000004 (IA32_VMX_BASIC)
 MSR 0x00000481 = 0x0000007F:0x00000016 (IA32_VMX_PINBASED_CTLS)
 MSR 0x00000482 = 0xFFF9FFFE:0x0401E172 (IA32_VMX_PROCBASED_CTLS)
 MSR 0x00000483 = 0x01FFFFFF:0x00036DFF (IA32_VMX_EXIT_CTLS)
 MSR 0x00000484 = 0x0003FFFF:0x000011FF (IA32_VMX_ENTRY_CTLS)
 MSR 0x00000485 = 0x00000000:0x7004C1E7 (IA32_VMX_MISC)
 MSR 0x00000486 = 0x00000000:0x80000021 (IA32_VMX_CR0_FIXED0)
 MSR 0x00000487 = 0x00000000:0xFFFFFFFF (IA32_VMX_CR0_FIXED1)
 MSR 0x00000488 = 0x00000000:0x00002000 (IA32_VMX_CR4_FIXED0)
 MSR 0x00000489 = 0x00000000:0x003767FF (IA32_VMX_CR4_FIXED1)
 MSR 0x0000048A = 0x00000000:0x0000002E (IA32_VMX_VMCS_ENUM)
 MSR 0x0000048B = 0x005FFCFF:0x00000000 (IA32_VMX_PROCBASED_CTLS2)
 MSR 0x0000048C = 0x00000F01:0x06734141 (IA32_VMX_EPT_VPID_ENUM)
 MSR 0x0000048D = 0x0000007F:0x00000016 (IA32_VMX_TRUE_PINBASED_CTLS)
 MSR 0x0000048E = 0xFFF9FFFE:0x04006172 (IA32_VMX_TRUE_PROCBASED_CTLS)
 MSR 0x0000048F = 0x01FFFFFF:0x00036DFB (IA32_VMX_TRUE_EXIT_CTLS)
 MSR 0x00000490 = 0x0003FFFF:0x000011FB (IA32_VMX_TRUE_ENTRY_CTLS)
 MSR 0x000004C1 = 0x00000000:0x00000000 (IA32_A_PMC0)
 MSR 0x000004C2 = 0x00000000:0x00000000 (IA32_A_PMC1)
 MSR 0x000004C3 = 0x00000000:0x00000000 (IA32_A_PMC2)
 MSR 0x000004C4 = 0x00000000:0x0000FFFF (IA32_A_PMC3)
 MSR 0x00000500 = 0x00000000:0x00020000 (IA32_SGX_SVN_STATUS)
 MSR 0x00000560 = 0x00000000:0x00000000 (IA32_RTIT_OUTPUT_BASE)
 MSR 0x00000561 = 0x00000000:0x0000007F (IA32_RTIT_OUTPUT_MASK_PTRS)
 MSR 0x00000570 = 0x00000000:0x00000000 (IA32_RTIT_CTL)
 MSR 0x00000571 = 0x00000000:0x00000000 (IA32_RTIT_STATUS)
 MSR 0x00000572 = 0x00000000:0x00000000 (IA32_RTIT_CR3_MATCH)
 MSR 0x00000580 = 0x00000000:0x00000000 (IA32_RTIT_ADDR0_A)
 MSR 0x00000581 = 0x00000000:0x00000000 (IA32_RTIT_ADDR0_B)
 MSR 0x00000582 = 0x00000000:0x00000000 (IA32_RTIT_ADDR1_A)
 MSR 0x00000583 = 0x00000000:0x00000000 (IA32_RTIT_ADDR1_B)
 MSR 0x00000600 = 0xFFFFFE00:0x0001B000 (IA32_DS_AREA)
 MSR 0x0000064E = 0x0000000F:0x63CE92D4 (MSR_PPERF)
 MSR 0x00000653 = 0x00000000:0x00000000 (MSR_CORE_HDC_RESIDENCY)
 MSR 0x00000690 = 0x00000000:0x00000000 (MSR_LASTBRANCH_16_FROM_IP)
 MSR 0x00000691 = 0x00000000:0x00000000 (MSR_LASTBRANCH_17_FROM_IP)
 MSR 0x00000692 = 0x00000000:0x00000000 (MSR_LASTBRANCH_18_FROM_IP)
 MSR 0x00000693 = 0x00000000:0x00000000 (MSR_LASTBRANCH_19_FROM_IP)
 MSR 0x00000694 = 0x00000000:0x00000000 (MSR_LASTBRANCH_20_FROM_IP)
 MSR 0x00000695 = 0x00000000:0x00000000 (MSR_LASTBRANCH_21_FROM_IP)
 MSR 0x00000696 = 0x00000000:0x00000000 (MSR_LASTBRANCH_22_FROM_IP)
 MSR 0x00000697 = 0x00000000:0x00000000 (MSR_LASTBRANCH_23_FROM_IP)
 MSR 0x00000698 = 0x00000000:0x00000000 (MSR_LASTBRANCH_24_FROM_IP)
 MSR 0x00000699 = 0x00000000:0x00000000 (MSR_LASTBRANCH_25_FROM_IP)
 MSR 0x0000069A = 0x00000000:0x00000000 (MSR_LASTBRANCH_26_FROM_IP)
 MSR 0x0000069B = 0x00000000:0x00000000 (MSR_LASTBRANCH_27_FROM_IP)
 MSR 0x0000069C = 0x00000000:0x00000000 (MSR_LASTBRANCH_28_FROM_IP)
 MSR 0x0000069D = 0x00000000:0x00000000 (MSR_LASTBRANCH_29_FROM_IP)
 MSR 0x0000069E = 0x00000000:0x00000000 (MSR_LASTBRANCH_30_FROM_IP)
 MSR 0x0000069F = 0x00000000:0x00000000 (MSR_LASTBRANCH_31_FROM_IP)
 MSR 0x000006D0 = 0x00000000:0x00000000 (MSR_LASTBRANCH_16_TO_IP)
 MSR 0x000006D1 = 0x00000000:0x00000000 (MSR_LASTBRANCH_17_TO_IP)
 MSR 0x000006D2 = 0x00000000:0x00000000 (MSR_LASTBRANCH_18_TO_IP)
 MSR 0x000006D3 = 0x00000000:0x00000000 (MSR_LASTBRANCH_19_TO_IP)
 MSR 0x000006D4 = 0x00000000:0x00000000 (MSR_LASTBRANCH_20_TO_IP)
 MSR 0x000006D5 = 0x00000000:0x00000000 (MSR_LASTBRANCH_21_TO_IP)
 MSR 0x000006D6 = 0x00000000:0x00000000 (MSR_LASTBRANCH_22_TO_IP)
 MSR 0x000006D7 = 0x00000000:0x00000000 (MSR_LASTBRANCH_23_TO_IP)
 MSR 0x000006D8 = 0x00000000:0x00000000 (MSR_LASTBRANCH_24_TO_IP)
 MSR 0x000006D9 = 0x00000000:0x00000000 (MSR_LASTBRANCH_25_TO_IP)
 MSR 0x000006DA = 0x00000000:0x00000000 (MSR_LASTBRANCH_26_TO_IP)
 MSR 0x000006DB = 0x00000000:0x00000000 (MSR_LASTBRANCH_27_TO_IP)
 MSR 0x000006DC = 0x00000000:0x00000000 (MSR_LASTBRANCH_28_TO_IP)
 MSR 0x000006DD = 0x00000000:0x00000000 (MSR_LASTBRANCH_29_TO_IP)
 MSR 0x000006DE = 0x00000000:0x00000000 (MSR_LASTBRANCH_30_TO_IP)
 MSR 0x000006DF = 0x00000000:0x00000000 (MSR_LASTBRANCH_31_TO_IP)
 MSR 0x000006E0 = 0x00000039:0x4AF998BC (IA32_TSC_DEADLINE)
 MSR 0x00000771 = 0x00000000:0x010C1824 (IA32_HWP_CAPABILITIES)
 MSR 0x00000773 = 0x00000000:0x00000001 (IA32_HWP_INTERRUPT)
 MSR 0x00000774 = 0x00000000:0x00002408 (IA32_HWP_REQUEST)
 MSR 0x00000777 = 0x00000000:0x00000000 (IA32_HWP_STATUS)
 MSR 0x00000D90 = 0x00000000:0x00000000 (IA32_BNDCFGS)
 MSR 0x00000DA0 = 0x00000000:0x00000000 (IA32_XSS)
 MSR 0x00000DB1 = 0x00000000:0x00000001 (IA32_PM_CTL1)
 MSR 0x00000DB2 = 0x00000000:0x00000000 (IA32_THREAD_STALL)
 MSR 0x00000DC0 = 0x00000000:0x00000000 (IA32_LBR_INFO_0)
 MSR 0x00000DC1 = 0x00000000:0x00000000 (IA32_LBR_INFO_1)
 MSR 0x00000DC2 = 0x00000000:0x00000000 (IA32_LBR_INFO_2)
 MSR 0x00000DC3 = 0x00000000:0x00000000 (IA32_LBR_INFO_3)
 MSR 0x00000DC4 = 0x00000000:0x00000000 (IA32_LBR_INFO_4)
 MSR 0x00000DC5 = 0x00000000:0x00000000 (IA32_LBR_INFO_5)
 MSR 0x00000DC6 = 0x00000000:0x00000000 (IA32_LBR_INFO_6)
 MSR 0x00000DC7 = 0x00000000:0x00000000 (IA32_LBR_INFO_7)
 MSR 0x00000DC8 = 0x00000000:0x00000000 (IA32_LBR_INFO_8)
 MSR 0x00000DC9 = 0x00000000:0x00000000 (IA32_LBR_INFO_9)
 MSR 0x00000DCA = 0x00000000:0x00000000 (IA32_LBR_INFO_10)
 MSR 0x00000DCB = 0x00000000:0x00000000 (IA32_LBR_INFO_11)
 MSR 0x00000DCC = 0x00000000:0x00000000 (IA32_LBR_INFO_12)
 MSR 0x00000DCD = 0x00000000:0x00000000 (IA32_LBR_INFO_13)
 MSR 0x00000DCE = 0x00000000:0x00000000 (IA32_LBR_INFO_14)
 MSR 0x00000DCF = 0x00000000:0x00000000 (IA32_LBR_INFO_15)
 MSR 0x00000DD0 = 0x00000000:0x00000000 (IA32_LBR_INFO_16)
 MSR 0x00000DD1 = 0x00000000:0x00000000 (IA32_LBR_INFO_17)
 MSR 0x00000DD2 = 0x00000000:0x00000000 (IA32_LBR_INFO_18)
 MSR 0x00000DD3 = 0x00000000:0x00000000 (IA32_LBR_INFO_19)
 MSR 0x00000DD4 = 0x00000000:0x00000000 (IA32_LBR_INFO_20)
 MSR 0x00000DD5 = 0x00000000:0x00000000 (IA32_LBR_INFO_21)
 MSR 0x00000DD6 = 0x00000000:0x00000000 (IA32_LBR_INFO_22)
 MSR 0x00000DD7 = 0x00000000:0x00000000 (IA32_LBR_INFO_23)
 MSR 0x00000DD8 = 0x00000000:0x00000000 (IA32_LBR_INFO_24)
 MSR 0x00000DD9 = 0x00000000:0x00000000 (IA32_LBR_INFO_25)
 MSR 0x00000DDA = 0x00000000:0x00000000 (IA32_LBR_INFO_26)
 MSR 0x00000DDB = 0x00000000:0x00000000 (IA32_LBR_INFO_27)
 MSR 0x00000DDC = 0x00000000:0x00000000 (IA32_LBR_INFO_28)
 MSR 0x00000DDD = 0x00000000:0x00000000 (IA32_LBR_INFO_29)
 MSR 0x00000DDE = 0x00000000:0x00000000 (IA32_LBR_INFO_30)
 MSR 0x00000DDF = 0x00000000:0x00000000 (IA32_LBR_INFO_31)

====================== UNIQUE MSRs  (core 1) ======================
 MSR 0x00000000 = 0x00000000:0x00000FFF (IA32_P5_MC_ADDR)
 MSR 0x00000001 = 0x00000000:0x00000000 (IA32_P5_MC_TYPE)
 MSR 0x00000006 = 0x00000000:0x00000040 (IA32_MONITOR_FILTER_SIZE)
 MSR 0x00000010 = 0x00000039:0x4AD9ABE6 (IA32_TIME_STAMP_COUNTER)
 MSR 0x0000001B = 0x00000000:0xFEE00C00 (IA32_APIC_BASE)
 MSR 0x00000034 = 0x00000000:0x000001DD (MSR_SMI_COUNT)
 MSR 0x0000003A = 0x00000000:0x00000005 (IA32_FEATURE_CONTROL)
 MSR 0x0000008B = 0x000000F4:0x00000000 (IA32_BIOS_SIGN_ID)
 MSR 0x000000C1 = 0x00000000:0x00000000 (IA32_PMC0)
 MSR 0x000000C2 = 0x00000000:0x00000000 (IA32_PMC1)
 MSR 0x000000C3 = 0x00000000:0x00000000 (IA32_PMC2)
 MSR 0x000000C4 = 0x00000000:0x00000000 (IA32_PMC3)
 MSR 0x000000E2 = 0x00000000:0x1E008008 (MSR_PKG_CST_CONFIG_CONTROL)
 MSR 0x000000E4 = 0x00000000:0x00051814 (MSR_PMG_IO_CAPTURE_BASE)
 MSR 0x000000E7 = 0x00000004:0x30638D4B (IA32_MPERF)
 MSR 0x000000E8 = 0x00000005:0xFB44AFBC (IA32_APERF)
 MSR 0x000000FE = 0x00000000:0x00001D0A (IA32_MTRRCAP)
 MSR 0x0000013C = 0x00000000:0x00000001 (MSR_FEATURE_CONFIG)
 MSR 0x00000174 = 0x00000000:0x00000010 (IA32_SYSENTER_CS)
 MSR 0x00000175 = 0xFFFFFE00:0x0003E000 (IA32_SYSENTER_ESP)
 MSR 0x00000176 = 0xFFFFFFFF:0x8D6018A0 (IA32_SYSENTER_EIP)
 MSR 0x00000179 = 0x00000000:0x00000C0C (IA32_MCG_CAP)
 MSR 0x0000017A = 0x00000000:0x00000000 (IA32_MCG_STATUS)
 MSR 0x00000186 = 0x00000000:0x00000000 (IA32_PERFEVTSEL0)
 MSR 0x00000187 = 0x00000000:0x00000000 (IA32_PERFEVTSEL1)
 MSR 0x00000188 = 0x00000000:0x00000000 (IA32_PERFEVTSEL2)
 MSR 0x00000189 = 0x00000000:0x00000000 (IA32_PERFEVTSEL3)
 MSR 0x00000199 = 0x00000000:0x00000800 (IA32_PERF_CTL)
 MSR 0x0000019A = 0x00000000:0x00000000 (IA32_CLOCK_MODULATION)
 MSR 0x0000019B = 0x00000000:0x00000013 (IA32_THERM_INTERRUPT)
 MSR 0x0000019C = 0x00000000:0x88440800 (IA32_THERM_STATUS)
 MSR 0x000001A0 = 0x00000000:0x00850089 (IA32_MISC_ENABLE)
 MSR 0x000001A4 = 0x00000000:0x00000000 (IA32_MISC_FEATURE_CONTROL)
 MSR 0x000001A6 = 0x00000000:0x00000000 (MSR_OFFCORE_RSP_0)
 MSR 0x000001A7 = 0x00000000:0x00000000 (MSR_OFFCORE_RSP_1)
 MSR 0x000001C8 = 0x00000000:0x00000000 (MSR_LBR_SELECT)
 MSR 0x000001C9 = 0x00000000:0x00000000 (MSR_LASTBRANCH_TOS)
 MSR 0x000001D9 = 0x00000000:0x00004000 (IA32_DEBUGCTL)
 MSR 0x000001DD = 0x00000000:0x00000000 (MSR_LER_FROM_LIP)
 MSR 0x000001DE = 0x00000000:0x00000000 (MSR_LER_TO_LIP)
 MSR 0x000001F2 = 0x00000000:0xBF800006 (IA32_SMRR_PHYSBASE)
 MSR 0x000001F3 = 0x00000000:0xFF800800 (IA32_SMRR_PHYSMASK)
 MSR 0x000001F4 = 0x00000000:0x00000000 (MSR_PRMRR_PHYS_BASE)
 MSR 0x000001F5 = 0x00000000:0x00000000 (MSR_PRMRR_PHYS_MASK)
 MSR 0x000001FB = 0x00000000:0x000000E1 (MSR_PRMRR_VALID_CONFIG)
 MSR 0x000001FC = 0x00000000:0x002C005D (MSR_POWER_CTL)
 MSR 0x00000200 = 0x00000000:0xC0000000 (IA32_MTRR_PHYSBASE0)
 MSR 0x00000201 = 0x0000007F:0xC0000800 (IA32_MTRR_PHYSBASE0)
 MSR 0x00000202 = 0x00000000:0x00000000 (IA32_MTRR_PHYSBASE1)
 MSR 0x00000203 = 0x00000000:0x00000000 (IA32_MTRR_PHYSBASE1)
 MSR 0x00000204 = 0x00000000:0x00000000 (IA32_MTRR_PHYSBASE2)
 MSR 0x00000205 = 0x00000000:0x00000000 (IA32_MTRR_PHYSBASE2)
 MSR 0x00000206 = 0x00000000:0x00000000 (IA32_MTRR_PHYSBASE3)
 MSR 0x00000207 = 0x00000000:0x00000000 (IA32_MTRR_PHYSBASE3)
 MSR 0x00000208 = 0x00000000:0x00000000 (IA32_MTRR_PHYSBASE4)
 MSR 0x00000209 = 0x00000000:0x00000000 (IA32_MTRR_PHYSBASE4)
 MSR 0x0000020A = 0x00000000:0x00000000 (IA32_MTRR_PHYSBASE5)
 MSR 0x0000020B = 0x00000000:0x00000000 (IA32_MTRR_PHYSBASE5)
 MSR 0x0000020C = 0x00000000:0x00000000 (IA32_MTRR_PHYSBASE6)
 MSR 0x0000020D = 0x00000000:0x00000000 (IA32_MTRR_PHYSBASE6)
 MSR 0x0000020E = 0x00000000:0x00000000 (IA32_MTRR_PHYSBASE7)
 MSR 0x0000020F = 0x00000000:0x00000000 (IA32_MTRR_PHYSBASE7)
 MSR 0x00000210 = 0x00000000:0x00000000 (IA32_MTRR_PHYSBASE8)
 MSR 0x00000211 = 0x00000000:0x00000000 (IA32_MTRR_PHYSBASE8)
 MSR 0x00000212 = 0x00000000:0x00000000 (IA32_MTRR_PHYSBASE9)
 MSR 0x00000213 = 0x00000000:0x00000000 (IA32_MTRR_PHYSBASE9)
 MSR 0x00000250 = 0x06060606:0x06060606 (IA32_MTRR_FIX64K_00000)
 MSR 0x00000258 = 0x06060606:0x06060606 (IA32_MTRR_FIX16K_80000)
 MSR 0x00000259 = 0x00000000:0x00000000 (IA32_MTRR_FIX16K_A0000)
 MSR 0x00000268 = 0x05050505:0x05050505 (IA32_MTRR_FIX4K_C0000)
 MSR 0x00000269 = 0x05050505:0x05050505 (IA32_MTRR_FIX4K_C8000)
 MSR 0x0000026A = 0x05050505:0x05050505 (IA32_MTRR_FIX4K_D0000)
 MSR 0x0000026B = 0x05050505:0x05050505 (IA32_MTRR_FIX4K_D8000)
 MSR 0x0000026C = 0x05050505:0x05050505 (IA32_MTRR_FIX4K_E0000)
 MSR 0x0000026D = 0x05050505:0x05050505 (IA32_MTRR_FIX4K_E8000)
 MSR 0x0000026E = 0x05050505:0x05050505 (IA32_MTRR_FIX4K_F0000)
 MSR 0x0000026F = 0x05050505:0x05050505 (IA32_MTRR_FIX4K_F8000)
 MSR 0x00000277 = 0x04070506:0x00070106 (IA32_PAT)
 MSR 0x00000280 = 0x00000000:0x40000001 (IA32_MC0_CTL2)
 MSR 0x00000281 = 0x00000000:0x40000001 (IA32_MC1_CTL2)
 MSR 0x00000282 = 0x00000000:0x40000001 (IA32_MC2_CTL2)
 MSR 0x00000283 = 0x00000000:0x40000001 (IA32_MC3_CTL2)
 MSR 0x000002FF = 0x00000000:0x00000C06 (IA32_MTRR_DEF_TYPE)
 MSR 0x00000309 = 0x00000000:0x00000000 (IA32_FIXED_CTR0)
 MSR 0x0000030A = 0x0000FFFA:0xC20459D7 (IA32_FIXED_CTR1)
 MSR 0x0000030B = 0x00000000:0x00000000 (IA32_FIXED_CTR2)
 MSR 0x00000345 = 0x00000000:0x000033C5 (IA32_PERF_CAPABILITIES)
 MSR 0x0000038D = 0x00000000:0x000000B0 (IA32_FIXED_CTR_CTRL)
 MSR 0x0000038E = 0x00000000:0x00000000 (IA32_PERF_GLOBAL_STATUS)
 MSR 0x0000038F = 0x00000007:0x0000000F (IA32_PERF_GLOBAL_CTRL)
 MSR 0x00000390 = 0x00000000:0x00000000 (IA32_PERF_GLOBAL_STATUS_RESET)
 MSR 0x00000391 = 0x00000000:0x00000000 (IA32_PERF_GLOBAL_STATUS_SET)
 MSR 0x000003F1 = 0x00000000:0x00000000 (MSR_PEBS_ENABLE)
 MSR 0x000003F6 = 0x00000000:0x0000FFFF (MSR_PEBS_LD_LAT)
 MSR 0x000003F7 = 0x00000000:0x00000800 (MSR_PEBS_FRONTEND)
 MSR 0x000003FC = 0x00000000:0x7EC787C8 (MSR_CORE_C3_RESIDENCY)
 MSR 0x000003FD = 0x00000001:0xB2516160 (MSR_CORE_C6_RESIDENCY)
 MSR 0x000003FE = 0x00000023:0xB2076638 (MSR_CORE_C7_RESIDENCY)
 MSR 0x00000400 = 0x00000000:0x00000FFF (IA32_MC0_CTL)
 MSR 0x00000401 = 0x00000000:0x00000000 (IA32_MC0_STATUS)
 MSR 0x00000402 = 0x00000000:0x00000000 (IA32_MC0_ADDR)
 MSR 0x00000403 = 0x00000000:0x00000000 (IA32_MC0_MISC)
 MSR 0x00000404 = 0x00000000:0x0000000F (IA32_MC1_CTL)
 MSR 0x00000405 = 0x00000000:0x00000000 (IA32_MC1_STATUS)
 MSR 0x00000406 = 0x00000000:0x00000000 (IA32_MC1_ADDR)
 MSR 0x00000407 = 0x00000000:0x00000000 (IA32_MC1_MISC)
 MSR 0x00000408 = 0x00000000:0x0000000F (IA32_MC2_CTL)
 MSR 0x00000409 = 0x00000000:0x00000000 (IA32_MC2_STATUS)
 MSR 0x0000040A = 0x00000000:0x00000000 (IA32_MC2_ADDR)
 MSR 0x0000040C = 0x00000000:0x0000001F (IA32_MC3_CTL)
 MSR 0x0000040D = 0x00000000:0x00000000 (IA32_MC3_STATUS)
 MSR 0x0000040E = 0x00000000:0x00000000 (IA32_MC3_ADDR)
 MSR 0x00000410 = 0x00000000:0x0000003F (IA32_MC4_CTL)
 MSR 0x00000411 = 0x00000000:0x00000000 (IA32_MC4_STATUS)
 MSR 0x00000480 = 0x00DA0400:0x00000004 (IA32_VMX_BASIC)
 MSR 0x00000481 = 0x0000007F:0x00000016 (IA32_VMX_PINBASED_CTLS)
 MSR 0x00000482 = 0xFFF9FFFE:0x0401E172 (IA32_VMX_PROCBASED_CTLS)
 MSR 0x00000483 = 0x01FFFFFF:0x00036DFF (IA32_VMX_EXIT_CTLS)
 MSR 0x00000484 = 0x0003FFFF:0x000011FF (IA32_VMX_ENTRY_CTLS)
 MSR 0x00000485 = 0x00000000:0x7004C1E7 (IA32_VMX_MISC)
 MSR 0x00000486 = 0x00000000:0x80000021 (IA32_VMX_CR0_FIXED0)
 MSR 0x00000487 = 0x00000000:0xFFFFFFFF (IA32_VMX_CR0_FIXED1)
 MSR 0x00000488 = 0x00000000:0x00002000 (IA32_VMX_CR4_FIXED0)
 MSR 0x00000489 = 0x00000000:0x003767FF (IA32_VMX_CR4_FIXED1)
 MSR 0x0000048A = 0x00000000:0x0000002E (IA32_VMX_VMCS_ENUM)
 MSR 0x0000048B = 0x005FFCFF:0x00000000 (IA32_VMX_PROCBASED_CTLS2)
 MSR 0x0000048C = 0x00000F01:0x06734141 (IA32_VMX_EPT_VPID_ENUM)
 MSR 0x0000048D = 0x0000007F:0x00000016 (IA32_VMX_TRUE_PINBASED_CTLS)
 MSR 0x0000048E = 0xFFF9FFFE:0x04006172 (IA32_VMX_TRUE_PROCBASED_CTLS)
 MSR 0x0000048F = 0x01FFFFFF:0x00036DFB (IA32_VMX_TRUE_EXIT_CTLS)
 MSR 0x00000490 = 0x0003FFFF:0x000011FB (IA32_VMX_TRUE_ENTRY_CTLS)
 MSR 0x000004C1 = 0x00000000:0x00000000 (IA32_A_PMC0)
 MSR 0x000004C2 = 0x00000000:0x00000000 (IA32_A_PMC1)
 MSR 0x000004C3 = 0x00000000:0x00000000 (IA32_A_PMC2)
 MSR 0x000004C4 = 0x00000000:0x00000000 (IA32_A_PMC3)
 MSR 0x00000500 = 0x00000000:0x00020000 (IA32_SGX_SVN_STATUS)
 MSR 0x00000560 = 0x00000000:0x00000000 (IA32_RTIT_OUTPUT_BASE)
 MSR 0x00000561 = 0x00000000:0x0000007F (IA32_RTIT_OUTPUT_MASK_PTRS)
 MSR 0x00000570 = 0x00000000:0x00000000 (IA32_RTIT_CTL)
 MSR 0x00000571 = 0x00000000:0x00000000 (IA32_RTIT_STATUS)
 MSR 0x00000572 = 0x00000000:0x00000000 (IA32_RTIT_CR3_MATCH)
 MSR 0x00000580 = 0x00000000:0x00000000 (IA32_RTIT_ADDR0_A)
 MSR 0x00000581 = 0x00000000:0x00000000 (IA32_RTIT_ADDR0_B)
 MSR 0x00000582 = 0x00000000:0x00000000 (IA32_RTIT_ADDR1_A)
 MSR 0x00000583 = 0x00000000:0x00000000 (IA32_RTIT_ADDR1_B)
 MSR 0x00000600 = 0xFFFFFE00:0x00056000 (IA32_DS_AREA)
 MSR 0x0000064E = 0x00000005:0x90EB55AB (MSR_PPERF)
 MSR 0x00000653 = 0x00000000:0x00000000 (MSR_CORE_HDC_RESIDENCY)
 MSR 0x00000690 = 0x00000000:0x00000000 (MSR_LASTBRANCH_16_FROM_IP)
 MSR 0x00000691 = 0x00000000:0x00000000 (MSR_LASTBRANCH_17_FROM_IP)
 MSR 0x00000692 = 0x00000000:0x00000000 (MSR_LASTBRANCH_18_FROM_IP)
 MSR 0x00000693 = 0x00000000:0x00000000 (MSR_LASTBRANCH_19_FROM_IP)
 MSR 0x00000694 = 0x00000000:0x00000000 (MSR_LASTBRANCH_20_FROM_IP)
 MSR 0x00000695 = 0x00000000:0x00000000 (MSR_LASTBRANCH_21_FROM_IP)
 MSR 0x00000696 = 0x00000000:0x00000000 (MSR_LASTBRANCH_22_FROM_IP)
 MSR 0x00000697 = 0x00000000:0x00000000 (MSR_LASTBRANCH_23_FROM_IP)
 MSR 0x00000698 = 0x00000000:0x00000000 (MSR_LASTBRANCH_24_FROM_IP)
 MSR 0x00000699 = 0x00000000:0x00000000 (MSR_LASTBRANCH_25_FROM_IP)
 MSR 0x0000069A = 0x00000000:0x00000000 (MSR_LASTBRANCH_26_FROM_IP)
 MSR 0x0000069B = 0x00000000:0x00000000 (MSR_LASTBRANCH_27_FROM_IP)
 MSR 0x0000069C = 0x00000000:0x00000000 (MSR_LASTBRANCH_28_FROM_IP)
 MSR 0x0000069D = 0x00000000:0x00000000 (MSR_LASTBRANCH_29_FROM_IP)
 MSR 0x0000069E = 0x00000000:0x00000000 (MSR_LASTBRANCH_30_FROM_IP)
 MSR 0x0000069F = 0x00000000:0x00000000 (MSR_LASTBRANCH_31_FROM_IP)
 MSR 0x000006D0 = 0x00000000:0x00000000 (MSR_LASTBRANCH_16_TO_IP)
 MSR 0x000006D1 = 0x00000000:0x00000000 (MSR_LASTBRANCH_17_TO_IP)
 MSR 0x000006D2 = 0x00000000:0x00000000 (MSR_LASTBRANCH_18_TO_IP)
 MSR 0x000006D3 = 0x00000000:0x00000000 (MSR_LASTBRANCH_19_TO_IP)
 MSR 0x000006D4 = 0x00000000:0x00000000 (MSR_LASTBRANCH_20_TO_IP)
 MSR 0x000006D5 = 0x00000000:0x00000000 (MSR_LASTBRANCH_21_TO_IP)
 MSR 0x000006D6 = 0x00000000:0x00000000 (MSR_LASTBRANCH_22_TO_IP)
 MSR 0x000006D7 = 0x00000000:0x00000000 (MSR_LASTBRANCH_23_TO_IP)
 MSR 0x000006D8 = 0x00000000:0x00000000 (MSR_LASTBRANCH_24_TO_IP)
 MSR 0x000006D9 = 0x00000000:0x00000000 (MSR_LASTBRANCH_25_TO_IP)
 MSR 0x000006DA = 0x00000000:0x00000000 (MSR_LASTBRANCH_26_TO_IP)
 MSR 0x000006DB = 0x00000000:0x00000000 (MSR_LASTBRANCH_27_TO_IP)
 MSR 0x000006DC = 0x00000000:0x00000000 (MSR_LASTBRANCH_28_TO_IP)
 MSR 0x000006DD = 0x00000000:0x00000000 (MSR_LASTBRANCH_29_TO_IP)
 MSR 0x000006DE = 0x00000000:0x00000000 (MSR_LASTBRANCH_30_TO_IP)
 MSR 0x000006DF = 0x00000000:0x00000000 (MSR_LASTBRANCH_31_TO_IP)
 MSR 0x000006E0 = 0x00000039:0x4B8C09E4 (IA32_TSC_DEADLINE)
 MSR 0x00000771 = 0x00000000:0x010C1824 (IA32_HWP_CAPABILITIES)
 MSR 0x00000773 = 0x00000000:0x00000001 (IA32_HWP_INTERRUPT)
 MSR 0x00000774 = 0x00000000:0x00002408 (IA32_HWP_REQUEST)
 MSR 0x00000777 = 0x00000000:0x00000000 (IA32_HWP_STATUS)
 MSR 0x00000D90 = 0x00000000:0x00000000 (IA32_BNDCFGS)
 MSR 0x00000DA0 = 0x00000000:0x00000000 (IA32_XSS)
 MSR 0x00000DB1 = 0x00000000:0x00000001 (IA32_PM_CTL1)
 MSR 0x00000DB2 = 0x00000000:0x00000000 (IA32_THREAD_STALL)
 MSR 0x00000DC0 = 0x00000000:0x00000000 (IA32_LBR_INFO_0)
 MSR 0x00000DC1 = 0x00000000:0x00000000 (IA32_LBR_INFO_1)
 MSR 0x00000DC2 = 0x00000000:0x00000000 (IA32_LBR_INFO_2)
 MSR 0x00000DC3 = 0x00000000:0x00000000 (IA32_LBR_INFO_3)
 MSR 0x00000DC4 = 0x00000000:0x00000000 (IA32_LBR_INFO_4)
 MSR 0x00000DC5 = 0x00000000:0x00000000 (IA32_LBR_INFO_5)
 MSR 0x00000DC6 = 0x00000000:0x00000000 (IA32_LBR_INFO_6)
 MSR 0x00000DC7 = 0x00000000:0x00000000 (IA32_LBR_INFO_7)
 MSR 0x00000DC8 = 0x00000000:0x00000000 (IA32_LBR_INFO_8)
 MSR 0x00000DC9 = 0x00000000:0x00000000 (IA32_LBR_INFO_9)
 MSR 0x00000DCA = 0x00000000:0x00000000 (IA32_LBR_INFO_10)
 MSR 0x00000DCB = 0x00000000:0x00000000 (IA32_LBR_INFO_11)
 MSR 0x00000DCC = 0x00000000:0x00000000 (IA32_LBR_INFO_12)
 MSR 0x00000DCD = 0x00000000:0x00000000 (IA32_LBR_INFO_13)
 MSR 0x00000DCE = 0x00000000:0x00000000 (IA32_LBR_INFO_14)
 MSR 0x00000DCF = 0x00000000:0x00000000 (IA32_LBR_INFO_15)
 MSR 0x00000DD0 = 0x00000000:0x00000000 (IA32_LBR_INFO_16)
 MSR 0x00000DD1 = 0x00000000:0x00000000 (IA32_LBR_INFO_17)
 MSR 0x00000DD2 = 0x00000000:0x00000000 (IA32_LBR_INFO_18)
 MSR 0x00000DD3 = 0x00000000:0x00000000 (IA32_LBR_INFO_19)
 MSR 0x00000DD4 = 0x00000000:0x00000000 (IA32_LBR_INFO_20)
 MSR 0x00000DD5 = 0x00000000:0x00000000 (IA32_LBR_INFO_21)
 MSR 0x00000DD6 = 0x00000000:0x00000000 (IA32_LBR_INFO_22)
 MSR 0x00000DD7 = 0x00000000:0x00000000 (IA32_LBR_INFO_23)
 MSR 0x00000DD8 = 0x00000000:0x00000000 (IA32_LBR_INFO_24)
 MSR 0x00000DD9 = 0x00000000:0x00000000 (IA32_LBR_INFO_25)
 MSR 0x00000DDA = 0x00000000:0x00000000 (IA32_LBR_INFO_26)
 MSR 0x00000DDB = 0x00000000:0x00000000 (IA32_LBR_INFO_27)
 MSR 0x00000DDC = 0x00000000:0x00000000 (IA32_LBR_INFO_28)
 MSR 0x00000DDD = 0x00000000:0x00000000 (IA32_LBR_INFO_29)
 MSR 0x00000DDE = 0x00000000:0x00000000 (IA32_LBR_INFO_30)
 MSR 0x00000DDF = 0x00000000:0x00000000 (IA32_LBR_INFO_31)

====================== UNIQUE MSRs  (core 2) ======================
 MSR 0x00000000 = 0x00000000:0x00000FFF (IA32_P5_MC_ADDR)
 MSR 0x00000001 = 0x00000000:0x00000000 (IA32_P5_MC_TYPE)
 MSR 0x00000006 = 0x00000000:0x00000040 (IA32_MONITOR_FILTER_SIZE)
 MSR 0x00000010 = 0x00000039:0x4B0A7268 (IA32_TIME_STAMP_COUNTER)
 MSR 0x0000001B = 0x00000000:0xFEE00C00 (IA32_APIC_BASE)
 MSR 0x00000034 = 0x00000000:0x000001DD (MSR_SMI_COUNT)
 MSR 0x0000003A = 0x00000000:0x00000005 (IA32_FEATURE_CONTROL)
 MSR 0x0000008B = 0x000000F4:0x00000000 (IA32_BIOS_SIGN_ID)
 MSR 0x000000C1 = 0x00000000:0x00000000 (IA32_PMC0)
 MSR 0x000000C2 = 0x00000000:0x00000000 (IA32_PMC1)
 MSR 0x000000C3 = 0x00000000:0x00000000 (IA32_PMC2)
 MSR 0x000000C4 = 0x00000000:0x00000000 (IA32_PMC3)
 MSR 0x000000E2 = 0x00000000:0x1E008008 (MSR_PKG_CST_CONFIG_CONTROL)
 MSR 0x000000E4 = 0x00000000:0x00051814 (MSR_PMG_IO_CAPTURE_BASE)
 MSR 0x000000E7 = 0x00000003:0x4DA9153E (IA32_MPERF)
 MSR 0x000000E8 = 0x00000004:0xA74E4B84 (IA32_APERF)
 MSR 0x000000FE = 0x00000000:0x00001D0A (IA32_MTRRCAP)
 MSR 0x0000013C = 0x00000000:0x00000001 (MSR_FEATURE_CONFIG)
 MSR 0x00000174 = 0x00000000:0x00000010 (IA32_SYSENTER_CS)
 MSR 0x00000175 = 0xFFFFFE00:0x00079000 (IA32_SYSENTER_ESP)
 MSR 0x00000176 = 0xFFFFFFFF:0x8D6018A0 (IA32_SYSENTER_EIP)
 MSR 0x00000179 = 0x00000000:0x00000C0C (IA32_MCG_CAP)
 MSR 0x0000017A = 0x00000000:0x00000000 (IA32_MCG_STATUS)
 MSR 0x00000186 = 0x00000000:0x00000000 (IA32_PERFEVTSEL0)
 MSR 0x00000187 = 0x00000000:0x00000000 (IA32_PERFEVTSEL1)
 MSR 0x00000188 = 0x00000000:0x00000000 (IA32_PERFEVTSEL2)
 MSR 0x00000189 = 0x00000000:0x00000000 (IA32_PERFEVTSEL3)
 MSR 0x00000199 = 0x00000000:0x00000800 (IA32_PERF_CTL)
 MSR 0x0000019A = 0x00000000:0x00000000 (IA32_CLOCK_MODULATION)
 MSR 0x0000019B = 0x00000000:0x00000013 (IA32_THERM_INTERRUPT)
 MSR 0x0000019C = 0x00000000:0x88410800 (IA32_THERM_STATUS)
 MSR 0x000001A0 = 0x00000000:0x00850089 (IA32_MISC_ENABLE)
 MSR 0x000001A4 = 0x00000000:0x00000000 (IA32_MISC_FEATURE_CONTROL)
 MSR 0x000001A6 = 0x00000000:0x00000000 (MSR_OFFCORE_RSP_0)
 MSR 0x000001A7 = 0x00000000:0x00000000 (MSR_OFFCORE_RSP_1)
 MSR 0x000001C8 = 0x00000000:0x00000000 (MSR_LBR_SELECT)
 MSR 0x000001C9 = 0x00000000:0x00000000 (MSR_LASTBRANCH_TOS)
 MSR 0x000001D9 = 0x00000000:0x00004000 (IA32_DEBUGCTL)
 MSR 0x000001DD = 0x00000000:0x00000000 (MSR_LER_FROM_LIP)
 MSR 0x000001DE = 0x00000000:0x00000000 (MSR_LER_TO_LIP)
 MSR 0x000001F2 = 0x00000000:0xBF800006 (IA32_SMRR_PHYSBASE)
 MSR 0x000001F3 = 0x00000000:0xFF800800 (IA32_SMRR_PHYSMASK)
 MSR 0x000001F4 = 0x00000000:0x00000000 (MSR_PRMRR_PHYS_BASE)
 MSR 0x000001F5 = 0x00000000:0x00000000 (MSR_PRMRR_PHYS_MASK)
 MSR 0x000001FB = 0x00000000:0x000000E1 (MSR_PRMRR_VALID_CONFIG)
 MSR 0x000001FC = 0x00000000:0x002C005D (MSR_POWER_CTL)
 MSR 0x00000200 = 0x00000000:0xC0000000 (IA32_MTRR_PHYSBASE0)
 MSR 0x00000201 = 0x0000007F:0xC0000800 (IA32_MTRR_PHYSBASE0)
 MSR 0x00000202 = 0x00000000:0x00000000 (IA32_MTRR_PHYSBASE1)
 MSR 0x00000203 = 0x00000000:0x00000000 (IA32_MTRR_PHYSBASE1)
 MSR 0x00000204 = 0x00000000:0x00000000 (IA32_MTRR_PHYSBASE2)
 MSR 0x00000205 = 0x00000000:0x00000000 (IA32_MTRR_PHYSBASE2)
 MSR 0x00000206 = 0x00000000:0x00000000 (IA32_MTRR_PHYSBASE3)
 MSR 0x00000207 = 0x00000000:0x00000000 (IA32_MTRR_PHYSBASE3)
 MSR 0x00000208 = 0x00000000:0x00000000 (IA32_MTRR_PHYSBASE4)
 MSR 0x00000209 = 0x00000000:0x00000000 (IA32_MTRR_PHYSBASE4)
 MSR 0x0000020A = 0x00000000:0x00000000 (IA32_MTRR_PHYSBASE5)
 MSR 0x0000020B = 0x00000000:0x00000000 (IA32_MTRR_PHYSBASE5)
 MSR 0x0000020C = 0x00000000:0x00000000 (IA32_MTRR_PHYSBASE6)
 MSR 0x0000020D = 0x00000000:0x00000000 (IA32_MTRR_PHYSBASE6)
 MSR 0x0000020E = 0x00000000:0x00000000 (IA32_MTRR_PHYSBASE7)
 MSR 0x0000020F = 0x00000000:0x00000000 (IA32_MTRR_PHYSBASE7)
 MSR 0x00000210 = 0x00000000:0x00000000 (IA32_MTRR_PHYSBASE8)
 MSR 0x00000211 = 0x00000000:0x00000000 (IA32_MTRR_PHYSBASE8)
 MSR 0x00000212 = 0x00000000:0x00000000 (IA32_MTRR_PHYSBASE9)
 MSR 0x00000213 = 0x00000000:0x00000000 (IA32_MTRR_PHYSBASE9)
 MSR 0x00000250 = 0x06060606:0x06060606 (IA32_MTRR_FIX64K_00000)
 MSR 0x00000258 = 0x06060606:0x06060606 (IA32_MTRR_FIX16K_80000)
 MSR 0x00000259 = 0x00000000:0x00000000 (IA32_MTRR_FIX16K_A0000)
 MSR 0x00000268 = 0x05050505:0x05050505 (IA32_MTRR_FIX4K_C0000)
 MSR 0x00000269 = 0x05050505:0x05050505 (IA32_MTRR_FIX4K_C8000)
 MSR 0x0000026A = 0x05050505:0x05050505 (IA32_MTRR_FIX4K_D0000)
 MSR 0x0000026B = 0x05050505:0x05050505 (IA32_MTRR_FIX4K_D8000)
 MSR 0x0000026C = 0x05050505:0x05050505 (IA32_MTRR_FIX4K_E0000)
 MSR 0x0000026D = 0x05050505:0x05050505 (IA32_MTRR_FIX4K_E8000)
 MSR 0x0000026E = 0x05050505:0x05050505 (IA32_MTRR_FIX4K_F0000)
 MSR 0x0000026F = 0x05050505:0x05050505 (IA32_MTRR_FIX4K_F8000)
 MSR 0x00000277 = 0x04070506:0x00070106 (IA32_PAT)
 MSR 0x00000280 = 0x00000000:0x40000001 (IA32_MC0_CTL2)
 MSR 0x00000281 = 0x00000000:0x40000001 (IA32_MC1_CTL2)
 MSR 0x00000282 = 0x00000000:0x40000001 (IA32_MC2_CTL2)
 MSR 0x00000283 = 0x00000000:0x40000001 (IA32_MC3_CTL2)
 MSR 0x000002FF = 0x00000000:0x00000C06 (IA32_MTRR_DEF_TYPE)
 MSR 0x00000309 = 0x00000000:0x00000000 (IA32_FIXED_CTR0)
 MSR 0x0000030A = 0x0000FFFF:0x02F3ABD8 (IA32_FIXED_CTR1)
 MSR 0x0000030B = 0x00000000:0x00000000 (IA32_FIXED_CTR2)
 MSR 0x00000345 = 0x00000000:0x000033C5 (IA32_PERF_CAPABILITIES)
 MSR 0x0000038D = 0x00000000:0x000000B0 (IA32_FIXED_CTR_CTRL)
 MSR 0x0000038E = 0x00000000:0x00000000 (IA32_PERF_GLOBAL_STATUS)
 MSR 0x0000038F = 0x00000007:0x0000000F (IA32_PERF_GLOBAL_CTRL)
 MSR 0x00000390 = 0x00000000:0x00000000 (IA32_PERF_GLOBAL_STATUS_RESET)
 MSR 0x00000391 = 0x00000000:0x00000000 (IA32_PERF_GLOBAL_STATUS_SET)
 MSR 0x000003F1 = 0x00000000:0x00000000 (MSR_PEBS_ENABLE)
 MSR 0x000003F6 = 0x00000000:0x0000FFFF (MSR_PEBS_LD_LAT)
 MSR 0x000003F7 = 0x00000000:0x00000800 (MSR_PEBS_FRONTEND)
 MSR 0x000003FC = 0x00000000:0x38E818F0 (MSR_CORE_C3_RESIDENCY)
 MSR 0x000003FD = 0x00000000:0xDD104368 (MSR_CORE_C6_RESIDENCY)
 MSR 0x000003FE = 0x00000026:0x78EB6C90 (MSR_CORE_C7_RESIDENCY)
 MSR 0x00000400 = 0x00000000:0x00000FFF (IA32_MC0_CTL)
 MSR 0x00000401 = 0x00000000:0x00000000 (IA32_MC0_STATUS)
 MSR 0x00000402 = 0x00000000:0x00000000 (IA32_MC0_ADDR)
 MSR 0x00000403 = 0x00000000:0x00000000 (IA32_MC0_MISC)
 MSR 0x00000404 = 0x00000000:0x0000000F (IA32_MC1_CTL)
 MSR 0x00000405 = 0x00000000:0x00000000 (IA32_MC1_STATUS)
 MSR 0x00000406 = 0x00000000:0x00000000 (IA32_MC1_ADDR)
 MSR 0x00000407 = 0x00000000:0x00000000 (IA32_MC1_MISC)
 MSR 0x00000408 = 0x00000000:0x0000000F (IA32_MC2_CTL)
 MSR 0x00000409 = 0x00000000:0x00000000 (IA32_MC2_STATUS)
 MSR 0x0000040A = 0x00000000:0x00000000 (IA32_MC2_ADDR)
 MSR 0x0000040C = 0x00000000:0x0000001F (IA32_MC3_CTL)
 MSR 0x0000040D = 0x00000000:0x00000000 (IA32_MC3_STATUS)
 MSR 0x0000040E = 0x00000000:0x00000000 (IA32_MC3_ADDR)
 MSR 0x00000410 = 0x00000000:0x0000003F (IA32_MC4_CTL)
 MSR 0x00000411 = 0x00000000:0x00000000 (IA32_MC4_STATUS)
 MSR 0x00000480 = 0x00DA0400:0x00000004 (IA32_VMX_BASIC)
 MSR 0x00000481 = 0x0000007F:0x00000016 (IA32_VMX_PINBASED_CTLS)
 MSR 0x00000482 = 0xFFF9FFFE:0x0401E172 (IA32_VMX_PROCBASED_CTLS)
 MSR 0x00000483 = 0x01FFFFFF:0x00036DFF (IA32_VMX_EXIT_CTLS)
 MSR 0x00000484 = 0x0003FFFF:0x000011FF (IA32_VMX_ENTRY_CTLS)
 MSR 0x00000485 = 0x00000000:0x7004C1E7 (IA32_VMX_MISC)
 MSR 0x00000486 = 0x00000000:0x80000021 (IA32_VMX_CR0_FIXED0)
 MSR 0x00000487 = 0x00000000:0xFFFFFFFF (IA32_VMX_CR0_FIXED1)
 MSR 0x00000488 = 0x00000000:0x00002000 (IA32_VMX_CR4_FIXED0)
 MSR 0x00000489 = 0x00000000:0x003767FF (IA32_VMX_CR4_FIXED1)
 MSR 0x0000048A = 0x00000000:0x0000002E (IA32_VMX_VMCS_ENUM)
 MSR 0x0000048B = 0x005FFCFF:0x00000000 (IA32_VMX_PROCBASED_CTLS2)
 MSR 0x0000048C = 0x00000F01:0x06734141 (IA32_VMX_EPT_VPID_ENUM)
 MSR 0x0000048D = 0x0000007F:0x00000016 (IA32_VMX_TRUE_PINBASED_CTLS)
 MSR 0x0000048E = 0xFFF9FFFE:0x04006172 (IA32_VMX_TRUE_PROCBASED_CTLS)
 MSR 0x0000048F = 0x01FFFFFF:0x00036DFB (IA32_VMX_TRUE_EXIT_CTLS)
 MSR 0x00000490 = 0x0003FFFF:0x000011FB (IA32_VMX_TRUE_ENTRY_CTLS)
 MSR 0x000004C1 = 0x00000000:0x00000000 (IA32_A_PMC0)
 MSR 0x000004C2 = 0x00000000:0x00000000 (IA32_A_PMC1)
 MSR 0x000004C3 = 0x00000000:0x00000000 (IA32_A_PMC2)
 MSR 0x000004C4 = 0x00000000:0x00000000 (IA32_A_PMC3)
 MSR 0x00000500 = 0x00000000:0x00020000 (IA32_SGX_SVN_STATUS)
 MSR 0x00000560 = 0x00000000:0x00000000 (IA32_RTIT_OUTPUT_BASE)
 MSR 0x00000561 = 0x00000000:0x0000007F (IA32_RTIT_OUTPUT_MASK_PTRS)
 MSR 0x00000570 = 0x00000000:0x00000000 (IA32_RTIT_CTL)
 MSR 0x00000571 = 0x00000000:0x00000000 (IA32_RTIT_STATUS)
 MSR 0x00000572 = 0x00000000:0x00000000 (IA32_RTIT_CR3_MATCH)
 MSR 0x00000580 = 0x00000000:0x00000000 (IA32_RTIT_ADDR0_A)
 MSR 0x00000581 = 0x00000000:0x00000000 (IA32_RTIT_ADDR0_B)
 MSR 0x00000582 = 0x00000000:0x00000000 (IA32_RTIT_ADDR1_A)
 MSR 0x00000583 = 0x00000000:0x00000000 (IA32_RTIT_ADDR1_B)
 MSR 0x00000600 = 0xFFFFFE00:0x00091000 (IA32_DS_AREA)
 MSR 0x0000064E = 0x00000004:0x1648D978 (MSR_PPERF)
 MSR 0x00000653 = 0x00000000:0x00000000 (MSR_CORE_HDC_RESIDENCY)
 MSR 0x00000690 = 0x00000000:0x00000000 (MSR_LASTBRANCH_16_FROM_IP)
 MSR 0x00000691 = 0x00000000:0x00000000 (MSR_LASTBRANCH_17_FROM_IP)
 MSR 0x00000692 = 0x00000000:0x00000000 (MSR_LASTBRANCH_18_FROM_IP)
 MSR 0x00000693 = 0x00000000:0x00000000 (MSR_LASTBRANCH_19_FROM_IP)
 MSR 0x00000694 = 0x00000000:0x00000000 (MSR_LASTBRANCH_20_FROM_IP)
 MSR 0x00000695 = 0x00000000:0x00000000 (MSR_LASTBRANCH_21_FROM_IP)
 MSR 0x00000696 = 0x00000000:0x00000000 (MSR_LASTBRANCH_22_FROM_IP)
 MSR 0x00000697 = 0x00000000:0x00000000 (MSR_LASTBRANCH_23_FROM_IP)
 MSR 0x00000698 = 0x00000000:0x00000000 (MSR_LASTBRANCH_24_FROM_IP)
 MSR 0x00000699 = 0x00000000:0x00000000 (MSR_LASTBRANCH_25_FROM_IP)
 MSR 0x0000069A = 0x00000000:0x00000000 (MSR_LASTBRANCH_26_FROM_IP)
 MSR 0x0000069B = 0x00000000:0x00000000 (MSR_LASTBRANCH_27_FROM_IP)
 MSR 0x0000069C = 0x00000000:0x00000000 (MSR_LASTBRANCH_28_FROM_IP)
 MSR 0x0000069D = 0x00000000:0x00000000 (MSR_LASTBRANCH_29_FROM_IP)
 MSR 0x0000069E = 0x00000000:0x00000000 (MSR_LASTBRANCH_30_FROM_IP)
 MSR 0x0000069F = 0x00000000:0x00000000 (MSR_LASTBRANCH_31_FROM_IP)
 MSR 0x000006D0 = 0x00000000:0x00000000 (MSR_LASTBRANCH_16_TO_IP)
 MSR 0x000006D1 = 0x00000000:0x00000000 (MSR_LASTBRANCH_17_TO_IP)
 MSR 0x000006D2 = 0x00000000:0x00000000 (MSR_LASTBRANCH_18_TO_IP)
 MSR 0x000006D3 = 0x00000000:0x00000000 (MSR_LASTBRANCH_19_TO_IP)
 MSR 0x000006D4 = 0x00000000:0x00000000 (MSR_LASTBRANCH_20_TO_IP)
 MSR 0x000006D5 = 0x00000000:0x00000000 (MSR_LASTBRANCH_21_TO_IP)
 MSR 0x000006D6 = 0x00000000:0x00000000 (MSR_LASTBRANCH_22_TO_IP)
 MSR 0x000006D7 = 0x00000000:0x00000000 (MSR_LASTBRANCH_23_TO_IP)
 MSR 0x000006D8 = 0x00000000:0x00000000 (MSR_LASTBRANCH_24_TO_IP)
 MSR 0x000006D9 = 0x00000000:0x00000000 (MSR_LASTBRANCH_25_TO_IP)
 MSR 0x000006DA = 0x00000000:0x00000000 (MSR_LASTBRANCH_26_TO_IP)
 MSR 0x000006DB = 0x00000000:0x00000000 (MSR_LASTBRANCH_27_TO_IP)
 MSR 0x000006DC = 0x00000000:0x00000000 (MSR_LASTBRANCH_28_TO_IP)
 MSR 0x000006DD = 0x00000000:0x00000000 (MSR_LASTBRANCH_29_TO_IP)
 MSR 0x000006DE = 0x00000000:0x00000000 (MSR_LASTBRANCH_30_TO_IP)
 MSR 0x000006DF = 0x00000000:0x00000000 (MSR_LASTBRANCH_31_TO_IP)
 MSR 0x000006E0 = 0x00000039:0x4B8C07FE (IA32_TSC_DEADLINE)
 MSR 0x00000771 = 0x00000000:0x010C1824 (IA32_HWP_CAPABILITIES)
 MSR 0x00000773 = 0x00000000:0x00000001 (IA32_HWP_INTERRUPT)
 MSR 0x00000774 = 0x00000000:0x00002408 (IA32_HWP_REQUEST)
 MSR 0x00000777 = 0x00000000:0x00000000 (IA32_HWP_STATUS)
 MSR 0x00000D90 = 0x00000000:0x00000000 (IA32_BNDCFGS)
 MSR 0x00000DA0 = 0x00000000:0x00000000 (IA32_XSS)
 MSR 0x00000DB1 = 0x00000000:0x00000001 (IA32_PM_CTL1)
 MSR 0x00000DB2 = 0x00000000:0x00000000 (IA32_THREAD_STALL)
 MSR 0x00000DC0 = 0x00000000:0x00000000 (IA32_LBR_INFO_0)
 MSR 0x00000DC1 = 0x00000000:0x00000000 (IA32_LBR_INFO_1)
 MSR 0x00000DC2 = 0x00000000:0x00000000 (IA32_LBR_INFO_2)
 MSR 0x00000DC3 = 0x00000000:0x00000000 (IA32_LBR_INFO_3)
 MSR 0x00000DC4 = 0x00000000:0x00000000 (IA32_LBR_INFO_4)
 MSR 0x00000DC5 = 0x00000000:0x00000000 (IA32_LBR_INFO_5)
 MSR 0x00000DC6 = 0x00000000:0x00000000 (IA32_LBR_INFO_6)
 MSR 0x00000DC7 = 0x00000000:0x00000000 (IA32_LBR_INFO_7)
 MSR 0x00000DC8 = 0x00000000:0x00000000 (IA32_LBR_INFO_8)
 MSR 0x00000DC9 = 0x00000000:0x00000000 (IA32_LBR_INFO_9)
 MSR 0x00000DCA = 0x00000000:0x00000000 (IA32_LBR_INFO_10)
 MSR 0x00000DCB = 0x00000000:0x00000000 (IA32_LBR_INFO_11)
 MSR 0x00000DCC = 0x00000000:0x00000000 (IA32_LBR_INFO_12)
 MSR 0x00000DCD = 0x00000000:0x00000000 (IA32_LBR_INFO_13)
 MSR 0x00000DCE = 0x00000000:0x00000000 (IA32_LBR_INFO_14)
 MSR 0x00000DCF = 0x00000000:0x00000000 (IA32_LBR_INFO_15)
 MSR 0x00000DD0 = 0x00000000:0x00000000 (IA32_LBR_INFO_16)
 MSR 0x00000DD1 = 0x00000000:0x00000000 (IA32_LBR_INFO_17)
 MSR 0x00000DD2 = 0x00000000:0x00000000 (IA32_LBR_INFO_18)
 MSR 0x00000DD3 = 0x00000000:0x00000000 (IA32_LBR_INFO_19)
 MSR 0x00000DD4 = 0x00000000:0x00000000 (IA32_LBR_INFO_20)
 MSR 0x00000DD5 = 0x00000000:0x00000000 (IA32_LBR_INFO_21)
 MSR 0x00000DD6 = 0x00000000:0x00000000 (IA32_LBR_INFO_22)
 MSR 0x00000DD7 = 0x00000000:0x00000000 (IA32_LBR_INFO_23)
 MSR 0x00000DD8 = 0x00000000:0x00000000 (IA32_LBR_INFO_24)
 MSR 0x00000DD9 = 0x00000000:0x00000000 (IA32_LBR_INFO_25)
 MSR 0x00000DDA = 0x00000000:0x00000000 (IA32_LBR_INFO_26)
 MSR 0x00000DDB = 0x00000000:0x00000000 (IA32_LBR_INFO_27)
 MSR 0x00000DDC = 0x00000000:0x00000000 (IA32_LBR_INFO_28)
 MSR 0x00000DDD = 0x00000000:0x00000000 (IA32_LBR_INFO_29)
 MSR 0x00000DDE = 0x00000000:0x00000000 (IA32_LBR_INFO_30)
 MSR 0x00000DDF = 0x00000000:0x00000000 (IA32_LBR_INFO_31)

====================== UNIQUE MSRs  (core 3) ======================
 MSR 0x00000000 = 0x00000000:0x00000FFF (IA32_P5_MC_ADDR)
 MSR 0x00000001 = 0x00000000:0x00000000 (IA32_P5_MC_TYPE)
 MSR 0x00000006 = 0x00000000:0x00000040 (IA32_MONITOR_FILTER_SIZE)
 MSR 0x00000010 = 0x00000039:0x4B343BC6 (IA32_TIME_STAMP_COUNTER)
 MSR 0x0000001B = 0x00000000:0xFEE00C00 (IA32_APIC_BASE)
 MSR 0x00000034 = 0x00000000:0x000001DD (MSR_SMI_COUNT)
 MSR 0x0000003A = 0x00000000:0x00000005 (IA32_FEATURE_CONTROL)
 MSR 0x0000008B = 0x000000F4:0x00000000 (IA32_BIOS_SIGN_ID)
 MSR 0x000000C1 = 0x00000000:0x00000000 (IA32_PMC0)
 MSR 0x000000C2 = 0x00000000:0x00000000 (IA32_PMC1)
 MSR 0x000000C3 = 0x00000000:0x00000000 (IA32_PMC2)
 MSR 0x000000C4 = 0x00000000:0x00000000 (IA32_PMC3)
 MSR 0x000000E2 = 0x00000000:0x1E008008 (MSR_PKG_CST_CONFIG_CONTROL)
 MSR 0x000000E4 = 0x00000000:0x00051814 (MSR_PMG_IO_CAPTURE_BASE)
 MSR 0x000000E7 = 0x00000002:0x9FFAF032 (IA32_MPERF)
 MSR 0x000000E8 = 0x00000003:0xB1C4F5B2 (IA32_APERF)
 MSR 0x000000FE = 0x00000000:0x00001D0A (IA32_MTRRCAP)
 MSR 0x0000013C = 0x00000000:0x00000001 (MSR_FEATURE_CONFIG)
 MSR 0x00000174 = 0x00000000:0x00000010 (IA32_SYSENTER_CS)
 MSR 0x00000175 = 0xFFFFFE00:0x000B4000 (IA32_SYSENTER_ESP)
 MSR 0x00000176 = 0xFFFFFFFF:0x8D6018A0 (IA32_SYSENTER_EIP)
 MSR 0x00000179 = 0x00000000:0x00000C0C (IA32_MCG_CAP)
 MSR 0x0000017A = 0x00000000:0x00000000 (IA32_MCG_STATUS)
 MSR 0x00000186 = 0x00000000:0x00000000 (IA32_PERFEVTSEL0)
 MSR 0x00000187 = 0x00000000:0x00000000 (IA32_PERFEVTSEL1)
 MSR 0x00000188 = 0x00000000:0x00000000 (IA32_PERFEVTSEL2)
 MSR 0x00000189 = 0x00000000:0x00000000 (IA32_PERFEVTSEL3)
 MSR 0x00000199 = 0x00000000:0x00000800 (IA32_PERF_CTL)
 MSR 0x0000019A = 0x00000000:0x00000000 (IA32_CLOCK_MODULATION)
 MSR 0x0000019B = 0x00000000:0x00000013 (IA32_THERM_INTERRUPT)
 MSR 0x0000019C = 0x00000000:0x88430800 (IA32_THERM_STATUS)
 MSR 0x000001A0 = 0x00000000:0x00850089 (IA32_MISC_ENABLE)
 MSR 0x000001A4 = 0x00000000:0x00000000 (IA32_MISC_FEATURE_CONTROL)
 MSR 0x000001A6 = 0x00000000:0x00000000 (MSR_OFFCORE_RSP_0)
 MSR 0x000001A7 = 0x00000000:0x00000000 (MSR_OFFCORE_RSP_1)
 MSR 0x000001C8 = 0x00000000:0x00000000 (MSR_LBR_SELECT)
 MSR 0x000001C9 = 0x00000000:0x00000000 (MSR_LASTBRANCH_TOS)
 MSR 0x000001D9 = 0x00000000:0x00004000 (IA32_DEBUGCTL)
 MSR 0x000001DD = 0x00000000:0x00000000 (MSR_LER_FROM_LIP)
 MSR 0x000001DE = 0x00000000:0x00000000 (MSR_LER_TO_LIP)
 MSR 0x000001F2 = 0x00000000:0xBF800006 (IA32_SMRR_PHYSBASE)
 MSR 0x000001F3 = 0x00000000:0xFF800800 (IA32_SMRR_PHYSMASK)
 MSR 0x000001F4 = 0x00000000:0x00000000 (MSR_PRMRR_PHYS_BASE)
 MSR 0x000001F5 = 0x00000000:0x00000000 (MSR_PRMRR_PHYS_MASK)
 MSR 0x000001FB = 0x00000000:0x000000E1 (MSR_PRMRR_VALID_CONFIG)
 MSR 0x000001FC = 0x00000000:0x002C005D (MSR_POWER_CTL)
 MSR 0x00000200 = 0x00000000:0xC0000000 (IA32_MTRR_PHYSBASE0)
 MSR 0x00000201 = 0x0000007F:0xC0000800 (IA32_MTRR_PHYSBASE0)
 MSR 0x00000202 = 0x00000000:0x00000000 (IA32_MTRR_PHYSBASE1)
 MSR 0x00000203 = 0x00000000:0x00000000 (IA32_MTRR_PHYSBASE1)
 MSR 0x00000204 = 0x00000000:0x00000000 (IA32_MTRR_PHYSBASE2)
 MSR 0x00000205 = 0x00000000:0x00000000 (IA32_MTRR_PHYSBASE2)
 MSR 0x00000206 = 0x00000000:0x00000000 (IA32_MTRR_PHYSBASE3)
 MSR 0x00000207 = 0x00000000:0x00000000 (IA32_MTRR_PHYSBASE3)
 MSR 0x00000208 = 0x00000000:0x00000000 (IA32_MTRR_PHYSBASE4)
 MSR 0x00000209 = 0x00000000:0x00000000 (IA32_MTRR_PHYSBASE4)
 MSR 0x0000020A = 0x00000000:0x00000000 (IA32_MTRR_PHYSBASE5)
 MSR 0x0000020B = 0x00000000:0x00000000 (IA32_MTRR_PHYSBASE5)
 MSR 0x0000020C = 0x00000000:0x00000000 (IA32_MTRR_PHYSBASE6)
 MSR 0x0000020D = 0x00000000:0x00000000 (IA32_MTRR_PHYSBASE6)
 MSR 0x0000020E = 0x00000000:0x00000000 (IA32_MTRR_PHYSBASE7)
 MSR 0x0000020F = 0x00000000:0x00000000 (IA32_MTRR_PHYSBASE7)
 MSR 0x00000210 = 0x00000000:0x00000000 (IA32_MTRR_PHYSBASE8)
 MSR 0x00000211 = 0x00000000:0x00000000 (IA32_MTRR_PHYSBASE8)
 MSR 0x00000212 = 0x00000000:0x00000000 (IA32_MTRR_PHYSBASE9)
 MSR 0x00000213 = 0x00000000:0x00000000 (IA32_MTRR_PHYSBASE9)
 MSR 0x00000250 = 0x06060606:0x06060606 (IA32_MTRR_FIX64K_00000)
 MSR 0x00000258 = 0x06060606:0x06060606 (IA32_MTRR_FIX16K_80000)
 MSR 0x00000259 = 0x00000000:0x00000000 (IA32_MTRR_FIX16K_A0000)
 MSR 0x00000268 = 0x05050505:0x05050505 (IA32_MTRR_FIX4K_C0000)
 MSR 0x00000269 = 0x05050505:0x05050505 (IA32_MTRR_FIX4K_C8000)
 MSR 0x0000026A = 0x05050505:0x05050505 (IA32_MTRR_FIX4K_D0000)
 MSR 0x0000026B = 0x05050505:0x05050505 (IA32_MTRR_FIX4K_D8000)
 MSR 0x0000026C = 0x05050505:0x05050505 (IA32_MTRR_FIX4K_E0000)
 MSR 0x0000026D = 0x05050505:0x05050505 (IA32_MTRR_FIX4K_E8000)
 MSR 0x0000026E = 0x05050505:0x05050505 (IA32_MTRR_FIX4K_F0000)
 MSR 0x0000026F = 0x05050505:0x05050505 (IA32_MTRR_FIX4K_F8000)
 MSR 0x00000277 = 0x04070506:0x00070106 (IA32_PAT)
 MSR 0x00000280 = 0x00000000:0x40000001 (IA32_MC0_CTL2)
 MSR 0x00000281 = 0x00000000:0x40000001 (IA32_MC1_CTL2)
 MSR 0x00000282 = 0x00000000:0x40000001 (IA32_MC2_CTL2)
 MSR 0x00000283 = 0x00000000:0x40000001 (IA32_MC3_CTL2)
 MSR 0x000002FF = 0x00000000:0x00000C06 (IA32_MTRR_DEF_TYPE)
 MSR 0x00000309 = 0x00000000:0x00000000 (IA32_FIXED_CTR0)
 MSR 0x0000030A = 0x0000FFFE:0x0D2808AB (IA32_FIXED_CTR1)
 MSR 0x0000030B = 0x00000000:0x00000000 (IA32_FIXED_CTR2)
 MSR 0x00000345 = 0x00000000:0x000033C5 (IA32_PERF_CAPABILITIES)
 MSR 0x0000038D = 0x00000000:0x000000B0 (IA32_FIXED_CTR_CTRL)
 MSR 0x0000038E = 0x00000000:0x00000000 (IA32_PERF_GLOBAL_STATUS)
 MSR 0x0000038F = 0x00000007:0x0000000F (IA32_PERF_GLOBAL_CTRL)
 MSR 0x00000390 = 0x00000000:0x00000000 (IA32_PERF_GLOBAL_STATUS_RESET)
 MSR 0x00000391 = 0x00000000:0x00000000 (IA32_PERF_GLOBAL_STATUS_SET)
 MSR 0x000003F1 = 0x00000000:0x00000000 (MSR_PEBS_ENABLE)
 MSR 0x000003F6 = 0x00000000:0x0000FFFF (MSR_PEBS_LD_LAT)
 MSR 0x000003F7 = 0x00000000:0x00000800 (MSR_PEBS_FRONTEND)
 MSR 0x000003FC = 0x00000000:0x352E60C0 (MSR_CORE_C3_RESIDENCY)
 MSR 0x000003FD = 0x00000001:0x09196F28 (MSR_CORE_C6_RESIDENCY)
 MSR 0x000003FE = 0x00000027:0xA750BE40 (MSR_CORE_C7_RESIDENCY)
 MSR 0x00000400 = 0x00000000:0x00000FFF (IA32_MC0_CTL)
 MSR 0x00000401 = 0x00000000:0x00000000 (IA32_MC0_STATUS)
 MSR 0x00000402 = 0x00000000:0x00000000 (IA32_MC0_ADDR)
 MSR 0x00000403 = 0x00000000:0x00000000 (IA32_MC0_MISC)
 MSR 0x00000404 = 0x00000000:0x0000000F (IA32_MC1_CTL)
 MSR 0x00000405 = 0x00000000:0x00000000 (IA32_MC1_STATUS)
 MSR 0x00000406 = 0x00000000:0x00000000 (IA32_MC1_ADDR)
 MSR 0x00000407 = 0x00000000:0x00000000 (IA32_MC1_MISC)
 MSR 0x00000408 = 0x00000000:0x0000000F (IA32_MC2_CTL)
 MSR 0x00000409 = 0x00000000:0x00000000 (IA32_MC2_STATUS)
 MSR 0x0000040A = 0x00000000:0x00000000 (IA32_MC2_ADDR)
 MSR 0x0000040C = 0x00000000:0x0000001F (IA32_MC3_CTL)
 MSR 0x0000040D = 0x00000000:0x00000000 (IA32_MC3_STATUS)
 MSR 0x0000040E = 0x00000000:0x00000000 (IA32_MC3_ADDR)
 MSR 0x00000410 = 0x00000000:0x0000003F (IA32_MC4_CTL)
 MSR 0x00000411 = 0x00000000:0x00000000 (IA32_MC4_STATUS)
 MSR 0x00000480 = 0x00DA0400:0x00000004 (IA32_VMX_BASIC)
 MSR 0x00000481 = 0x0000007F:0x00000016 (IA32_VMX_PINBASED_CTLS)
 MSR 0x00000482 = 0xFFF9FFFE:0x0401E172 (IA32_VMX_PROCBASED_CTLS)
 MSR 0x00000483 = 0x01FFFFFF:0x00036DFF (IA32_VMX_EXIT_CTLS)
 MSR 0x00000484 = 0x0003FFFF:0x000011FF (IA32_VMX_ENTRY_CTLS)
 MSR 0x00000485 = 0x00000000:0x7004C1E7 (IA32_VMX_MISC)
 MSR 0x00000486 = 0x00000000:0x80000021 (IA32_VMX_CR0_FIXED0)
 MSR 0x00000487 = 0x00000000:0xFFFFFFFF (IA32_VMX_CR0_FIXED1)
 MSR 0x00000488 = 0x00000000:0x00002000 (IA32_VMX_CR4_FIXED0)
 MSR 0x00000489 = 0x00000000:0x003767FF (IA32_VMX_CR4_FIXED1)
 MSR 0x0000048A = 0x00000000:0x0000002E (IA32_VMX_VMCS_ENUM)
 MSR 0x0000048B = 0x005FFCFF:0x00000000 (IA32_VMX_PROCBASED_CTLS2)
 MSR 0x0000048C = 0x00000F01:0x06734141 (IA32_VMX_EPT_VPID_ENUM)
 MSR 0x0000048D = 0x0000007F:0x00000016 (IA32_VMX_TRUE_PINBASED_CTLS)
 MSR 0x0000048E = 0xFFF9FFFE:0x04006172 (IA32_VMX_TRUE_PROCBASED_CTLS)
 MSR 0x0000048F = 0x01FFFFFF:0x00036DFB (IA32_VMX_TRUE_EXIT_CTLS)
 MSR 0x00000490 = 0x0003FFFF:0x000011FB (IA32_VMX_TRUE_ENTRY_CTLS)
 MSR 0x000004C1 = 0x00000000:0x00000000 (IA32_A_PMC0)
 MSR 0x000004C2 = 0x00000000:0x00000000 (IA32_A_PMC1)
 MSR 0x000004C3 = 0x00000000:0x00000000 (IA32_A_PMC2)
 MSR 0x000004C4 = 0x00000000:0x00000000 (IA32_A_PMC3)
 MSR 0x00000500 = 0x00000000:0x00020000 (IA32_SGX_SVN_STATUS)
 MSR 0x00000560 = 0x00000000:0x00000000 (IA32_RTIT_OUTPUT_BASE)
 MSR 0x00000561 = 0x00000000:0x0000007F (IA32_RTIT_OUTPUT_MASK_PTRS)
 MSR 0x00000570 = 0x00000000:0x00000000 (IA32_RTIT_CTL)
 MSR 0x00000571 = 0x00000000:0x00000000 (IA32_RTIT_STATUS)
 MSR 0x00000572 = 0x00000000:0x00000000 (IA32_RTIT_CR3_MATCH)
 MSR 0x00000580 = 0x00000000:0x00000000 (IA32_RTIT_ADDR0_A)
 MSR 0x00000581 = 0x00000000:0x00000000 (IA32_RTIT_ADDR0_B)
 MSR 0x00000582 = 0x00000000:0x00000000 (IA32_RTIT_ADDR1_A)
 MSR 0x00000583 = 0x00000000:0x00000000 (IA32_RTIT_ADDR1_B)
 MSR 0x00000600 = 0xFFFFFE00:0x000CC000 (IA32_DS_AREA)
 MSR 0x0000064E = 0x00000003:0x4E0FEA07 (MSR_PPERF)
 MSR 0x00000653 = 0x00000000:0x00000000 (MSR_CORE_HDC_RESIDENCY)
 MSR 0x00000690 = 0x00000000:0x00000000 (MSR_LASTBRANCH_16_FROM_IP)
 MSR 0x00000691 = 0x00000000:0x00000000 (MSR_LASTBRANCH_17_FROM_IP)
 MSR 0x00000692 = 0x00000000:0x00000000 (MSR_LASTBRANCH_18_FROM_IP)
 MSR 0x00000693 = 0x00000000:0x00000000 (MSR_LASTBRANCH_19_FROM_IP)
 MSR 0x00000694 = 0x00000000:0x00000000 (MSR_LASTBRANCH_20_FROM_IP)
 MSR 0x00000695 = 0x00000000:0x00000000 (MSR_LASTBRANCH_21_FROM_IP)
 MSR 0x00000696 = 0x00000000:0x00000000 (MSR_LASTBRANCH_22_FROM_IP)
 MSR 0x00000697 = 0x00000000:0x00000000 (MSR_LASTBRANCH_23_FROM_IP)
 MSR 0x00000698 = 0x00000000:0x00000000 (MSR_LASTBRANCH_24_FROM_IP)
 MSR 0x00000699 = 0x00000000:0x00000000 (MSR_LASTBRANCH_25_FROM_IP)
 MSR 0x0000069A = 0x00000000:0x00000000 (MSR_LASTBRANCH_26_FROM_IP)
 MSR 0x0000069B = 0x00000000:0x00000000 (MSR_LASTBRANCH_27_FROM_IP)
 MSR 0x0000069C = 0x00000000:0x00000000 (MSR_LASTBRANCH_28_FROM_IP)
 MSR 0x0000069D = 0x00000000:0x00000000 (MSR_LASTBRANCH_29_FROM_IP)
 MSR 0x0000069E = 0x00000000:0x00000000 (MSR_LASTBRANCH_30_FROM_IP)
 MSR 0x0000069F = 0x00000000:0x00000000 (MSR_LASTBRANCH_31_FROM_IP)
 MSR 0x000006D0 = 0x00000000:0x00000000 (MSR_LASTBRANCH_16_TO_IP)
 MSR 0x000006D1 = 0x00000000:0x00000000 (MSR_LASTBRANCH_17_TO_IP)
 MSR 0x000006D2 = 0x00000000:0x00000000 (MSR_LASTBRANCH_18_TO_IP)
 MSR 0x000006D3 = 0x00000000:0x00000000 (MSR_LASTBRANCH_19_TO_IP)
 MSR 0x000006D4 = 0x00000000:0x00000000 (MSR_LASTBRANCH_20_TO_IP)
 MSR 0x000006D5 = 0x00000000:0x00000000 (MSR_LASTBRANCH_21_TO_IP)
 MSR 0x000006D6 = 0x00000000:0x00000000 (MSR_LASTBRANCH_22_TO_IP)
 MSR 0x000006D7 = 0x00000000:0x00000000 (MSR_LASTBRANCH_23_TO_IP)
 MSR 0x000006D8 = 0x00000000:0x00000000 (MSR_LASTBRANCH_24_TO_IP)
 MSR 0x000006D9 = 0x00000000:0x00000000 (MSR_LASTBRANCH_25_TO_IP)
 MSR 0x000006DA = 0x00000000:0x00000000 (MSR_LASTBRANCH_26_TO_IP)
 MSR 0x000006DB = 0x00000000:0x00000000 (MSR_LASTBRANCH_27_TO_IP)
 MSR 0x000006DC = 0x00000000:0x00000000 (MSR_LASTBRANCH_28_TO_IP)
 MSR 0x000006DD = 0x00000000:0x00000000 (MSR_LASTBRANCH_29_TO_IP)
 MSR 0x000006DE = 0x00000000:0x00000000 (MSR_LASTBRANCH_30_TO_IP)
 MSR 0x000006DF = 0x00000000:0x00000000 (MSR_LASTBRANCH_31_TO_IP)
 MSR 0x000006E0 = 0x00000039:0x4B8C09E8 (IA32_TSC_DEADLINE)
 MSR 0x00000771 = 0x00000000:0x010C1824 (IA32_HWP_CAPABILITIES)
 MSR 0x00000773 = 0x00000000:0x00000001 (IA32_HWP_INTERRUPT)
 MSR 0x00000774 = 0x00000000:0x00002408 (IA32_HWP_REQUEST)
 MSR 0x00000777 = 0x00000000:0x00000000 (IA32_HWP_STATUS)
 MSR 0x00000D90 = 0x00000000:0x00000000 (IA32_BNDCFGS)
 MSR 0x00000DA0 = 0x00000000:0x00000000 (IA32_XSS)
 MSR 0x00000DB1 = 0x00000000:0x00000001 (IA32_PM_CTL1)
 MSR 0x00000DB2 = 0x00000000:0x00000000 (IA32_THREAD_STALL)
 MSR 0x00000DC0 = 0x00000000:0x00000000 (IA32_LBR_INFO_0)
 MSR 0x00000DC1 = 0x00000000:0x00000000 (IA32_LBR_INFO_1)
 MSR 0x00000DC2 = 0x00000000:0x00000000 (IA32_LBR_INFO_2)
 MSR 0x00000DC3 = 0x00000000:0x00000000 (IA32_LBR_INFO_3)
 MSR 0x00000DC4 = 0x00000000:0x00000000 (IA32_LBR_INFO_4)
 MSR 0x00000DC5 = 0x00000000:0x00000000 (IA32_LBR_INFO_5)
 MSR 0x00000DC6 = 0x00000000:0x00000000 (IA32_LBR_INFO_6)
 MSR 0x00000DC7 = 0x00000000:0x00000000 (IA32_LBR_INFO_7)
 MSR 0x00000DC8 = 0x00000000:0x00000000 (IA32_LBR_INFO_8)
 MSR 0x00000DC9 = 0x00000000:0x00000000 (IA32_LBR_INFO_9)
 MSR 0x00000DCA = 0x00000000:0x00000000 (IA32_LBR_INFO_10)
 MSR 0x00000DCB = 0x00000000:0x00000000 (IA32_LBR_INFO_11)
 MSR 0x00000DCC = 0x00000000:0x00000000 (IA32_LBR_INFO_12)
 MSR 0x00000DCD = 0x00000000:0x00000000 (IA32_LBR_INFO_13)
 MSR 0x00000DCE = 0x00000000:0x00000000 (IA32_LBR_INFO_14)
 MSR 0x00000DCF = 0x00000000:0x00000000 (IA32_LBR_INFO_15)
 MSR 0x00000DD0 = 0x00000000:0x00000000 (IA32_LBR_INFO_16)
 MSR 0x00000DD1 = 0x00000000:0x00000000 (IA32_LBR_INFO_17)
 MSR 0x00000DD2 = 0x00000000:0x00000000 (IA32_LBR_INFO_18)
 MSR 0x00000DD3 = 0x00000000:0x00000000 (IA32_LBR_INFO_19)
 MSR 0x00000DD4 = 0x00000000:0x00000000 (IA32_LBR_INFO_20)
 MSR 0x00000DD5 = 0x00000000:0x00000000 (IA32_LBR_INFO_21)
 MSR 0x00000DD6 = 0x00000000:0x00000000 (IA32_LBR_INFO_22)
 MSR 0x00000DD7 = 0x00000000:0x00000000 (IA32_LBR_INFO_23)
 MSR 0x00000DD8 = 0x00000000:0x00000000 (IA32_LBR_INFO_24)
 MSR 0x00000DD9 = 0x00000000:0x00000000 (IA32_LBR_INFO_25)
 MSR 0x00000DDA = 0x00000000:0x00000000 (IA32_LBR_INFO_26)
 MSR 0x00000DDB = 0x00000000:0x00000000 (IA32_LBR_INFO_27)
 MSR 0x00000DDC = 0x00000000:0x00000000 (IA32_LBR_INFO_28)
 MSR 0x00000DDD = 0x00000000:0x00000000 (IA32_LBR_INFO_29)
 MSR 0x00000DDE = 0x00000000:0x00000000 (IA32_LBR_INFO_30)
 MSR 0x00000DDF = 0x00000000:0x00000000 (IA32_LBR_INFO_31)

====================== UNIQUE MSRs  (core 4) ======================
 MSR 0x00000000 = 0x00000000:0x00000FFF (IA32_P5_MC_ADDR)
 MSR 0x00000001 = 0x00000000:0x00000000 (IA32_P5_MC_TYPE)
 MSR 0x00000006 = 0x00000000:0x00000040 (IA32_MONITOR_FILTER_SIZE)
 MSR 0x00000010 = 0x00000039:0x4B43D40A (IA32_TIME_STAMP_COUNTER)
 MSR 0x0000001B = 0x00000000:0xFEE00C00 (IA32_APIC_BASE)
 MSR 0x00000034 = 0x00000000:0x000001DD (MSR_SMI_COUNT)
 MSR 0x0000003A = 0x00000000:0x00000005 (IA32_FEATURE_CONTROL)
 MSR 0x0000008B = 0x000000F4:0x00000000 (IA32_BIOS_SIGN_ID)
 MSR 0x000000C1 = 0x00000000:0x00000000 (IA32_PMC0)
 MSR 0x000000C2 = 0x00000000:0x00000000 (IA32_PMC1)
 MSR 0x000000C3 = 0x00000000:0x00000000 (IA32_PMC2)
 MSR 0x000000C4 = 0x00000000:0x00000000 (IA32_PMC3)
 MSR 0x000000E2 = 0x00000000:0x1E008008 (MSR_PKG_CST_CONFIG_CONTROL)
 MSR 0x000000E4 = 0x00000000:0x00051814 (MSR_PMG_IO_CAPTURE_BASE)
 MSR 0x000000E7 = 0x00000001:0xC4E4ED11 (IA32_MPERF)
 MSR 0x000000E8 = 0x00000002:0x77E7DD2A (IA32_APERF)
 MSR 0x000000FE = 0x00000000:0x00001D0A (IA32_MTRRCAP)
 MSR 0x0000013C = 0x00000000:0x00000001 (MSR_FEATURE_CONFIG)
 MSR 0x00000174 = 0x00000000:0x00000010 (IA32_SYSENTER_CS)
 MSR 0x00000175 = 0xFFFFFE00:0x000EF000 (IA32_SYSENTER_ESP)
 MSR 0x00000176 = 0xFFFFFFFF:0x8D6018A0 (IA32_SYSENTER_EIP)
 MSR 0x00000179 = 0x00000000:0x00000C0C (IA32_MCG_CAP)
 MSR 0x0000017A = 0x00000000:0x00000000 (IA32_MCG_STATUS)
 MSR 0x00000186 = 0x00000000:0x00000000 (IA32_PERFEVTSEL0)
 MSR 0x00000187 = 0x00000000:0x00000000 (IA32_PERFEVTSEL1)
 MSR 0x00000188 = 0x00000000:0x00000000 (IA32_PERFEVTSEL2)
 MSR 0x00000189 = 0x00000000:0x00000000 (IA32_PERFEVTSEL3)
 MSR 0x00000199 = 0x00000000:0x00000800 (IA32_PERF_CTL)
 MSR 0x0000019A = 0x00000000:0x00000000 (IA32_CLOCK_MODULATION)
 MSR 0x0000019B = 0x00000000:0x00000013 (IA32_THERM_INTERRUPT)
 MSR 0x0000019C = 0x00000000:0x88470800 (IA32_THERM_STATUS)
 MSR 0x000001A0 = 0x00000000:0x00850089 (IA32_MISC_ENABLE)
 MSR 0x000001A4 = 0x00000000:0x00000000 (IA32_MISC_FEATURE_CONTROL)
 MSR 0x000001A6 = 0x00000000:0x00000000 (MSR_OFFCORE_RSP_0)
 MSR 0x000001A7 = 0x00000000:0x00000000 (MSR_OFFCORE_RSP_1)
 MSR 0x000001C8 = 0x00000000:0x00000000 (MSR_LBR_SELECT)
 MSR 0x000001C9 = 0x00000000:0x00000000 (MSR_LASTBRANCH_TOS)
 MSR 0x000001D9 = 0x00000000:0x00004000 (IA32_DEBUGCTL)
 MSR 0x000001DD = 0x00000000:0x00000000 (MSR_LER_FROM_LIP)
 MSR 0x000001DE = 0x00000000:0x00000000 (MSR_LER_TO_LIP)
 MSR 0x000001F2 = 0x00000000:0xBF800006 (IA32_SMRR_PHYSBASE)
 MSR 0x000001F3 = 0x00000000:0xFF800800 (IA32_SMRR_PHYSMASK)
 MSR 0x000001F4 = 0x00000000:0x00000000 (MSR_PRMRR_PHYS_BASE)
 MSR 0x000001F5 = 0x00000000:0x00000000 (MSR_PRMRR_PHYS_MASK)
 MSR 0x000001FB = 0x00000000:0x000000E1 (MSR_PRMRR_VALID_CONFIG)
 MSR 0x000001FC = 0x00000000:0x002C005D (MSR_POWER_CTL)
 MSR 0x00000200 = 0x00000000:0xC0000000 (IA32_MTRR_PHYSBASE0)
 MSR 0x00000201 = 0x0000007F:0xC0000800 (IA32_MTRR_PHYSBASE0)
 MSR 0x00000202 = 0x00000000:0x00000000 (IA32_MTRR_PHYSBASE1)
 MSR 0x00000203 = 0x00000000:0x00000000 (IA32_MTRR_PHYSBASE1)
 MSR 0x00000204 = 0x00000000:0x00000000 (IA32_MTRR_PHYSBASE2)
 MSR 0x00000205 = 0x00000000:0x00000000 (IA32_MTRR_PHYSBASE2)
 MSR 0x00000206 = 0x00000000:0x00000000 (IA32_MTRR_PHYSBASE3)
 MSR 0x00000207 = 0x00000000:0x00000000 (IA32_MTRR_PHYSBASE3)
 MSR 0x00000208 = 0x00000000:0x00000000 (IA32_MTRR_PHYSBASE4)
 MSR 0x00000209 = 0x00000000:0x00000000 (IA32_MTRR_PHYSBASE4)
 MSR 0x0000020A = 0x00000000:0x00000000 (IA32_MTRR_PHYSBASE5)
 MSR 0x0000020B = 0x00000000:0x00000000 (IA32_MTRR_PHYSBASE5)
 MSR 0x0000020C = 0x00000000:0x00000000 (IA32_MTRR_PHYSBASE6)
 MSR 0x0000020D = 0x00000000:0x00000000 (IA32_MTRR_PHYSBASE6)
 MSR 0x0000020E = 0x00000000:0x00000000 (IA32_MTRR_PHYSBASE7)
 MSR 0x0000020F = 0x00000000:0x00000000 (IA32_MTRR_PHYSBASE7)
 MSR 0x00000210 = 0x00000000:0x00000000 (IA32_MTRR_PHYSBASE8)
 MSR 0x00000211 = 0x00000000:0x00000000 (IA32_MTRR_PHYSBASE8)
 MSR 0x00000212 = 0x00000000:0x00000000 (IA32_MTRR_PHYSBASE9)
 MSR 0x00000213 = 0x00000000:0x00000000 (IA32_MTRR_PHYSBASE9)
 MSR 0x00000250 = 0x06060606:0x06060606 (IA32_MTRR_FIX64K_00000)
 MSR 0x00000258 = 0x06060606:0x06060606 (IA32_MTRR_FIX16K_80000)
 MSR 0x00000259 = 0x00000000:0x00000000 (IA32_MTRR_FIX16K_A0000)
 MSR 0x00000268 = 0x05050505:0x05050505 (IA32_MTRR_FIX4K_C0000)
 MSR 0x00000269 = 0x05050505:0x05050505 (IA32_MTRR_FIX4K_C8000)
 MSR 0x0000026A = 0x05050505:0x05050505 (IA32_MTRR_FIX4K_D0000)
 MSR 0x0000026B = 0x05050505:0x05050505 (IA32_MTRR_FIX4K_D8000)
 MSR 0x0000026C = 0x05050505:0x05050505 (IA32_MTRR_FIX4K_E0000)
 MSR 0x0000026D = 0x05050505:0x05050505 (IA32_MTRR_FIX4K_E8000)
 MSR 0x0000026E = 0x05050505:0x05050505 (IA32_MTRR_FIX4K_F0000)
 MSR 0x0000026F = 0x05050505:0x05050505 (IA32_MTRR_FIX4K_F8000)
 MSR 0x00000277 = 0x04070506:0x00070106 (IA32_PAT)
 MSR 0x00000280 = 0x00000000:0x40000001 (IA32_MC0_CTL2)
 MSR 0x00000281 = 0x00000000:0x40000001 (IA32_MC1_CTL2)
 MSR 0x00000282 = 0x00000000:0x40000001 (IA32_MC2_CTL2)
 MSR 0x00000283 = 0x00000000:0x40000001 (IA32_MC3_CTL2)
 MSR 0x000002FF = 0x00000000:0x00000C06 (IA32_MTRR_DEF_TYPE)
 MSR 0x00000309 = 0x00000000:0x00000000 (IA32_FIXED_CTR0)
 MSR 0x0000030A = 0x0000FFFC:0xD1FBD307 (IA32_FIXED_CTR1)
 MSR 0x0000030B = 0x00000000:0x00000000 (IA32_FIXED_CTR2)
 MSR 0x00000345 = 0x00000000:0x000033C5 (IA32_PERF_CAPABILITIES)
 MSR 0x0000038D = 0x00000000:0x000000B0 (IA32_FIXED_CTR_CTRL)
 MSR 0x0000038E = 0x00000000:0x00000000 (IA32_PERF_GLOBAL_STATUS)
 MSR 0x0000038F = 0x00000007:0x0000000F (IA32_PERF_GLOBAL_CTRL)
 MSR 0x00000390 = 0x00000000:0x00000000 (IA32_PERF_GLOBAL_STATUS_RESET)
 MSR 0x00000391 = 0x00000000:0x00000000 (IA32_PERF_GLOBAL_STATUS_SET)
 MSR 0x000003F1 = 0x00000000:0x00000000 (MSR_PEBS_ENABLE)
 MSR 0x000003F6 = 0x00000000:0x0000FFFF (MSR_PEBS_LD_LAT)
 MSR 0x000003F7 = 0x00000000:0x00000800 (MSR_PEBS_FRONTEND)
 MSR 0x000003FC = 0x00000000:0x2BE30678 (MSR_CORE_C3_RESIDENCY)
 MSR 0x000003FD = 0x00000000:0xC3BA9690 (MSR_CORE_C6_RESIDENCY)
 MSR 0x000003FE = 0x00000029:0x4D4FFDC0 (MSR_CORE_C7_RESIDENCY)
 MSR 0x00000400 = 0x00000000:0x00000FFF (IA32_MC0_CTL)
 MSR 0x00000401 = 0x00000000:0x00000000 (IA32_MC0_STATUS)
 MSR 0x00000402 = 0x00000000:0x00000000 (IA32_MC0_ADDR)
 MSR 0x00000403 = 0x00000000:0x00000000 (IA32_MC0_MISC)
 MSR 0x00000404 = 0x00000000:0x0000000F (IA32_MC1_CTL)
 MSR 0x00000405 = 0x00000000:0x00000000 (IA32_MC1_STATUS)
 MSR 0x00000406 = 0x00000000:0x00000000 (IA32_MC1_ADDR)
 MSR 0x00000407 = 0x00000000:0x00000000 (IA32_MC1_MISC)
 MSR 0x00000408 = 0x00000000:0x0000000F (IA32_MC2_CTL)
 MSR 0x00000409 = 0x00000000:0x00000000 (IA32_MC2_STATUS)
 MSR 0x0000040A = 0x00000000:0x00000000 (IA32_MC2_ADDR)
 MSR 0x0000040C = 0x00000000:0x0000001F (IA32_MC3_CTL)
 MSR 0x0000040D = 0x00000000:0x00000000 (IA32_MC3_STATUS)
 MSR 0x0000040E = 0x00000000:0x00000000 (IA32_MC3_ADDR)
 MSR 0x00000410 = 0x00000000:0x0000003F (IA32_MC4_CTL)
 MSR 0x00000411 = 0x00000000:0x00000000 (IA32_MC4_STATUS)
 MSR 0x00000480 = 0x00DA0400:0x00000004 (IA32_VMX_BASIC)
 MSR 0x00000481 = 0x0000007F:0x00000016 (IA32_VMX_PINBASED_CTLS)
 MSR 0x00000482 = 0xFFF9FFFE:0x0401E172 (IA32_VMX_PROCBASED_CTLS)
 MSR 0x00000483 = 0x01FFFFFF:0x00036DFF (IA32_VMX_EXIT_CTLS)
 MSR 0x00000484 = 0x0003FFFF:0x000011FF (IA32_VMX_ENTRY_CTLS)
 MSR 0x00000485 = 0x00000000:0x7004C1E7 (IA32_VMX_MISC)
 MSR 0x00000486 = 0x00000000:0x80000021 (IA32_VMX_CR0_FIXED0)
 MSR 0x00000487 = 0x00000000:0xFFFFFFFF (IA32_VMX_CR0_FIXED1)
 MSR 0x00000488 = 0x00000000:0x00002000 (IA32_VMX_CR4_FIXED0)
 MSR 0x00000489 = 0x00000000:0x003767FF (IA32_VMX_CR4_FIXED1)
 MSR 0x0000048A = 0x00000000:0x0000002E (IA32_VMX_VMCS_ENUM)
 MSR 0x0000048B = 0x005FFCFF:0x00000000 (IA32_VMX_PROCBASED_CTLS2)
 MSR 0x0000048C = 0x00000F01:0x06734141 (IA32_VMX_EPT_VPID_ENUM)
 MSR 0x0000048D = 0x0000007F:0x00000016 (IA32_VMX_TRUE_PINBASED_CTLS)
 MSR 0x0000048E = 0xFFF9FFFE:0x04006172 (IA32_VMX_TRUE_PROCBASED_CTLS)
 MSR 0x0000048F = 0x01FFFFFF:0x00036DFB (IA32_VMX_TRUE_EXIT_CTLS)
 MSR 0x00000490 = 0x0003FFFF:0x000011FB (IA32_VMX_TRUE_ENTRY_CTLS)
 MSR 0x000004C1 = 0x00000000:0x00000000 (IA32_A_PMC0)
 MSR 0x000004C2 = 0x00000000:0x00000000 (IA32_A_PMC1)
 MSR 0x000004C3 = 0x00000000:0x00000000 (IA32_A_PMC2)
 MSR 0x000004C4 = 0x00000000:0x00000000 (IA32_A_PMC3)
 MSR 0x00000500 = 0x00000000:0x00020000 (IA32_SGX_SVN_STATUS)
 MSR 0x00000560 = 0x00000000:0x00000000 (IA32_RTIT_OUTPUT_BASE)
 MSR 0x00000561 = 0x00000000:0x0000007F (IA32_RTIT_OUTPUT_MASK_PTRS)
 MSR 0x00000570 = 0x00000000:0x00000000 (IA32_RTIT_CTL)
 MSR 0x00000571 = 0x00000000:0x00000000 (IA32_RTIT_STATUS)
 MSR 0x00000572 = 0x00000000:0x00000000 (IA32_RTIT_CR3_MATCH)
 MSR 0x00000580 = 0x00000000:0x00000000 (IA32_RTIT_ADDR0_A)
 MSR 0x00000581 = 0x00000000:0x00000000 (IA32_RTIT_ADDR0_B)
 MSR 0x00000582 = 0x00000000:0x00000000 (IA32_RTIT_ADDR1_A)
 MSR 0x00000583 = 0x00000000:0x00000000 (IA32_RTIT_ADDR1_B)
 MSR 0x00000600 = 0xFFFFFE00:0x00107000 (IA32_DS_AREA)
 MSR 0x0000064E = 0x00000002:0x3BF74A11 (MSR_PPERF)
 MSR 0x00000653 = 0x00000000:0x00000000 (MSR_CORE_HDC_RESIDENCY)
 MSR 0x00000690 = 0x00000000:0x00000000 (MSR_LASTBRANCH_16_FROM_IP)
 MSR 0x00000691 = 0x00000000:0x00000000 (MSR_LASTBRANCH_17_FROM_IP)
 MSR 0x00000692 = 0x00000000:0x00000000 (MSR_LASTBRANCH_18_FROM_IP)
 MSR 0x00000693 = 0x00000000:0x00000000 (MSR_LASTBRANCH_19_FROM_IP)
 MSR 0x00000694 = 0x00000000:0x00000000 (MSR_LASTBRANCH_20_FROM_IP)
 MSR 0x00000695 = 0x00000000:0x00000000 (MSR_LASTBRANCH_21_FROM_IP)
 MSR 0x00000696 = 0x00000000:0x00000000 (MSR_LASTBRANCH_22_FROM_IP)
 MSR 0x00000697 = 0x00000000:0x00000000 (MSR_LASTBRANCH_23_FROM_IP)
 MSR 0x00000698 = 0x00000000:0x00000000 (MSR_LASTBRANCH_24_FROM_IP)
 MSR 0x00000699 = 0x00000000:0x00000000 (MSR_LASTBRANCH_25_FROM_IP)
 MSR 0x0000069A = 0x00000000:0x00000000 (MSR_LASTBRANCH_26_FROM_IP)
 MSR 0x0000069B = 0x00000000:0x00000000 (MSR_LASTBRANCH_27_FROM_IP)
 MSR 0x0000069C = 0x00000000:0x00000000 (MSR_LASTBRANCH_28_FROM_IP)
 MSR 0x0000069D = 0x00000000:0x00000000 (MSR_LASTBRANCH_29_FROM_IP)
 MSR 0x0000069E = 0x00000000:0x00000000 (MSR_LASTBRANCH_30_FROM_IP)
 MSR 0x0000069F = 0x00000000:0x00000000 (MSR_LASTBRANCH_31_FROM_IP)
 MSR 0x000006D0 = 0x00000000:0x00000000 (MSR_LASTBRANCH_16_TO_IP)
 MSR 0x000006D1 = 0x00000000:0x00000000 (MSR_LASTBRANCH_17_TO_IP)
 MSR 0x000006D2 = 0x00000000:0x00000000 (MSR_LASTBRANCH_18_TO_IP)
 MSR 0x000006D3 = 0x00000000:0x00000000 (MSR_LASTBRANCH_19_TO_IP)
 MSR 0x000006D4 = 0x00000000:0x00000000 (MSR_LASTBRANCH_20_TO_IP)
 MSR 0x000006D5 = 0x00000000:0x00000000 (MSR_LASTBRANCH_21_TO_IP)
 MSR 0x000006D6 = 0x00000000:0x00000000 (MSR_LASTBRANCH_22_TO_IP)
 MSR 0x000006D7 = 0x00000000:0x00000000 (MSR_LASTBRANCH_23_TO_IP)
 MSR 0x000006D8 = 0x00000000:0x00000000 (MSR_LASTBRANCH_24_TO_IP)
 MSR 0x000006D9 = 0x00000000:0x00000000 (MSR_LASTBRANCH_25_TO_IP)
 MSR 0x000006DA = 0x00000000:0x00000000 (MSR_LASTBRANCH_26_TO_IP)
 MSR 0x000006DB = 0x00000000:0x00000000 (MSR_LASTBRANCH_27_TO_IP)
 MSR 0x000006DC = 0x00000000:0x00000000 (MSR_LASTBRANCH_28_TO_IP)
 MSR 0x000006DD = 0x00000000:0x00000000 (MSR_LASTBRANCH_29_TO_IP)
 MSR 0x000006DE = 0x00000000:0x00000000 (MSR_LASTBRANCH_30_TO_IP)
 MSR 0x000006DF = 0x00000000:0x00000000 (MSR_LASTBRANCH_31_TO_IP)
 MSR 0x000006E0 = 0x00000039:0x4B8C0196 (IA32_TSC_DEADLINE)
 MSR 0x00000771 = 0x00000000:0x010C1824 (IA32_HWP_CAPABILITIES)
 MSR 0x00000773 = 0x00000000:0x00000001 (IA32_HWP_INTERRUPT)
 MSR 0x00000774 = 0x00000000:0x00002408 (IA32_HWP_REQUEST)
 MSR 0x00000777 = 0x00000000:0x00000000 (IA32_HWP_STATUS)
 MSR 0x00000D90 = 0x00000000:0x00000000 (IA32_BNDCFGS)
 MSR 0x00000DA0 = 0x00000000:0x00000000 (IA32_XSS)
 MSR 0x00000DB1 = 0x00000000:0x00000001 (IA32_PM_CTL1)
 MSR 0x00000DB2 = 0x00000000:0x00000000 (IA32_THREAD_STALL)
 MSR 0x00000DC0 = 0x00000000:0x00000000 (IA32_LBR_INFO_0)
 MSR 0x00000DC1 = 0x00000000:0x00000000 (IA32_LBR_INFO_1)
 MSR 0x00000DC2 = 0x00000000:0x00000000 (IA32_LBR_INFO_2)
 MSR 0x00000DC3 = 0x00000000:0x00000000 (IA32_LBR_INFO_3)
 MSR 0x00000DC4 = 0x00000000:0x00000000 (IA32_LBR_INFO_4)
 MSR 0x00000DC5 = 0x00000000:0x00000000 (IA32_LBR_INFO_5)
 MSR 0x00000DC6 = 0x00000000:0x00000000 (IA32_LBR_INFO_6)
 MSR 0x00000DC7 = 0x00000000:0x00000000 (IA32_LBR_INFO_7)
 MSR 0x00000DC8 = 0x00000000:0x00000000 (IA32_LBR_INFO_8)
 MSR 0x00000DC9 = 0x00000000:0x00000000 (IA32_LBR_INFO_9)
 MSR 0x00000DCA = 0x00000000:0x00000000 (IA32_LBR_INFO_10)
 MSR 0x00000DCB = 0x00000000:0x00000000 (IA32_LBR_INFO_11)
 MSR 0x00000DCC = 0x00000000:0x00000000 (IA32_LBR_INFO_12)
 MSR 0x00000DCD = 0x00000000:0x00000000 (IA32_LBR_INFO_13)
 MSR 0x00000DCE = 0x00000000:0x00000000 (IA32_LBR_INFO_14)
 MSR 0x00000DCF = 0x00000000:0x00000000 (IA32_LBR_INFO_15)
 MSR 0x00000DD0 = 0x00000000:0x00000000 (IA32_LBR_INFO_16)
 MSR 0x00000DD1 = 0x00000000:0x00000000 (IA32_LBR_INFO_17)
 MSR 0x00000DD2 = 0x00000000:0x00000000 (IA32_LBR_INFO_18)
 MSR 0x00000DD3 = 0x00000000:0x00000000 (IA32_LBR_INFO_19)
 MSR 0x00000DD4 = 0x00000000:0x00000000 (IA32_LBR_INFO_20)
 MSR 0x00000DD5 = 0x00000000:0x00000000 (IA32_LBR_INFO_21)
 MSR 0x00000DD6 = 0x00000000:0x00000000 (IA32_LBR_INFO_22)
 MSR 0x00000DD7 = 0x00000000:0x00000000 (IA32_LBR_INFO_23)
 MSR 0x00000DD8 = 0x00000000:0x00000000 (IA32_LBR_INFO_24)
 MSR 0x00000DD9 = 0x00000000:0x00000000 (IA32_LBR_INFO_25)
 MSR 0x00000DDA = 0x00000000:0x00000000 (IA32_LBR_INFO_26)
 MSR 0x00000DDB = 0x00000000:0x00000000 (IA32_LBR_INFO_27)
 MSR 0x00000DDC = 0x00000000:0x00000000 (IA32_LBR_INFO_28)
 MSR 0x00000DDD = 0x00000000:0x00000000 (IA32_LBR_INFO_29)
 MSR 0x00000DDE = 0x00000000:0x00000000 (IA32_LBR_INFO_30)
 MSR 0x00000DDF = 0x00000000:0x00000000 (IA32_LBR_INFO_31)

====================== UNIQUE MSRs  (core 5) ======================
 MSR 0x00000000 = 0x00000000:0x00000FFF (IA32_P5_MC_ADDR)
 MSR 0x00000001 = 0x00000000:0x00000000 (IA32_P5_MC_TYPE)
 MSR 0x00000006 = 0x00000000:0x00000040 (IA32_MONITOR_FILTER_SIZE)
 MSR 0x00000010 = 0x00000039:0x4B6E932A (IA32_TIME_STAMP_COUNTER)
 MSR 0x0000001B = 0x00000000:0xFEE00C00 (IA32_APIC_BASE)
 MSR 0x00000034 = 0x00000000:0x000001DD (MSR_SMI_COUNT)
 MSR 0x0000003A = 0x00000000:0x00000005 (IA32_FEATURE_CONTROL)
 MSR 0x0000008B = 0x000000F4:0x00000000 (IA32_BIOS_SIGN_ID)
 MSR 0x000000C1 = 0x00000000:0x00000000 (IA32_PMC0)
 MSR 0x000000C2 = 0x00000000:0x00000000 (IA32_PMC1)
 MSR 0x000000C3 = 0x00000000:0x00000000 (IA32_PMC2)
 MSR 0x000000C4 = 0x00000000:0x00000000 (IA32_PMC3)
 MSR 0x000000E2 = 0x00000000:0x1E008008 (MSR_PKG_CST_CONFIG_CONTROL)
 MSR 0x000000E4 = 0x00000000:0x00051814 (MSR_PMG_IO_CAPTURE_BASE)
 MSR 0x000000E7 = 0x00000001:0xA420C287 (IA32_MPERF)
 MSR 0x000000E8 = 0x00000002:0x466A9113 (IA32_APERF)
 MSR 0x000000FE = 0x00000000:0x00001D0A (IA32_MTRRCAP)
 MSR 0x0000013C = 0x00000000:0x00000001 (MSR_FEATURE_CONFIG)
 MSR 0x00000174 = 0x00000000:0x00000010 (IA32_SYSENTER_CS)
 MSR 0x00000175 = 0xFFFFFE00:0x0012A000 (IA32_SYSENTER_ESP)
 MSR 0x00000176 = 0xFFFFFFFF:0x8D6018A0 (IA32_SYSENTER_EIP)
 MSR 0x00000179 = 0x00000000:0x00000C0C (IA32_MCG_CAP)
 MSR 0x0000017A = 0x00000000:0x00000000 (IA32_MCG_STATUS)
 MSR 0x00000186 = 0x00000000:0x00000000 (IA32_PERFEVTSEL0)
 MSR 0x00000187 = 0x00000000:0x00000000 (IA32_PERFEVTSEL1)
 MSR 0x00000188 = 0x00000000:0x00000000 (IA32_PERFEVTSEL2)
 MSR 0x00000189 = 0x00000000:0x00000000 (IA32_PERFEVTSEL3)
 MSR 0x00000199 = 0x00000000:0x00000800 (IA32_PERF_CTL)
 MSR 0x0000019A = 0x00000000:0x00000000 (IA32_CLOCK_MODULATION)
 MSR 0x0000019B = 0x00000000:0x00000013 (IA32_THERM_INTERRUPT)
 MSR 0x0000019C = 0x00000000:0x88490800 (IA32_THERM_STATUS)
 MSR 0x000001A0 = 0x00000000:0x00850089 (IA32_MISC_ENABLE)
 MSR 0x000001A4 = 0x00000000:0x00000000 (IA32_MISC_FEATURE_CONTROL)
 MSR 0x000001A6 = 0x00000000:0x00000000 (MSR_OFFCORE_RSP_0)
 MSR 0x000001A7 = 0x00000000:0x00000000 (MSR_OFFCORE_RSP_1)
 MSR 0x000001C8 = 0x00000000:0x00000000 (MSR_LBR_SELECT)
 MSR 0x000001C9 = 0x00000000:0x00000000 (MSR_LASTBRANCH_TOS)
 MSR 0x000001D9 = 0x00000000:0x00004000 (IA32_DEBUGCTL)
 MSR 0x000001DD = 0x00000000:0x00000000 (MSR_LER_FROM_LIP)
 MSR 0x000001DE = 0x00000000:0x00000000 (MSR_LER_TO_LIP)
 MSR 0x000001F2 = 0x00000000:0xBF800006 (IA32_SMRR_PHYSBASE)
 MSR 0x000001F3 = 0x00000000:0xFF800800 (IA32_SMRR_PHYSMASK)
 MSR 0x000001F4 = 0x00000000:0x00000000 (MSR_PRMRR_PHYS_BASE)
 MSR 0x000001F5 = 0x00000000:0x00000000 (MSR_PRMRR_PHYS_MASK)
 MSR 0x000001FB = 0x00000000:0x000000E1 (MSR_PRMRR_VALID_CONFIG)
 MSR 0x000001FC = 0x00000000:0x002C005D (MSR_POWER_CTL)
 MSR 0x00000200 = 0x00000000:0xC0000000 (IA32_MTRR_PHYSBASE0)
 MSR 0x00000201 = 0x0000007F:0xC0000800 (IA32_MTRR_PHYSBASE0)
 MSR 0x00000202 = 0x00000000:0x00000000 (IA32_MTRR_PHYSBASE1)
 MSR 0x00000203 = 0x00000000:0x00000000 (IA32_MTRR_PHYSBASE1)
 MSR 0x00000204 = 0x00000000:0x00000000 (IA32_MTRR_PHYSBASE2)
 MSR 0x00000205 = 0x00000000:0x00000000 (IA32_MTRR_PHYSBASE2)
 MSR 0x00000206 = 0x00000000:0x00000000 (IA32_MTRR_PHYSBASE3)
 MSR 0x00000207 = 0x00000000:0x00000000 (IA32_MTRR_PHYSBASE3)
 MSR 0x00000208 = 0x00000000:0x00000000 (IA32_MTRR_PHYSBASE4)
 MSR 0x00000209 = 0x00000000:0x00000000 (IA32_MTRR_PHYSBASE4)
 MSR 0x0000020A = 0x00000000:0x00000000 (IA32_MTRR_PHYSBASE5)
 MSR 0x0000020B = 0x00000000:0x00000000 (IA32_MTRR_PHYSBASE5)
 MSR 0x0000020C = 0x00000000:0x00000000 (IA32_MTRR_PHYSBASE6)
 MSR 0x0000020D = 0x00000000:0x00000000 (IA32_MTRR_PHYSBASE6)
 MSR 0x0000020E = 0x00000000:0x00000000 (IA32_MTRR_PHYSBASE7)
 MSR 0x0000020F = 0x00000000:0x00000000 (IA32_MTRR_PHYSBASE7)
 MSR 0x00000210 = 0x00000000:0x00000000 (IA32_MTRR_PHYSBASE8)
 MSR 0x00000211 = 0x00000000:0x00000000 (IA32_MTRR_PHYSBASE8)
 MSR 0x00000212 = 0x00000000:0x00000000 (IA32_MTRR_PHYSBASE9)
 MSR 0x00000213 = 0x00000000:0x00000000 (IA32_MTRR_PHYSBASE9)
 MSR 0x00000250 = 0x06060606:0x06060606 (IA32_MTRR_FIX64K_00000)
 MSR 0x00000258 = 0x06060606:0x06060606 (IA32_MTRR_FIX16K_80000)
 MSR 0x00000259 = 0x00000000:0x00000000 (IA32_MTRR_FIX16K_A0000)
 MSR 0x00000268 = 0x05050505:0x05050505 (IA32_MTRR_FIX4K_C0000)
 MSR 0x00000269 = 0x05050505:0x05050505 (IA32_MTRR_FIX4K_C8000)
 MSR 0x0000026A = 0x05050505:0x05050505 (IA32_MTRR_FIX4K_D0000)
 MSR 0x0000026B = 0x05050505:0x05050505 (IA32_MTRR_FIX4K_D8000)
 MSR 0x0000026C = 0x05050505:0x05050505 (IA32_MTRR_FIX4K_E0000)
 MSR 0x0000026D = 0x05050505:0x05050505 (IA32_MTRR_FIX4K_E8000)
 MSR 0x0000026E = 0x05050505:0x05050505 (IA32_MTRR_FIX4K_F0000)
 MSR 0x0000026F = 0x05050505:0x05050505 (IA32_MTRR_FIX4K_F8000)
 MSR 0x00000277 = 0x04070506:0x00070106 (IA32_PAT)
 MSR 0x00000280 = 0x00000000:0x40000001 (IA32_MC0_CTL2)
 MSR 0x00000281 = 0x00000000:0x40000001 (IA32_MC1_CTL2)
 MSR 0x00000282 = 0x00000000:0x40000001 (IA32_MC2_CTL2)
 MSR 0x00000283 = 0x00000000:0x40000001 (IA32_MC3_CTL2)
 MSR 0x000002FF = 0x00000000:0x00000C06 (IA32_MTRR_DEF_TYPE)
 MSR 0x00000309 = 0x00000000:0x00000000 (IA32_FIXED_CTR0)
 MSR 0x0000030A = 0x0000FFFC:0xA007D6A1 (IA32_FIXED_CTR1)
 MSR 0x0000030B = 0x00000000:0x00000000 (IA32_FIXED_CTR2)
 MSR 0x00000345 = 0x00000000:0x000033C5 (IA32_PERF_CAPABILITIES)
 MSR 0x0000038D = 0x00000000:0x000000B0 (IA32_FIXED_CTR_CTRL)
 MSR 0x0000038E = 0x00000000:0x00000000 (IA32_PERF_GLOBAL_STATUS)
 MSR 0x0000038F = 0x00000007:0x0000000F (IA32_PERF_GLOBAL_CTRL)
 MSR 0x00000390 = 0x00000000:0x00000000 (IA32_PERF_GLOBAL_STATUS_RESET)
 MSR 0x00000391 = 0x00000000:0x00000000 (IA32_PERF_GLOBAL_STATUS_SET)
 MSR 0x000003F1 = 0x00000000:0x00000000 (MSR_PEBS_ENABLE)
 MSR 0x000003F6 = 0x00000000:0x0000FFFF (MSR_PEBS_LD_LAT)
 MSR 0x000003F7 = 0x00000000:0x00000800 (MSR_PEBS_FRONTEND)
 MSR 0x000003FC = 0x00000000:0x30BB1E68 (MSR_CORE_C3_RESIDENCY)
 MSR 0x000003FD = 0x00000001:0x010B0098 (MSR_CORE_C6_RESIDENCY)
 MSR 0x000003FE = 0x00000029:0xD6C1D370 (MSR_CORE_C7_RESIDENCY)
 MSR 0x00000400 = 0x00000000:0x00000FFF (IA32_MC0_CTL)
 MSR 0x00000401 = 0x00000000:0x00000000 (IA32_MC0_STATUS)
 MSR 0x00000402 = 0x00000000:0x00000000 (IA32_MC0_ADDR)
 MSR 0x00000403 = 0x00000000:0x00000000 (IA32_MC0_MISC)
 MSR 0x00000404 = 0x00000000:0x0000000F (IA32_MC1_CTL)
 MSR 0x00000405 = 0x00000000:0x00000000 (IA32_MC1_STATUS)
 MSR 0x00000406 = 0x00000000:0x00000000 (IA32_MC1_ADDR)
 MSR 0x00000407 = 0x00000000:0x00000000 (IA32_MC1_MISC)
 MSR 0x00000408 = 0x00000000:0x0000000F (IA32_MC2_CTL)
 MSR 0x00000409 = 0x00000000:0x00000000 (IA32_MC2_STATUS)
 MSR 0x0000040A = 0x00000000:0x00000000 (IA32_MC2_ADDR)
 MSR 0x0000040C = 0x00000000:0x0000001F (IA32_MC3_CTL)
 MSR 0x0000040D = 0x00000000:0x00000000 (IA32_MC3_STATUS)
 MSR 0x0000040E = 0x00000000:0x00000000 (IA32_MC3_ADDR)
 MSR 0x00000410 = 0x00000000:0x0000003F (IA32_MC4_CTL)
 MSR 0x00000411 = 0x00000000:0x00000000 (IA32_MC4_STATUS)
 MSR 0x00000480 = 0x00DA0400:0x00000004 (IA32_VMX_BASIC)
 MSR 0x00000481 = 0x0000007F:0x00000016 (IA32_VMX_PINBASED_CTLS)
 MSR 0x00000482 = 0xFFF9FFFE:0x0401E172 (IA32_VMX_PROCBASED_CTLS)
 MSR 0x00000483 = 0x01FFFFFF:0x00036DFF (IA32_VMX_EXIT_CTLS)
 MSR 0x00000484 = 0x0003FFFF:0x000011FF (IA32_VMX_ENTRY_CTLS)
 MSR 0x00000485 = 0x00000000:0x7004C1E7 (IA32_VMX_MISC)
 MSR 0x00000486 = 0x00000000:0x80000021 (IA32_VMX_CR0_FIXED0)
 MSR 0x00000487 = 0x00000000:0xFFFFFFFF (IA32_VMX_CR0_FIXED1)
 MSR 0x00000488 = 0x00000000:0x00002000 (IA32_VMX_CR4_FIXED0)
 MSR 0x00000489 = 0x00000000:0x003767FF (IA32_VMX_CR4_FIXED1)
 MSR 0x0000048A = 0x00000000:0x0000002E (IA32_VMX_VMCS_ENUM)
 MSR 0x0000048B = 0x005FFCFF:0x00000000 (IA32_VMX_PROCBASED_CTLS2)
 MSR 0x0000048C = 0x00000F01:0x06734141 (IA32_VMX_EPT_VPID_ENUM)
 MSR 0x0000048D = 0x0000007F:0x00000016 (IA32_VMX_TRUE_PINBASED_CTLS)
 MSR 0x0000048E = 0xFFF9FFFE:0x04006172 (IA32_VMX_TRUE_PROCBASED_CTLS)
 MSR 0x0000048F = 0x01FFFFFF:0x00036DFB (IA32_VMX_TRUE_EXIT_CTLS)
 MSR 0x00000490 = 0x0003FFFF:0x000011FB (IA32_VMX_TRUE_ENTRY_CTLS)
 MSR 0x000004C1 = 0x00000000:0x00000000 (IA32_A_PMC0)
 MSR 0x000004C2 = 0x00000000:0x00000000 (IA32_A_PMC1)
 MSR 0x000004C3 = 0x00000000:0x00000000 (IA32_A_PMC2)
 MSR 0x000004C4 = 0x00000000:0x00000000 (IA32_A_PMC3)
 MSR 0x00000500 = 0x00000000:0x00020000 (IA32_SGX_SVN_STATUS)
 MSR 0x00000560 = 0x00000000:0x00000000 (IA32_RTIT_OUTPUT_BASE)
 MSR 0x00000561 = 0x00000000:0x0000007F (IA32_RTIT_OUTPUT_MASK_PTRS)
 MSR 0x00000570 = 0x00000000:0x00000000 (IA32_RTIT_CTL)
 MSR 0x00000571 = 0x00000000:0x00000000 (IA32_RTIT_STATUS)
 MSR 0x00000572 = 0x00000000:0x00000000 (IA32_RTIT_CR3_MATCH)
 MSR 0x00000580 = 0x00000000:0x00000000 (IA32_RTIT_ADDR0_A)
 MSR 0x00000581 = 0x00000000:0x00000000 (IA32_RTIT_ADDR0_B)
 MSR 0x00000582 = 0x00000000:0x00000000 (IA32_RTIT_ADDR1_A)
 MSR 0x00000583 = 0x00000000:0x00000000 (IA32_RTIT_ADDR1_B)
 MSR 0x00000600 = 0xFFFFFE00:0x00142000 (IA32_DS_AREA)
 MSR 0x0000064E = 0x00000002:0x1AD06815 (MSR_PPERF)
 MSR 0x00000653 = 0x00000000:0x00000000 (MSR_CORE_HDC_RESIDENCY)
 MSR 0x00000690 = 0x00000000:0x00000000 (MSR_LASTBRANCH_16_FROM_IP)
 MSR 0x00000691 = 0x00000000:0x00000000 (MSR_LASTBRANCH_17_FROM_IP)
 MSR 0x00000692 = 0x00000000:0x00000000 (MSR_LASTBRANCH_18_FROM_IP)
 MSR 0x00000693 = 0x00000000:0x00000000 (MSR_LASTBRANCH_19_FROM_IP)
 MSR 0x00000694 = 0x00000000:0x00000000 (MSR_LASTBRANCH_20_FROM_IP)
 MSR 0x00000695 = 0x00000000:0x00000000 (MSR_LASTBRANCH_21_FROM_IP)
 MSR 0x00000696 = 0x00000000:0x00000000 (MSR_LASTBRANCH_22_FROM_IP)
 MSR 0x00000697 = 0x00000000:0x00000000 (MSR_LASTBRANCH_23_FROM_IP)
 MSR 0x00000698 = 0x00000000:0x00000000 (MSR_LASTBRANCH_24_FROM_IP)
 MSR 0x00000699 = 0x00000000:0x00000000 (MSR_LASTBRANCH_25_FROM_IP)
 MSR 0x0000069A = 0x00000000:0x00000000 (MSR_LASTBRANCH_26_FROM_IP)
 MSR 0x0000069B = 0x00000000:0x00000000 (MSR_LASTBRANCH_27_FROM_IP)
 MSR 0x0000069C = 0x00000000:0x00000000 (MSR_LASTBRANCH_28_FROM_IP)
 MSR 0x0000069D = 0x00000000:0x00000000 (MSR_LASTBRANCH_29_FROM_IP)
 MSR 0x0000069E = 0x00000000:0x00000000 (MSR_LASTBRANCH_30_FROM_IP)
 MSR 0x0000069F = 0x00000000:0x00000000 (MSR_LASTBRANCH_31_FROM_IP)
 MSR 0x000006D0 = 0x00000000:0x00000000 (MSR_LASTBRANCH_16_TO_IP)
 MSR 0x000006D1 = 0x00000000:0x00000000 (MSR_LASTBRANCH_17_TO_IP)
 MSR 0x000006D2 = 0x00000000:0x00000000 (MSR_LASTBRANCH_18_TO_IP)
 MSR 0x000006D3 = 0x00000000:0x00000000 (MSR_LASTBRANCH_19_TO_IP)
 MSR 0x000006D4 = 0x00000000:0x00000000 (MSR_LASTBRANCH_20_TO_IP)
 MSR 0x000006D5 = 0x00000000:0x00000000 (MSR_LASTBRANCH_21_TO_IP)
 MSR 0x000006D6 = 0x00000000:0x00000000 (MSR_LASTBRANCH_22_TO_IP)
 MSR 0x000006D7 = 0x00000000:0x00000000 (MSR_LASTBRANCH_23_TO_IP)
 MSR 0x000006D8 = 0x00000000:0x00000000 (MSR_LASTBRANCH_24_TO_IP)
 MSR 0x000006D9 = 0x00000000:0x00000000 (MSR_LASTBRANCH_25_TO_IP)
 MSR 0x000006DA = 0x00000000:0x00000000 (MSR_LASTBRANCH_26_TO_IP)
 MSR 0x000006DB = 0x00000000:0x00000000 (MSR_LASTBRANCH_27_TO_IP)
 MSR 0x000006DC = 0x00000000:0x00000000 (MSR_LASTBRANCH_28_TO_IP)
 MSR 0x000006DD = 0x00000000:0x00000000 (MSR_LASTBRANCH_29_TO_IP)
 MSR 0x000006DE = 0x00000000:0x00000000 (MSR_LASTBRANCH_30_TO_IP)
 MSR 0x000006DF = 0x00000000:0x00000000 (MSR_LASTBRANCH_31_TO_IP)
 MSR 0x000006E0 = 0x00000039:0x4C1E756E (IA32_TSC_DEADLINE)
 MSR 0x00000771 = 0x00000000:0x010C1824 (IA32_HWP_CAPABILITIES)
 MSR 0x00000773 = 0x00000000:0x00000001 (IA32_HWP_INTERRUPT)
 MSR 0x00000774 = 0x00000000:0x00002408 (IA32_HWP_REQUEST)
 MSR 0x00000777 = 0x00000000:0x00000000 (IA32_HWP_STATUS)
 MSR 0x00000D90 = 0x00000000:0x00000000 (IA32_BNDCFGS)
 MSR 0x00000DA0 = 0x00000000:0x00000000 (IA32_XSS)
 MSR 0x00000DB1 = 0x00000000:0x00000001 (IA32_PM_CTL1)
 MSR 0x00000DB2 = 0x00000000:0x00000000 (IA32_THREAD_STALL)
 MSR 0x00000DC0 = 0x00000000:0x00000000 (IA32_LBR_INFO_0)
 MSR 0x00000DC1 = 0x00000000:0x00000000 (IA32_LBR_INFO_1)
 MSR 0x00000DC2 = 0x00000000:0x00000000 (IA32_LBR_INFO_2)
 MSR 0x00000DC3 = 0x00000000:0x00000000 (IA32_LBR_INFO_3)
 MSR 0x00000DC4 = 0x00000000:0x00000000 (IA32_LBR_INFO_4)
 MSR 0x00000DC5 = 0x00000000:0x00000000 (IA32_LBR_INFO_5)
 MSR 0x00000DC6 = 0x00000000:0x00000000 (IA32_LBR_INFO_6)
 MSR 0x00000DC7 = 0x00000000:0x00000000 (IA32_LBR_INFO_7)
 MSR 0x00000DC8 = 0x00000000:0x00000000 (IA32_LBR_INFO_8)
 MSR 0x00000DC9 = 0x00000000:0x00000000 (IA32_LBR_INFO_9)
 MSR 0x00000DCA = 0x00000000:0x00000000 (IA32_LBR_INFO_10)
 MSR 0x00000DCB = 0x00000000:0x00000000 (IA32_LBR_INFO_11)
 MSR 0x00000DCC = 0x00000000:0x00000000 (IA32_LBR_INFO_12)
 MSR 0x00000DCD = 0x00000000:0x00000000 (IA32_LBR_INFO_13)
 MSR 0x00000DCE = 0x00000000:0x00000000 (IA32_LBR_INFO_14)
 MSR 0x00000DCF = 0x00000000:0x00000000 (IA32_LBR_INFO_15)
 MSR 0x00000DD0 = 0x00000000:0x00000000 (IA32_LBR_INFO_16)
 MSR 0x00000DD1 = 0x00000000:0x00000000 (IA32_LBR_INFO_17)
 MSR 0x00000DD2 = 0x00000000:0x00000000 (IA32_LBR_INFO_18)
 MSR 0x00000DD3 = 0x00000000:0x00000000 (IA32_LBR_INFO_19)
 MSR 0x00000DD4 = 0x00000000:0x00000000 (IA32_LBR_INFO_20)
 MSR 0x00000DD5 = 0x00000000:0x00000000 (IA32_LBR_INFO_21)
 MSR 0x00000DD6 = 0x00000000:0x00000000 (IA32_LBR_INFO_22)
 MSR 0x00000DD7 = 0x00000000:0x00000000 (IA32_LBR_INFO_23)
 MSR 0x00000DD8 = 0x00000000:0x00000000 (IA32_LBR_INFO_24)
 MSR 0x00000DD9 = 0x00000000:0x00000000 (IA32_LBR_INFO_25)
 MSR 0x00000DDA = 0x00000000:0x00000000 (IA32_LBR_INFO_26)
 MSR 0x00000DDB = 0x00000000:0x00000000 (IA32_LBR_INFO_27)
 MSR 0x00000DDC = 0x00000000:0x00000000 (IA32_LBR_INFO_28)
 MSR 0x00000DDD = 0x00000000:0x00000000 (IA32_LBR_INFO_29)
 MSR 0x00000DDE = 0x00000000:0x00000000 (IA32_LBR_INFO_30)
 MSR 0x00000DDF = 0x00000000:0x00000000 (IA32_LBR_INFO_31)

====================== UNIQUE MSRs  (core 6) ======================
 MSR 0x00000000 = 0x00000000:0x00000FFF (IA32_P5_MC_ADDR)
 MSR 0x00000001 = 0x00000000:0x00000000 (IA32_P5_MC_TYPE)
 MSR 0x00000006 = 0x00000000:0x00000040 (IA32_MONITOR_FILTER_SIZE)
 MSR 0x00000010 = 0x00000039:0x4B9A6D70 (IA32_TIME_STAMP_COUNTER)
 MSR 0x0000001B = 0x00000000:0xFEE00C00 (IA32_APIC_BASE)
 MSR 0x00000034 = 0x00000000:0x000001DD (MSR_SMI_COUNT)
 MSR 0x0000003A = 0x00000000:0x00000005 (IA32_FEATURE_CONTROL)
 MSR 0x0000008B = 0x000000F4:0x00000000 (IA32_BIOS_SIGN_ID)
 MSR 0x000000C1 = 0x00000000:0x00000000 (IA32_PMC0)
 MSR 0x000000C2 = 0x00000000:0x00000000 (IA32_PMC1)
 MSR 0x000000C3 = 0x00000000:0x00000000 (IA32_PMC2)
 MSR 0x000000C4 = 0x00000000:0x00000000 (IA32_PMC3)
 MSR 0x000000E2 = 0x00000000:0x1E008008 (MSR_PKG_CST_CONFIG_CONTROL)
 MSR 0x000000E4 = 0x00000000:0x00051814 (MSR_PMG_IO_CAPTURE_BASE)
 MSR 0x000000E7 = 0x00000002:0x24C17581 (IA32_MPERF)
 MSR 0x000000E8 = 0x00000003:0x020B8039 (IA32_APERF)
 MSR 0x000000FE = 0x00000000:0x00001D0A (IA32_MTRRCAP)
 MSR 0x0000013C = 0x00000000:0x00000001 (MSR_FEATURE_CONFIG)
 MSR 0x00000174 = 0x00000000:0x00000010 (IA32_SYSENTER_CS)
 MSR 0x00000175 = 0xFFFFFE00:0x00165000 (IA32_SYSENTER_ESP)
 MSR 0x00000176 = 0xFFFFFFFF:0x8D6018A0 (IA32_SYSENTER_EIP)
 MSR 0x00000179 = 0x00000000:0x00000C0C (IA32_MCG_CAP)
 MSR 0x0000017A = 0x00000000:0x00000000 (IA32_MCG_STATUS)
 MSR 0x00000186 = 0x00000000:0x00000000 (IA32_PERFEVTSEL0)
 MSR 0x00000187 = 0x00000000:0x00000000 (IA32_PERFEVTSEL1)
 MSR 0x00000188 = 0x00000000:0x00000000 (IA32_PERFEVTSEL2)
 MSR 0x00000189 = 0x00000000:0x00000000 (IA32_PERFEVTSEL3)
 MSR 0x00000199 = 0x00000000:0x00000800 (IA32_PERF_CTL)
 MSR 0x0000019A = 0x00000000:0x00000000 (IA32_CLOCK_MODULATION)
 MSR 0x0000019B = 0x00000000:0x00000013 (IA32_THERM_INTERRUPT)
 MSR 0x0000019C = 0x00000000:0x88460800 (IA32_THERM_STATUS)
 MSR 0x000001A0 = 0x00000000:0x00850089 (IA32_MISC_ENABLE)
 MSR 0x000001A4 = 0x00000000:0x00000000 (IA32_MISC_FEATURE_CONTROL)
 MSR 0x000001A6 = 0x00000000:0x00000000 (MSR_OFFCORE_RSP_0)
 MSR 0x000001A7 = 0x00000000:0x00000000 (MSR_OFFCORE_RSP_1)
 MSR 0x000001C8 = 0x00000000:0x00000000 (MSR_LBR_SELECT)
 MSR 0x000001C9 = 0x00000000:0x00000000 (MSR_LASTBRANCH_TOS)
 MSR 0x000001D9 = 0x00000000:0x00004000 (IA32_DEBUGCTL)
 MSR 0x000001DD = 0x00000000:0x00000000 (MSR_LER_FROM_LIP)
 MSR 0x000001DE = 0x00000000:0x00000000 (MSR_LER_TO_LIP)
 MSR 0x000001F2 = 0x00000000:0xBF800006 (IA32_SMRR_PHYSBASE)
 MSR 0x000001F3 = 0x00000000:0xFF800800 (IA32_SMRR_PHYSMASK)
 MSR 0x000001F4 = 0x00000000:0x00000000 (MSR_PRMRR_PHYS_BASE)
 MSR 0x000001F5 = 0x00000000:0x00000000 (MSR_PRMRR_PHYS_MASK)
 MSR 0x000001FB = 0x00000000:0x000000E1 (MSR_PRMRR_VALID_CONFIG)
 MSR 0x000001FC = 0x00000000:0x002C005D (MSR_POWER_CTL)
 MSR 0x00000200 = 0x00000000:0xC0000000 (IA32_MTRR_PHYSBASE0)
 MSR 0x00000201 = 0x0000007F:0xC0000800 (IA32_MTRR_PHYSBASE0)
 MSR 0x00000202 = 0x00000000:0x00000000 (IA32_MTRR_PHYSBASE1)
 MSR 0x00000203 = 0x00000000:0x00000000 (IA32_MTRR_PHYSBASE1)
 MSR 0x00000204 = 0x00000000:0x00000000 (IA32_MTRR_PHYSBASE2)
 MSR 0x00000205 = 0x00000000:0x00000000 (IA32_MTRR_PHYSBASE2)
 MSR 0x00000206 = 0x00000000:0x00000000 (IA32_MTRR_PHYSBASE3)
 MSR 0x00000207 = 0x00000000:0x00000000 (IA32_MTRR_PHYSBASE3)
 MSR 0x00000208 = 0x00000000:0x00000000 (IA32_MTRR_PHYSBASE4)
 MSR 0x00000209 = 0x00000000:0x00000000 (IA32_MTRR_PHYSBASE4)
 MSR 0x0000020A = 0x00000000:0x00000000 (IA32_MTRR_PHYSBASE5)
 MSR 0x0000020B = 0x00000000:0x00000000 (IA32_MTRR_PHYSBASE5)
 MSR 0x0000020C = 0x00000000:0x00000000 (IA32_MTRR_PHYSBASE6)
 MSR 0x0000020D = 0x00000000:0x00000000 (IA32_MTRR_PHYSBASE6)
 MSR 0x0000020E = 0x00000000:0x00000000 (IA32_MTRR_PHYSBASE7)
 MSR 0x0000020F = 0x00000000:0x00000000 (IA32_MTRR_PHYSBASE7)
 MSR 0x00000210 = 0x00000000:0x00000000 (IA32_MTRR_PHYSBASE8)
 MSR 0x00000211 = 0x00000000:0x00000000 (IA32_MTRR_PHYSBASE8)
 MSR 0x00000212 = 0x00000000:0x00000000 (IA32_MTRR_PHYSBASE9)
 MSR 0x00000213 = 0x00000000:0x00000000 (IA32_MTRR_PHYSBASE9)
 MSR 0x00000250 = 0x06060606:0x06060606 (IA32_MTRR_FIX64K_00000)
 MSR 0x00000258 = 0x06060606:0x06060606 (IA32_MTRR_FIX16K_80000)
 MSR 0x00000259 = 0x00000000:0x00000000 (IA32_MTRR_FIX16K_A0000)
 MSR 0x00000268 = 0x05050505:0x05050505 (IA32_MTRR_FIX4K_C0000)
 MSR 0x00000269 = 0x05050505:0x05050505 (IA32_MTRR_FIX4K_C8000)
 MSR 0x0000026A = 0x05050505:0x05050505 (IA32_MTRR_FIX4K_D0000)
 MSR 0x0000026B = 0x05050505:0x05050505 (IA32_MTRR_FIX4K_D8000)
 MSR 0x0000026C = 0x05050505:0x05050505 (IA32_MTRR_FIX4K_E0000)
 MSR 0x0000026D = 0x05050505:0x05050505 (IA32_MTRR_FIX4K_E8000)
 MSR 0x0000026E = 0x05050505:0x05050505 (IA32_MTRR_FIX4K_F0000)
 MSR 0x0000026F = 0x05050505:0x05050505 (IA32_MTRR_FIX4K_F8000)
 MSR 0x00000277 = 0x04070506:0x00070106 (IA32_PAT)
 MSR 0x00000280 = 0x00000000:0x40000001 (IA32_MC0_CTL2)
 MSR 0x00000281 = 0x00000000:0x40000001 (IA32_MC1_CTL2)
 MSR 0x00000282 = 0x00000000:0x40000001 (IA32_MC2_CTL2)
 MSR 0x00000283 = 0x00000000:0x40000001 (IA32_MC3_CTL2)
 MSR 0x000002FF = 0x00000000:0x00000C06 (IA32_MTRR_DEF_TYPE)
 MSR 0x00000309 = 0x00000000:0x00000000 (IA32_FIXED_CTR0)
 MSR 0x0000030A = 0x0000FFFD:0x5A280064 (IA32_FIXED_CTR1)
 MSR 0x0000030B = 0x00000000:0x00000000 (IA32_FIXED_CTR2)
 MSR 0x00000345 = 0x00000000:0x000033C5 (IA32_PERF_CAPABILITIES)
 MSR 0x0000038D = 0x00000000:0x000000B0 (IA32_FIXED_CTR_CTRL)
 MSR 0x0000038E = 0x00000000:0x00000000 (IA32_PERF_GLOBAL_STATUS)
 MSR 0x0000038F = 0x00000007:0x0000000F (IA32_PERF_GLOBAL_CTRL)
 MSR 0x00000390 = 0x00000000:0x00000000 (IA32_PERF_GLOBAL_STATUS_RESET)
 MSR 0x00000391 = 0x00000000:0x00000000 (IA32_PERF_GLOBAL_STATUS_SET)
 MSR 0x000003F1 = 0x00000000:0x00000000 (MSR_PEBS_ENABLE)
 MSR 0x000003F6 = 0x00000000:0x0000FFFF (MSR_PEBS_LD_LAT)
 MSR 0x000003F7 = 0x00000000:0x00000800 (MSR_PEBS_FRONTEND)
 MSR 0x000003FC = 0x00000000:0x314253A8 (MSR_CORE_C3_RESIDENCY)
 MSR 0x000003FD = 0x00000001:0x0EACAF88 (MSR_CORE_C6_RESIDENCY)
 MSR 0x000003FE = 0x00000027:0x3790F938 (MSR_CORE_C7_RESIDENCY)
 MSR 0x00000400 = 0x00000000:0x00000FFF (IA32_MC0_CTL)
 MSR 0x00000401 = 0x00000000:0x00000000 (IA32_MC0_STATUS)
 MSR 0x00000402 = 0x00000000:0x00000000 (IA32_MC0_ADDR)
 MSR 0x00000403 = 0x00000000:0x00000000 (IA32_MC0_MISC)
 MSR 0x00000404 = 0x00000000:0x0000000F (IA32_MC1_CTL)
 MSR 0x00000405 = 0x00000000:0x00000000 (IA32_MC1_STATUS)
 MSR 0x00000406 = 0x00000000:0x00000000 (IA32_MC1_ADDR)
 MSR 0x00000407 = 0x00000000:0x00000000 (IA32_MC1_MISC)
 MSR 0x00000408 = 0x00000000:0x0000000F (IA32_MC2_CTL)
 MSR 0x00000409 = 0x00000000:0x00000000 (IA32_MC2_STATUS)
 MSR 0x0000040A = 0x00000000:0x00000000 (IA32_MC2_ADDR)
 MSR 0x0000040C = 0x00000000:0x0000001F (IA32_MC3_CTL)
 MSR 0x0000040D = 0x00000000:0x00000000 (IA32_MC3_STATUS)
 MSR 0x0000040E = 0x00000000:0x00000000 (IA32_MC3_ADDR)
 MSR 0x00000410 = 0x00000000:0x0000003F (IA32_MC4_CTL)
 MSR 0x00000411 = 0x00000000:0x00000000 (IA32_MC4_STATUS)
 MSR 0x00000480 = 0x00DA0400:0x00000004 (IA32_VMX_BASIC)
 MSR 0x00000481 = 0x0000007F:0x00000016 (IA32_VMX_PINBASED_CTLS)
 MSR 0x00000482 = 0xFFF9FFFE:0x0401E172 (IA32_VMX_PROCBASED_CTLS)
 MSR 0x00000483 = 0x01FFFFFF:0x00036DFF (IA32_VMX_EXIT_CTLS)
 MSR 0x00000484 = 0x0003FFFF:0x000011FF (IA32_VMX_ENTRY_CTLS)
 MSR 0x00000485 = 0x00000000:0x7004C1E7 (IA32_VMX_MISC)
 MSR 0x00000486 = 0x00000000:0x80000021 (IA32_VMX_CR0_FIXED0)
 MSR 0x00000487 = 0x00000000:0xFFFFFFFF (IA32_VMX_CR0_FIXED1)
 MSR 0x00000488 = 0x00000000:0x00002000 (IA32_VMX_CR4_FIXED0)
 MSR 0x00000489 = 0x00000000:0x003767FF (IA32_VMX_CR4_FIXED1)
 MSR 0x0000048A = 0x00000000:0x0000002E (IA32_VMX_VMCS_ENUM)
 MSR 0x0000048B = 0x005FFCFF:0x00000000 (IA32_VMX_PROCBASED_CTLS2)
 MSR 0x0000048C = 0x00000F01:0x06734141 (IA32_VMX_EPT_VPID_ENUM)
 MSR 0x0000048D = 0x0000007F:0x00000016 (IA32_VMX_TRUE_PINBASED_CTLS)
 MSR 0x0000048E = 0xFFF9FFFE:0x04006172 (IA32_VMX_TRUE_PROCBASED_CTLS)
 MSR 0x0000048F = 0x01FFFFFF:0x00036DFB (IA32_VMX_TRUE_EXIT_CTLS)
 MSR 0x00000490 = 0x0003FFFF:0x000011FB (IA32_VMX_TRUE_ENTRY_CTLS)
 MSR 0x000004C1 = 0x00000000:0x00000000 (IA32_A_PMC0)
 MSR 0x000004C2 = 0x00000000:0x00000000 (IA32_A_PMC1)
 MSR 0x000004C3 = 0x00000000:0x00000000 (IA32_A_PMC2)
 MSR 0x000004C4 = 0x00000000:0x00000000 (IA32_A_PMC3)
 MSR 0x00000500 = 0x00000000:0x00020000 (IA32_SGX_SVN_STATUS)
 MSR 0x00000560 = 0x00000000:0x00000000 (IA32_RTIT_OUTPUT_BASE)
 MSR 0x00000561 = 0x00000000:0x0000007F (IA32_RTIT_OUTPUT_MASK_PTRS)
 MSR 0x00000570 = 0x00000000:0x00000000 (IA32_RTIT_CTL)
 MSR 0x00000571 = 0x00000000:0x00000000 (IA32_RTIT_STATUS)
 MSR 0x00000572 = 0x00000000:0x00000000 (IA32_RTIT_CR3_MATCH)
 MSR 0x00000580 = 0x00000000:0x00000000 (IA32_RTIT_ADDR0_A)
 MSR 0x00000581 = 0x00000000:0x00000000 (IA32_RTIT_ADDR0_B)
 MSR 0x00000582 = 0x00000000:0x00000000 (IA32_RTIT_ADDR1_A)
 MSR 0x00000583 = 0x00000000:0x00000000 (IA32_RTIT_ADDR1_B)
 MSR 0x00000600 = 0xFFFFFE00:0x0017D000 (IA32_DS_AREA)
 MSR 0x0000064E = 0x00000002:0xBCBDB83F (MSR_PPERF)
 MSR 0x00000653 = 0x00000000:0x00000000 (MSR_CORE_HDC_RESIDENCY)
 MSR 0x00000690 = 0x00000000:0x00000000 (MSR_LASTBRANCH_16_FROM_IP)
 MSR 0x00000691 = 0x00000000:0x00000000 (MSR_LASTBRANCH_17_FROM_IP)
 MSR 0x00000692 = 0x00000000:0x00000000 (MSR_LASTBRANCH_18_FROM_IP)
 MSR 0x00000693 = 0x00000000:0x00000000 (MSR_LASTBRANCH_19_FROM_IP)
 MSR 0x00000694 = 0x00000000:0x00000000 (MSR_LASTBRANCH_20_FROM_IP)
 MSR 0x00000695 = 0x00000000:0x00000000 (MSR_LASTBRANCH_21_FROM_IP)
 MSR 0x00000696 = 0x00000000:0x00000000 (MSR_LASTBRANCH_22_FROM_IP)
 MSR 0x00000697 = 0x00000000:0x00000000 (MSR_LASTBRANCH_23_FROM_IP)
 MSR 0x00000698 = 0x00000000:0x00000000 (MSR_LASTBRANCH_24_FROM_IP)
 MSR 0x00000699 = 0x00000000:0x00000000 (MSR_LASTBRANCH_25_FROM_IP)
 MSR 0x0000069A = 0x00000000:0x00000000 (MSR_LASTBRANCH_26_FROM_IP)
 MSR 0x0000069B = 0x00000000:0x00000000 (MSR_LASTBRANCH_27_FROM_IP)
 MSR 0x0000069C = 0x00000000:0x00000000 (MSR_LASTBRANCH_28_FROM_IP)
 MSR 0x0000069D = 0x00000000:0x00000000 (MSR_LASTBRANCH_29_FROM_IP)
 MSR 0x0000069E = 0x00000000:0x00000000 (MSR_LASTBRANCH_30_FROM_IP)
 MSR 0x0000069F = 0x00000000:0x00000000 (MSR_LASTBRANCH_31_FROM_IP)
 MSR 0x000006D0 = 0x00000000:0x00000000 (MSR_LASTBRANCH_16_TO_IP)
 MSR 0x000006D1 = 0x00000000:0x00000000 (MSR_LASTBRANCH_17_TO_IP)
 MSR 0x000006D2 = 0x00000000:0x00000000 (MSR_LASTBRANCH_18_TO_IP)
 MSR 0x000006D3 = 0x00000000:0x00000000 (MSR_LASTBRANCH_19_TO_IP)
 MSR 0x000006D4 = 0x00000000:0x00000000 (MSR_LASTBRANCH_20_TO_IP)
 MSR 0x000006D5 = 0x00000000:0x00000000 (MSR_LASTBRANCH_21_TO_IP)
 MSR 0x000006D6 = 0x00000000:0x00000000 (MSR_LASTBRANCH_22_TO_IP)
 MSR 0x000006D7 = 0x00000000:0x00000000 (MSR_LASTBRANCH_23_TO_IP)
 MSR 0x000006D8 = 0x00000000:0x00000000 (MSR_LASTBRANCH_24_TO_IP)
 MSR 0x000006D9 = 0x00000000:0x00000000 (MSR_LASTBRANCH_25_TO_IP)
 MSR 0x000006DA = 0x00000000:0x00000000 (MSR_LASTBRANCH_26_TO_IP)
 MSR 0x000006DB = 0x00000000:0x00000000 (MSR_LASTBRANCH_27_TO_IP)
 MSR 0x000006DC = 0x00000000:0x00000000 (MSR_LASTBRANCH_28_TO_IP)
 MSR 0x000006DD = 0x00000000:0x00000000 (MSR_LASTBRANCH_29_TO_IP)
 MSR 0x000006DE = 0x00000000:0x00000000 (MSR_LASTBRANCH_30_TO_IP)
 MSR 0x000006DF = 0x00000000:0x00000000 (MSR_LASTBRANCH_31_TO_IP)
 MSR 0x000006E0 = 0x00000039:0x4C1E757A (IA32_TSC_DEADLINE)
 MSR 0x00000771 = 0x00000000:0x010D1824 (IA32_HWP_CAPABILITIES)
 MSR 0x00000773 = 0x00000000:0x00000001 (IA32_HWP_INTERRUPT)
 MSR 0x00000774 = 0x00000000:0x00002408 (IA32_HWP_REQUEST)
 MSR 0x00000777 = 0x00000000:0x00000000 (IA32_HWP_STATUS)
 MSR 0x00000D90 = 0x00000000:0x00000000 (IA32_BNDCFGS)
 MSR 0x00000DA0 = 0x00000000:0x00000000 (IA32_XSS)
 MSR 0x00000DB1 = 0x00000000:0x00000001 (IA32_PM_CTL1)
 MSR 0x00000DB2 = 0x00000000:0x00000000 (IA32_THREAD_STALL)
 MSR 0x00000DC0 = 0x00000000:0x00000000 (IA32_LBR_INFO_0)
 MSR 0x00000DC1 = 0x00000000:0x00000000 (IA32_LBR_INFO_1)
 MSR 0x00000DC2 = 0x00000000:0x00000000 (IA32_LBR_INFO_2)
 MSR 0x00000DC3 = 0x00000000:0x00000000 (IA32_LBR_INFO_3)
 MSR 0x00000DC4 = 0x00000000:0x00000000 (IA32_LBR_INFO_4)
 MSR 0x00000DC5 = 0x00000000:0x00000000 (IA32_LBR_INFO_5)
 MSR 0x00000DC6 = 0x00000000:0x00000000 (IA32_LBR_INFO_6)
 MSR 0x00000DC7 = 0x00000000:0x00000000 (IA32_LBR_INFO_7)
 MSR 0x00000DC8 = 0x00000000:0x00000000 (IA32_LBR_INFO_8)
 MSR 0x00000DC9 = 0x00000000:0x00000000 (IA32_LBR_INFO_9)
 MSR 0x00000DCA = 0x00000000:0x00000000 (IA32_LBR_INFO_10)
 MSR 0x00000DCB = 0x00000000:0x00000000 (IA32_LBR_INFO_11)
 MSR 0x00000DCC = 0x00000000:0x00000000 (IA32_LBR_INFO_12)
 MSR 0x00000DCD = 0x00000000:0x00000000 (IA32_LBR_INFO_13)
 MSR 0x00000DCE = 0x00000000:0x00000000 (IA32_LBR_INFO_14)
 MSR 0x00000DCF = 0x00000000:0x00000000 (IA32_LBR_INFO_15)
 MSR 0x00000DD0 = 0x00000000:0x00000000 (IA32_LBR_INFO_16)
 MSR 0x00000DD1 = 0x00000000:0x00000000 (IA32_LBR_INFO_17)
 MSR 0x00000DD2 = 0x00000000:0x00000000 (IA32_LBR_INFO_18)
 MSR 0x00000DD3 = 0x00000000:0x00000000 (IA32_LBR_INFO_19)
 MSR 0x00000DD4 = 0x00000000:0x00000000 (IA32_LBR_INFO_20)
 MSR 0x00000DD5 = 0x00000000:0x00000000 (IA32_LBR_INFO_21)
 MSR 0x00000DD6 = 0x00000000:0x00000000 (IA32_LBR_INFO_22)
 MSR 0x00000DD7 = 0x00000000:0x00000000 (IA32_LBR_INFO_23)
 MSR 0x00000DD8 = 0x00000000:0x00000000 (IA32_LBR_INFO_24)
 MSR 0x00000DD9 = 0x00000000:0x00000000 (IA32_LBR_INFO_25)
 MSR 0x00000DDA = 0x00000000:0x00000000 (IA32_LBR_INFO_26)
 MSR 0x00000DDB = 0x00000000:0x00000000 (IA32_LBR_INFO_27)
 MSR 0x00000DDC = 0x00000000:0x00000000 (IA32_LBR_INFO_28)
 MSR 0x00000DDD = 0x00000000:0x00000000 (IA32_LBR_INFO_29)
 MSR 0x00000DDE = 0x00000000:0x00000000 (IA32_LBR_INFO_30)
 MSR 0x00000DDF = 0x00000000:0x00000000 (IA32_LBR_INFO_31)

====================== UNIQUE MSRs  (core 7) ======================
 MSR 0x00000000 = 0x00000000:0x00000FFF (IA32_P5_MC_ADDR)
 MSR 0x00000001 = 0x00000000:0x00000000 (IA32_P5_MC_TYPE)
 MSR 0x00000006 = 0x00000000:0x00000040 (IA32_MONITOR_FILTER_SIZE)
 MSR 0x00000010 = 0x00000039:0x4BC4D3F0 (IA32_TIME_STAMP_COUNTER)
 MSR 0x0000001B = 0x00000000:0xFEE00C00 (IA32_APIC_BASE)
 MSR 0x00000034 = 0x00000000:0x000001DD (MSR_SMI_COUNT)
 MSR 0x0000003A = 0x00000000:0x00000005 (IA32_FEATURE_CONTROL)
 MSR 0x0000008B = 0x000000F4:0x00000000 (IA32_BIOS_SIGN_ID)
 MSR 0x000000C1 = 0x00000000:0x00000000 (IA32_PMC0)
 MSR 0x000000C2 = 0x00000000:0x00000000 (IA32_PMC1)
 MSR 0x000000C3 = 0x00000000:0x00000000 (IA32_PMC2)
 MSR 0x000000C4 = 0x00000000:0x00000000 (IA32_PMC3)
 MSR 0x000000E2 = 0x00000000:0x1E008008 (MSR_PKG_CST_CONFIG_CONTROL)
 MSR 0x000000E4 = 0x00000000:0x00051814 (MSR_PMG_IO_CAPTURE_BASE)
 MSR 0x000000E7 = 0x00000003:0x6B69D4EF (IA32_MPERF)
 MSR 0x000000E8 = 0x00000004:0xBFD7AB2E (IA32_APERF)
 MSR 0x000000FE = 0x00000000:0x00001D0A (IA32_MTRRCAP)
 MSR 0x0000013C = 0x00000000:0x00000001 (MSR_FEATURE_CONFIG)
 MSR 0x00000174 = 0x00000000:0x00000010 (IA32_SYSENTER_CS)
 MSR 0x00000175 = 0xFFFFFE00:0x001A0000 (IA32_SYSENTER_ESP)
 MSR 0x00000176 = 0xFFFFFFFF:0x8D6018A0 (IA32_SYSENTER_EIP)
 MSR 0x00000179 = 0x00000000:0x00000C0C (IA32_MCG_CAP)
 MSR 0x0000017A = 0x00000000:0x00000000 (IA32_MCG_STATUS)
 MSR 0x00000186 = 0x00000000:0x00000000 (IA32_PERFEVTSEL0)
 MSR 0x00000187 = 0x00000000:0x00000000 (IA32_PERFEVTSEL1)
 MSR 0x00000188 = 0x00000000:0x00000000 (IA32_PERFEVTSEL2)
 MSR 0x00000189 = 0x00000000:0x00000000 (IA32_PERFEVTSEL3)
 MSR 0x00000199 = 0x00000000:0x00000800 (IA32_PERF_CTL)
 MSR 0x0000019A = 0x00000000:0x00000000 (IA32_CLOCK_MODULATION)
 MSR 0x0000019B = 0x00000000:0x00000013 (IA32_THERM_INTERRUPT)
 MSR 0x0000019C = 0x00000000:0x88460800 (IA32_THERM_STATUS)
 MSR 0x000001A0 = 0x00000000:0x00850089 (IA32_MISC_ENABLE)
 MSR 0x000001A4 = 0x00000000:0x00000000 (IA32_MISC_FEATURE_CONTROL)
 MSR 0x000001A6 = 0x00000000:0x00000000 (MSR_OFFCORE_RSP_0)
 MSR 0x000001A7 = 0x00000000:0x00000000 (MSR_OFFCORE_RSP_1)
 MSR 0x000001C8 = 0x00000000:0x00000000 (MSR_LBR_SELECT)
 MSR 0x000001C9 = 0x00000000:0x00000000 (MSR_LASTBRANCH_TOS)
 MSR 0x000001D9 = 0x00000000:0x00004000 (IA32_DEBUGCTL)
 MSR 0x000001DD = 0x00000000:0x00000000 (MSR_LER_FROM_LIP)
 MSR 0x000001DE = 0x00000000:0x00000000 (MSR_LER_TO_LIP)
 MSR 0x000001F2 = 0x00000000:0xBF800006 (IA32_SMRR_PHYSBASE)
 MSR 0x000001F3 = 0x00000000:0xFF800800 (IA32_SMRR_PHYSMASK)
 MSR 0x000001F4 = 0x00000000:0x00000000 (MSR_PRMRR_PHYS_BASE)
 MSR 0x000001F5 = 0x00000000:0x00000000 (MSR_PRMRR_PHYS_MASK)
 MSR 0x000001FB = 0x00000000:0x000000E1 (MSR_PRMRR_VALID_CONFIG)
 MSR 0x000001FC = 0x00000000:0x002C005D (MSR_POWER_CTL)
 MSR 0x00000200 = 0x00000000:0xC0000000 (IA32_MTRR_PHYSBASE0)
 MSR 0x00000201 = 0x0000007F:0xC0000800 (IA32_MTRR_PHYSBASE0)
 MSR 0x00000202 = 0x00000000:0x00000000 (IA32_MTRR_PHYSBASE1)
 MSR 0x00000203 = 0x00000000:0x00000000 (IA32_MTRR_PHYSBASE1)
 MSR 0x00000204 = 0x00000000:0x00000000 (IA32_MTRR_PHYSBASE2)
 MSR 0x00000205 = 0x00000000:0x00000000 (IA32_MTRR_PHYSBASE2)
 MSR 0x00000206 = 0x00000000:0x00000000 (IA32_MTRR_PHYSBASE3)
 MSR 0x00000207 = 0x00000000:0x00000000 (IA32_MTRR_PHYSBASE3)
 MSR 0x00000208 = 0x00000000:0x00000000 (IA32_MTRR_PHYSBASE4)
 MSR 0x00000209 = 0x00000000:0x00000000 (IA32_MTRR_PHYSBASE4)
 MSR 0x0000020A = 0x00000000:0x00000000 (IA32_MTRR_PHYSBASE5)
 MSR 0x0000020B = 0x00000000:0x00000000 (IA32_MTRR_PHYSBASE5)
 MSR 0x0000020C = 0x00000000:0x00000000 (IA32_MTRR_PHYSBASE6)
 MSR 0x0000020D = 0x00000000:0x00000000 (IA32_MTRR_PHYSBASE6)
 MSR 0x0000020E = 0x00000000:0x00000000 (IA32_MTRR_PHYSBASE7)
 MSR 0x0000020F = 0x00000000:0x00000000 (IA32_MTRR_PHYSBASE7)
 MSR 0x00000210 = 0x00000000:0x00000000 (IA32_MTRR_PHYSBASE8)
 MSR 0x00000211 = 0x00000000:0x00000000 (IA32_MTRR_PHYSBASE8)
 MSR 0x00000212 = 0x00000000:0x00000000 (IA32_MTRR_PHYSBASE9)
 MSR 0x00000213 = 0x00000000:0x00000000 (IA32_MTRR_PHYSBASE9)
 MSR 0x00000250 = 0x06060606:0x06060606 (IA32_MTRR_FIX64K_00000)
 MSR 0x00000258 = 0x06060606:0x06060606 (IA32_MTRR_FIX16K_80000)
 MSR 0x00000259 = 0x00000000:0x00000000 (IA32_MTRR_FIX16K_A0000)
 MSR 0x00000268 = 0x05050505:0x05050505 (IA32_MTRR_FIX4K_C0000)
 MSR 0x00000269 = 0x05050505:0x05050505 (IA32_MTRR_FIX4K_C8000)
 MSR 0x0000026A = 0x05050505:0x05050505 (IA32_MTRR_FIX4K_D0000)
 MSR 0x0000026B = 0x05050505:0x05050505 (IA32_MTRR_FIX4K_D8000)
 MSR 0x0000026C = 0x05050505:0x05050505 (IA32_MTRR_FIX4K_E0000)
 MSR 0x0000026D = 0x05050505:0x05050505 (IA32_MTRR_FIX4K_E8000)
 MSR 0x0000026E = 0x05050505:0x05050505 (IA32_MTRR_FIX4K_F0000)
 MSR 0x0000026F = 0x05050505:0x05050505 (IA32_MTRR_FIX4K_F8000)
 MSR 0x00000277 = 0x04070506:0x00070106 (IA32_PAT)
 MSR 0x00000280 = 0x00000000:0x40000001 (IA32_MC0_CTL2)
 MSR 0x00000281 = 0x00000000:0x40000001 (IA32_MC1_CTL2)
 MSR 0x00000282 = 0x00000000:0x40000001 (IA32_MC2_CTL2)
 MSR 0x00000283 = 0x00000000:0x40000001 (IA32_MC3_CTL2)
 MSR 0x000002FF = 0x00000000:0x00000C06 (IA32_MTRR_DEF_TYPE)
 MSR 0x00000309 = 0x00000000:0x00000000 (IA32_FIXED_CTR0)
 MSR 0x0000030A = 0x0000FFFF:0x198B6739 (IA32_FIXED_CTR1)
 MSR 0x0000030B = 0x00000000:0x00000000 (IA32_FIXED_CTR2)
 MSR 0x00000345 = 0x00000000:0x000033C5 (IA32_PERF_CAPABILITIES)
 MSR 0x0000038D = 0x00000000:0x000000B0 (IA32_FIXED_CTR_CTRL)
 MSR 0x0000038E = 0x00000000:0x00000000 (IA32_PERF_GLOBAL_STATUS)
 MSR 0x0000038F = 0x00000007:0x0000000F (IA32_PERF_GLOBAL_CTRL)
 MSR 0x00000390 = 0x00000000:0x00000000 (IA32_PERF_GLOBAL_STATUS_RESET)
 MSR 0x00000391 = 0x00000000:0x00000000 (IA32_PERF_GLOBAL_STATUS_SET)
 MSR 0x000003F1 = 0x00000000:0x00000000 (MSR_PEBS_ENABLE)
 MSR 0x000003F6 = 0x00000000:0x0000FFFF (MSR_PEBS_LD_LAT)
 MSR 0x000003F7 = 0x00000000:0x00000800 (MSR_PEBS_FRONTEND)
 MSR 0x000003FC = 0x00000000:0x7EC787C8 (MSR_CORE_C3_RESIDENCY)
 MSR 0x000003FD = 0x00000001:0xB2516160 (MSR_CORE_C6_RESIDENCY)
 MSR 0x000003FE = 0x00000023:0xB23DCDE8 (MSR_CORE_C7_RESIDENCY)
 MSR 0x00000400 = 0x00000000:0x00000FFF (IA32_MC0_CTL)
 MSR 0x00000401 = 0x00000000:0x00000000 (IA32_MC0_STATUS)
 MSR 0x00000402 = 0x00000000:0x00000000 (IA32_MC0_ADDR)
 MSR 0x00000403 = 0x00000000:0x00000000 (IA32_MC0_MISC)
 MSR 0x00000404 = 0x00000000:0x0000000F (IA32_MC1_CTL)
 MSR 0x00000405 = 0x00000000:0x00000000 (IA32_MC1_STATUS)
 MSR 0x00000406 = 0x00000000:0x00000000 (IA32_MC1_ADDR)
 MSR 0x00000407 = 0x00000000:0x00000000 (IA32_MC1_MISC)
 MSR 0x00000408 = 0x00000000:0x0000000F (IA32_MC2_CTL)
 MSR 0x00000409 = 0x00000000:0x00000000 (IA32_MC2_STATUS)
 MSR 0x0000040A = 0x00000000:0x00000000 (IA32_MC2_ADDR)
 MSR 0x0000040C = 0x00000000:0x0000001F (IA32_MC3_CTL)
 MSR 0x0000040D = 0x00000000:0x00000000 (IA32_MC3_STATUS)
 MSR 0x0000040E = 0x00000000:0x00000000 (IA32_MC3_ADDR)
 MSR 0x00000410 = 0x00000000:0x0000003F (IA32_MC4_CTL)
 MSR 0x00000411 = 0x00000000:0x00000000 (IA32_MC4_STATUS)
 MSR 0x00000480 = 0x00DA0400:0x00000004 (IA32_VMX_BASIC)
 MSR 0x00000481 = 0x0000007F:0x00000016 (IA32_VMX_PINBASED_CTLS)
 MSR 0x00000482 = 0xFFF9FFFE:0x0401E172 (IA32_VMX_PROCBASED_CTLS)
 MSR 0x00000483 = 0x01FFFFFF:0x00036DFF (IA32_VMX_EXIT_CTLS)
 MSR 0x00000484 = 0x0003FFFF:0x000011FF (IA32_VMX_ENTRY_CTLS)
 MSR 0x00000485 = 0x00000000:0x7004C1E7 (IA32_VMX_MISC)
 MSR 0x00000486 = 0x00000000:0x80000021 (IA32_VMX_CR0_FIXED0)
 MSR 0x00000487 = 0x00000000:0xFFFFFFFF (IA32_VMX_CR0_FIXED1)
 MSR 0x00000488 = 0x00000000:0x00002000 (IA32_VMX_CR4_FIXED0)
 MSR 0x00000489 = 0x00000000:0x003767FF (IA32_VMX_CR4_FIXED1)
 MSR 0x0000048A = 0x00000000:0x0000002E (IA32_VMX_VMCS_ENUM)
 MSR 0x0000048B = 0x005FFCFF:0x00000000 (IA32_VMX_PROCBASED_CTLS2)
 MSR 0x0000048C = 0x00000F01:0x06734141 (IA32_VMX_EPT_VPID_ENUM)
 MSR 0x0000048D = 0x0000007F:0x00000016 (IA32_VMX_TRUE_PINBASED_CTLS)
 MSR 0x0000048E = 0xFFF9FFFE:0x04006172 (IA32_VMX_TRUE_PROCBASED_CTLS)
 MSR 0x0000048F = 0x01FFFFFF:0x00036DFB (IA32_VMX_TRUE_EXIT_CTLS)
 MSR 0x00000490 = 0x0003FFFF:0x000011FB (IA32_VMX_TRUE_ENTRY_CTLS)
 MSR 0x000004C1 = 0x00000000:0x00000000 (IA32_A_PMC0)
 MSR 0x000004C2 = 0x00000000:0x00000000 (IA32_A_PMC1)
 MSR 0x000004C3 = 0x00000000:0x00000000 (IA32_A_PMC2)
 MSR 0x000004C4 = 0x00000000:0x00000000 (IA32_A_PMC3)
 MSR 0x00000500 = 0x00000000:0x00020000 (IA32_SGX_SVN_STATUS)
 MSR 0x00000560 = 0x00000000:0x00000000 (IA32_RTIT_OUTPUT_BASE)
 MSR 0x00000561 = 0x00000000:0x0000007F (IA32_RTIT_OUTPUT_MASK_PTRS)
 MSR 0x00000570 = 0x00000000:0x00000000 (IA32_RTIT_CTL)
 MSR 0x00000571 = 0x00000000:0x00000000 (IA32_RTIT_STATUS)
 MSR 0x00000572 = 0x00000000:0x00000000 (IA32_RTIT_CR3_MATCH)
 MSR 0x00000580 = 0x00000000:0x00000000 (IA32_RTIT_ADDR0_A)
 MSR 0x00000581 = 0x00000000:0x00000000 (IA32_RTIT_ADDR0_B)
 MSR 0x00000582 = 0x00000000:0x00000000 (IA32_RTIT_ADDR1_A)
 MSR 0x00000583 = 0x00000000:0x00000000 (IA32_RTIT_ADDR1_B)
 MSR 0x00000600 = 0xFFFFFE00:0x001B8000 (IA32_DS_AREA)
 MSR 0x0000064E = 0x00000004:0x231E96B0 (MSR_PPERF)
 MSR 0x00000653 = 0x00000000:0x00000000 (MSR_CORE_HDC_RESIDENCY)
 MSR 0x00000690 = 0x00000000:0x00000000 (MSR_LASTBRANCH_16_FROM_IP)
 MSR 0x00000691 = 0x00000000:0x00000000 (MSR_LASTBRANCH_17_FROM_IP)
 MSR 0x00000692 = 0x00000000:0x00000000 (MSR_LASTBRANCH_18_FROM_IP)
 MSR 0x00000693 = 0x00000000:0x00000000 (MSR_LASTBRANCH_19_FROM_IP)
 MSR 0x00000694 = 0x00000000:0x00000000 (MSR_LASTBRANCH_20_FROM_IP)
 MSR 0x00000695 = 0x00000000:0x00000000 (MSR_LASTBRANCH_21_FROM_IP)
 MSR 0x00000696 = 0x00000000:0x00000000 (MSR_LASTBRANCH_22_FROM_IP)
 MSR 0x00000697 = 0x00000000:0x00000000 (MSR_LASTBRANCH_23_FROM_IP)
 MSR 0x00000698 = 0x00000000:0x00000000 (MSR_LASTBRANCH_24_FROM_IP)
 MSR 0x00000699 = 0x00000000:0x00000000 (MSR_LASTBRANCH_25_FROM_IP)
 MSR 0x0000069A = 0x00000000:0x00000000 (MSR_LASTBRANCH_26_FROM_IP)
 MSR 0x0000069B = 0x00000000:0x00000000 (MSR_LASTBRANCH_27_FROM_IP)
 MSR 0x0000069C = 0x00000000:0x00000000 (MSR_LASTBRANCH_28_FROM_IP)
 MSR 0x0000069D = 0x00000000:0x00000000 (MSR_LASTBRANCH_29_FROM_IP)
 MSR 0x0000069E = 0x00000000:0x00000000 (MSR_LASTBRANCH_30_FROM_IP)
 MSR 0x0000069F = 0x00000000:0x00000000 (MSR_LASTBRANCH_31_FROM_IP)
 MSR 0x000006D0 = 0x00000000:0x00000000 (MSR_LASTBRANCH_16_TO_IP)
 MSR 0x000006D1 = 0x00000000:0x00000000 (MSR_LASTBRANCH_17_TO_IP)
 MSR 0x000006D2 = 0x00000000:0x00000000 (MSR_LASTBRANCH_18_TO_IP)
 MSR 0x000006D3 = 0x00000000:0x00000000 (MSR_LASTBRANCH_19_TO_IP)
 MSR 0x000006D4 = 0x00000000:0x00000000 (MSR_LASTBRANCH_20_TO_IP)
 MSR 0x000006D5 = 0x00000000:0x00000000 (MSR_LASTBRANCH_21_TO_IP)
 MSR 0x000006D6 = 0x00000000:0x00000000 (MSR_LASTBRANCH_22_TO_IP)
 MSR 0x000006D7 = 0x00000000:0x00000000 (MSR_LASTBRANCH_23_TO_IP)
 MSR 0x000006D8 = 0x00000000:0x00000000 (MSR_LASTBRANCH_24_TO_IP)
 MSR 0x000006D9 = 0x00000000:0x00000000 (MSR_LASTBRANCH_25_TO_IP)
 MSR 0x000006DA = 0x00000000:0x00000000 (MSR_LASTBRANCH_26_TO_IP)
 MSR 0x000006DB = 0x00000000:0x00000000 (MSR_LASTBRANCH_27_TO_IP)
 MSR 0x000006DC = 0x00000000:0x00000000 (MSR_LASTBRANCH_28_TO_IP)
 MSR 0x000006DD = 0x00000000:0x00000000 (MSR_LASTBRANCH_29_TO_IP)
 MSR 0x000006DE = 0x00000000:0x00000000 (MSR_LASTBRANCH_30_TO_IP)
 MSR 0x000006DF = 0x00000000:0x00000000 (MSR_LASTBRANCH_31_TO_IP)
 MSR 0x000006E0 = 0x00000039:0x4C1E6F0C (IA32_TSC_DEADLINE)
 MSR 0x00000771 = 0x00000000:0x010D1824 (IA32_HWP_CAPABILITIES)
 MSR 0x00000773 = 0x00000000:0x00000001 (IA32_HWP_INTERRUPT)
 MSR 0x00000774 = 0x00000000:0x00002408 (IA32_HWP_REQUEST)
 MSR 0x00000777 = 0x00000000:0x00000000 (IA32_HWP_STATUS)
 MSR 0x00000D90 = 0x00000000:0x00000000 (IA32_BNDCFGS)
 MSR 0x00000DA0 = 0x00000000:0x00000000 (IA32_XSS)
 MSR 0x00000DB1 = 0x00000000:0x00000001 (IA32_PM_CTL1)
 MSR 0x00000DB2 = 0x00000000:0x00000000 (IA32_THREAD_STALL)
 MSR 0x00000DC0 = 0x00000000:0x00000000 (IA32_LBR_INFO_0)
 MSR 0x00000DC1 = 0x00000000:0x00000000 (IA32_LBR_INFO_1)
 MSR 0x00000DC2 = 0x00000000:0x00000000 (IA32_LBR_INFO_2)
 MSR 0x00000DC3 = 0x00000000:0x00000000 (IA32_LBR_INFO_3)
 MSR 0x00000DC4 = 0x00000000:0x00000000 (IA32_LBR_INFO_4)
 MSR 0x00000DC5 = 0x00000000:0x00000000 (IA32_LBR_INFO_5)
 MSR 0x00000DC6 = 0x00000000:0x00000000 (IA32_LBR_INFO_6)
 MSR 0x00000DC7 = 0x00000000:0x00000000 (IA32_LBR_INFO_7)
 MSR 0x00000DC8 = 0x00000000:0x00000000 (IA32_LBR_INFO_8)
 MSR 0x00000DC9 = 0x00000000:0x00000000 (IA32_LBR_INFO_9)
 MSR 0x00000DCA = 0x00000000:0x00000000 (IA32_LBR_INFO_10)
 MSR 0x00000DCB = 0x00000000:0x00000000 (IA32_LBR_INFO_11)
 MSR 0x00000DCC = 0x00000000:0x00000000 (IA32_LBR_INFO_12)
 MSR 0x00000DCD = 0x00000000:0x00000000 (IA32_LBR_INFO_13)
 MSR 0x00000DCE = 0x00000000:0x00000000 (IA32_LBR_INFO_14)
 MSR 0x00000DCF = 0x00000000:0x00000000 (IA32_LBR_INFO_15)
 MSR 0x00000DD0 = 0x00000000:0x00000000 (IA32_LBR_INFO_16)
 MSR 0x00000DD1 = 0x00000000:0x00000000 (IA32_LBR_INFO_17)
 MSR 0x00000DD2 = 0x00000000:0x00000000 (IA32_LBR_INFO_18)
 MSR 0x00000DD3 = 0x00000000:0x00000000 (IA32_LBR_INFO_19)
 MSR 0x00000DD4 = 0x00000000:0x00000000 (IA32_LBR_INFO_20)
 MSR 0x00000DD5 = 0x00000000:0x00000000 (IA32_LBR_INFO_21)
 MSR 0x00000DD6 = 0x00000000:0x00000000 (IA32_LBR_INFO_22)
 MSR 0x00000DD7 = 0x00000000:0x00000000 (IA32_LBR_INFO_23)
 MSR 0x00000DD8 = 0x00000000:0x00000000 (IA32_LBR_INFO_24)
 MSR 0x00000DD9 = 0x00000000:0x00000000 (IA32_LBR_INFO_25)
 MSR 0x00000DDA = 0x00000000:0x00000000 (IA32_LBR_INFO_26)
 MSR 0x00000DDB = 0x00000000:0x00000000 (IA32_LBR_INFO_27)
 MSR 0x00000DDC = 0x00000000:0x00000000 (IA32_LBR_INFO_28)
 MSR 0x00000DDD = 0x00000000:0x00000000 (IA32_LBR_INFO_29)
 MSR 0x00000DDE = 0x00000000:0x00000000 (IA32_LBR_INFO_30)
 MSR 0x00000DDF = 0x00000000:0x00000000 (IA32_LBR_INFO_31)

====================== UNIQUE MSRs  (core 8) ======================
 MSR 0x00000000 = 0x00000000:0x00000FFF (IA32_P5_MC_ADDR)
 MSR 0x00000001 = 0x00000000:0x00000000 (IA32_P5_MC_TYPE)
 MSR 0x00000006 = 0x00000000:0x00000040 (IA32_MONITOR_FILTER_SIZE)
 MSR 0x00000010 = 0x00000039:0x4BEF348C (IA32_TIME_STAMP_COUNTER)
 MSR 0x0000001B = 0x00000000:0xFEE00C00 (IA32_APIC_BASE)
 MSR 0x00000034 = 0x00000000:0x000001DD (MSR_SMI_COUNT)
 MSR 0x0000003A = 0x00000000:0x00000005 (IA32_FEATURE_CONTROL)
 MSR 0x0000008B = 0x000000F4:0x00000000 (IA32_BIOS_SIGN_ID)
 MSR 0x000000C1 = 0x00000000:0x00000000 (IA32_PMC0)
 MSR 0x000000C2 = 0x00000000:0x00000000 (IA32_PMC1)
 MSR 0x000000C3 = 0x00000000:0x00000000 (IA32_PMC2)
 MSR 0x000000C4 = 0x00000000:0x00000000 (IA32_PMC3)
 MSR 0x000000E2 = 0x00000000:0x1E008008 (MSR_PKG_CST_CONFIG_CONTROL)
 MSR 0x000000E4 = 0x00000000:0x00051814 (MSR_PMG_IO_CAPTURE_BASE)
 MSR 0x000000E7 = 0x00000004:0xED4CD0D5 (IA32_MPERF)
 MSR 0x000000E8 = 0x00000007:0x0FF481EA (IA32_APERF)
 MSR 0x000000FE = 0x00000000:0x00001D0A (IA32_MTRRCAP)
 MSR 0x0000013C = 0x00000000:0x00000001 (MSR_FEATURE_CONFIG)
 MSR 0x00000174 = 0x00000000:0x00000010 (IA32_SYSENTER_CS)
 MSR 0x00000175 = 0xFFFFFE00:0x001DB000 (IA32_SYSENTER_ESP)
 MSR 0x00000176 = 0xFFFFFFFF:0x8D6018A0 (IA32_SYSENTER_EIP)
 MSR 0x00000179 = 0x00000000:0x00000C0C (IA32_MCG_CAP)
 MSR 0x0000017A = 0x00000000:0x00000000 (IA32_MCG_STATUS)
 MSR 0x00000186 = 0x00000000:0x00000000 (IA32_PERFEVTSEL0)
 MSR 0x00000187 = 0x00000000:0x00000000 (IA32_PERFEVTSEL1)
 MSR 0x00000188 = 0x00000000:0x00000000 (IA32_PERFEVTSEL2)
 MSR 0x00000189 = 0x00000000:0x00000000 (IA32_PERFEVTSEL3)
 MSR 0x00000199 = 0x00000000:0x00000800 (IA32_PERF_CTL)
 MSR 0x0000019A = 0x00000000:0x00000000 (IA32_CLOCK_MODULATION)
 MSR 0x0000019B = 0x00000000:0x00000013 (IA32_THERM_INTERRUPT)
 MSR 0x0000019C = 0x00000000:0x88400800 (IA32_THERM_STATUS)
 MSR 0x000001A0 = 0x00000000:0x00850089 (IA32_MISC_ENABLE)
 MSR 0x000001A4 = 0x00000000:0x00000000 (IA32_MISC_FEATURE_CONTROL)
 MSR 0x000001A6 = 0x00000000:0x00000000 (MSR_OFFCORE_RSP_0)
 MSR 0x000001A7 = 0x00000000:0x00000000 (MSR_OFFCORE_RSP_1)
 MSR 0x000001C8 = 0x00000000:0x00000000 (MSR_LBR_SELECT)
 MSR 0x000001C9 = 0x00000000:0x00000000 (MSR_LASTBRANCH_TOS)
 MSR 0x000001D9 = 0x00000000:0x00004000 (IA32_DEBUGCTL)
 MSR 0x000001DD = 0x00000000:0x00000000 (MSR_LER_FROM_LIP)
 MSR 0x000001DE = 0x00000000:0x00000000 (MSR_LER_TO_LIP)
 MSR 0x000001F2 = 0x00000000:0xBF800006 (IA32_SMRR_PHYSBASE)
 MSR 0x000001F3 = 0x00000000:0xFF800800 (IA32_SMRR_PHYSMASK)
 MSR 0x000001F4 = 0x00000000:0x00000000 (MSR_PRMRR_PHYS_BASE)
 MSR 0x000001F5 = 0x00000000:0x00000000 (MSR_PRMRR_PHYS_MASK)
 MSR 0x000001FB = 0x00000000:0x000000E1 (MSR_PRMRR_VALID_CONFIG)
 MSR 0x000001FC = 0x00000000:0x002C005D (MSR_POWER_CTL)
 MSR 0x00000200 = 0x00000000:0xC0000000 (IA32_MTRR_PHYSBASE0)
 MSR 0x00000201 = 0x0000007F:0xC0000800 (IA32_MTRR_PHYSBASE0)
 MSR 0x00000202 = 0x00000000:0x00000000 (IA32_MTRR_PHYSBASE1)
 MSR 0x00000203 = 0x00000000:0x00000000 (IA32_MTRR_PHYSBASE1)
 MSR 0x00000204 = 0x00000000:0x00000000 (IA32_MTRR_PHYSBASE2)
 MSR 0x00000205 = 0x00000000:0x00000000 (IA32_MTRR_PHYSBASE2)
 MSR 0x00000206 = 0x00000000:0x00000000 (IA32_MTRR_PHYSBASE3)
 MSR 0x00000207 = 0x00000000:0x00000000 (IA32_MTRR_PHYSBASE3)
 MSR 0x00000208 = 0x00000000:0x00000000 (IA32_MTRR_PHYSBASE4)
 MSR 0x00000209 = 0x00000000:0x00000000 (IA32_MTRR_PHYSBASE4)
 MSR 0x0000020A = 0x00000000:0x00000000 (IA32_MTRR_PHYSBASE5)
 MSR 0x0000020B = 0x00000000:0x00000000 (IA32_MTRR_PHYSBASE5)
 MSR 0x0000020C = 0x00000000:0x00000000 (IA32_MTRR_PHYSBASE6)
 MSR 0x0000020D = 0x00000000:0x00000000 (IA32_MTRR_PHYSBASE6)
 MSR 0x0000020E = 0x00000000:0x00000000 (IA32_MTRR_PHYSBASE7)
 MSR 0x0000020F = 0x00000000:0x00000000 (IA32_MTRR_PHYSBASE7)
 MSR 0x00000210 = 0x00000000:0x00000000 (IA32_MTRR_PHYSBASE8)
 MSR 0x00000211 = 0x00000000:0x00000000 (IA32_MTRR_PHYSBASE8)
 MSR 0x00000212 = 0x00000000:0x00000000 (IA32_MTRR_PHYSBASE9)
 MSR 0x00000213 = 0x00000000:0x00000000 (IA32_MTRR_PHYSBASE9)
 MSR 0x00000250 = 0x06060606:0x06060606 (IA32_MTRR_FIX64K_00000)
 MSR 0x00000258 = 0x06060606:0x06060606 (IA32_MTRR_FIX16K_80000)
 MSR 0x00000259 = 0x00000000:0x00000000 (IA32_MTRR_FIX16K_A0000)
 MSR 0x00000268 = 0x05050505:0x05050505 (IA32_MTRR_FIX4K_C0000)
 MSR 0x00000269 = 0x05050505:0x05050505 (IA32_MTRR_FIX4K_C8000)
 MSR 0x0000026A = 0x05050505:0x05050505 (IA32_MTRR_FIX4K_D0000)
 MSR 0x0000026B = 0x05050505:0x05050505 (IA32_MTRR_FIX4K_D8000)
 MSR 0x0000026C = 0x05050505:0x05050505 (IA32_MTRR_FIX4K_E0000)
 MSR 0x0000026D = 0x05050505:0x05050505 (IA32_MTRR_FIX4K_E8000)
 MSR 0x0000026E = 0x05050505:0x05050505 (IA32_MTRR_FIX4K_F0000)
 MSR 0x0000026F = 0x05050505:0x05050505 (IA32_MTRR_FIX4K_F8000)
 MSR 0x00000277 = 0x04070506:0x00070106 (IA32_PAT)
 MSR 0x00000280 = 0x00000000:0x40000001 (IA32_MC0_CTL2)
 MSR 0x00000281 = 0x00000000:0x40000001 (IA32_MC1_CTL2)
 MSR 0x00000282 = 0x00000000:0x40000001 (IA32_MC2_CTL2)
 MSR 0x00000283 = 0x00000000:0x40000001 (IA32_MC3_CTL2)
 MSR 0x000002FF = 0x00000000:0x00000C06 (IA32_MTRR_DEF_TYPE)
 MSR 0x00000309 = 0x00000000:0x00000000 (IA32_FIXED_CTR0)
 MSR 0x0000030A = 0x0000FFFB:0xD1643372 (IA32_FIXED_CTR1)
 MSR 0x0000030B = 0x00000000:0x00000000 (IA32_FIXED_CTR2)
 MSR 0x00000345 = 0x00000000:0x000033C5 (IA32_PERF_CAPABILITIES)
 MSR 0x0000038D = 0x00000000:0x000000B0 (IA32_FIXED_CTR_CTRL)
 MSR 0x0000038E = 0x00000000:0x00000000 (IA32_PERF_GLOBAL_STATUS)
 MSR 0x0000038F = 0x00000007:0x0000000F (IA32_PERF_GLOBAL_CTRL)
 MSR 0x00000390 = 0x00000000:0x00000000 (IA32_PERF_GLOBAL_STATUS_RESET)
 MSR 0x00000391 = 0x00000000:0x00000000 (IA32_PERF_GLOBAL_STATUS_SET)
 MSR 0x000003F1 = 0x00000000:0x00000000 (MSR_PEBS_ENABLE)
 MSR 0x000003F6 = 0x00000000:0x0000FFFF (MSR_PEBS_LD_LAT)
 MSR 0x000003F7 = 0x00000000:0x00000800 (MSR_PEBS_FRONTEND)
 MSR 0x000003FC = 0x00000000:0x38E818F0 (MSR_CORE_C3_RESIDENCY)
 MSR 0x000003FD = 0x00000000:0xDD104368 (MSR_CORE_C6_RESIDENCY)
 MSR 0x000003FE = 0x00000026:0x78EB6C90 (MSR_CORE_C7_RESIDENCY)
 MSR 0x00000400 = 0x00000000:0x00000FFF (IA32_MC0_CTL)
 MSR 0x00000401 = 0x00000000:0x00000000 (IA32_MC0_STATUS)
 MSR 0x00000402 = 0x00000000:0x00000000 (IA32_MC0_ADDR)
 MSR 0x00000403 = 0x00000000:0x00000000 (IA32_MC0_MISC)
 MSR 0x00000404 = 0x00000000:0x0000000F (IA32_MC1_CTL)
 MSR 0x00000405 = 0x00000000:0x00000000 (IA32_MC1_STATUS)
 MSR 0x00000406 = 0x00000000:0x00000000 (IA32_MC1_ADDR)
 MSR 0x00000407 = 0x00000000:0x00000000 (IA32_MC1_MISC)
 MSR 0x00000408 = 0x00000000:0x0000000F (IA32_MC2_CTL)
 MSR 0x00000409 = 0x00000000:0x00000000 (IA32_MC2_STATUS)
 MSR 0x0000040A = 0x00000000:0x00000000 (IA32_MC2_ADDR)
 MSR 0x0000040C = 0x00000000:0x0000001F (IA32_MC3_CTL)
 MSR 0x0000040D = 0x00000000:0x00000000 (IA32_MC3_STATUS)
 MSR 0x0000040E = 0x00000000:0x00000000 (IA32_MC3_ADDR)
 MSR 0x00000410 = 0x00000000:0x0000003F (IA32_MC4_CTL)
 MSR 0x00000411 = 0x00000000:0x00000000 (IA32_MC4_STATUS)
 MSR 0x00000480 = 0x00DA0400:0x00000004 (IA32_VMX_BASIC)
 MSR 0x00000481 = 0x0000007F:0x00000016 (IA32_VMX_PINBASED_CTLS)
 MSR 0x00000482 = 0xFFF9FFFE:0x0401E172 (IA32_VMX_PROCBASED_CTLS)
 MSR 0x00000483 = 0x01FFFFFF:0x00036DFF (IA32_VMX_EXIT_CTLS)
 MSR 0x00000484 = 0x0003FFFF:0x000011FF (IA32_VMX_ENTRY_CTLS)
 MSR 0x00000485 = 0x00000000:0x7004C1E7 (IA32_VMX_MISC)
 MSR 0x00000486 = 0x00000000:0x80000021 (IA32_VMX_CR0_FIXED0)
 MSR 0x00000487 = 0x00000000:0xFFFFFFFF (IA32_VMX_CR0_FIXED1)
 MSR 0x00000488 = 0x00000000:0x00002000 (IA32_VMX_CR4_FIXED0)
 MSR 0x00000489 = 0x00000000:0x003767FF (IA32_VMX_CR4_FIXED1)
 MSR 0x0000048A = 0x00000000:0x0000002E (IA32_VMX_VMCS_ENUM)
 MSR 0x0000048B = 0x005FFCFF:0x00000000 (IA32_VMX_PROCBASED_CTLS2)
 MSR 0x0000048C = 0x00000F01:0x06734141 (IA32_VMX_EPT_VPID_ENUM)
 MSR 0x0000048D = 0x0000007F:0x00000016 (IA32_VMX_TRUE_PINBASED_CTLS)
 MSR 0x0000048E = 0xFFF9FFFE:0x04006172 (IA32_VMX_TRUE_PROCBASED_CTLS)
 MSR 0x0000048F = 0x01FFFFFF:0x00036DFB (IA32_VMX_TRUE_EXIT_CTLS)
 MSR 0x00000490 = 0x0003FFFF:0x000011FB (IA32_VMX_TRUE_ENTRY_CTLS)
 MSR 0x000004C1 = 0x00000000:0x00000000 (IA32_A_PMC0)
 MSR 0x000004C2 = 0x00000000:0x00000000 (IA32_A_PMC1)
 MSR 0x000004C3 = 0x00000000:0x00000000 (IA32_A_PMC2)
 MSR 0x000004C4 = 0x00000000:0x00000000 (IA32_A_PMC3)
 MSR 0x00000500 = 0x00000000:0x00020000 (IA32_SGX_SVN_STATUS)
 MSR 0x00000560 = 0x00000000:0x00000000 (IA32_RTIT_OUTPUT_BASE)
 MSR 0x00000561 = 0x00000000:0x0000007F (IA32_RTIT_OUTPUT_MASK_PTRS)
 MSR 0x00000570 = 0x00000000:0x00000000 (IA32_RTIT_CTL)
 MSR 0x00000571 = 0x00000000:0x00000000 (IA32_RTIT_STATUS)
 MSR 0x00000572 = 0x00000000:0x00000000 (IA32_RTIT_CR3_MATCH)
 MSR 0x00000580 = 0x00000000:0x00000000 (IA32_RTIT_ADDR0_A)
 MSR 0x00000581 = 0x00000000:0x00000000 (IA32_RTIT_ADDR0_B)
 MSR 0x00000582 = 0x00000000:0x00000000 (IA32_RTIT_ADDR1_A)
 MSR 0x00000583 = 0x00000000:0x00000000 (IA32_RTIT_ADDR1_B)
 MSR 0x00000600 = 0xFFFFFE00:0x001F3000 (IA32_DS_AREA)
 MSR 0x0000064E = 0x00000006:0x786D1EB0 (MSR_PPERF)
 MSR 0x00000653 = 0x00000000:0x00000000 (MSR_CORE_HDC_RESIDENCY)
 MSR 0x00000690 = 0x00000000:0x00000000 (MSR_LASTBRANCH_16_FROM_IP)
 MSR 0x00000691 = 0x00000000:0x00000000 (MSR_LASTBRANCH_17_FROM_IP)
 MSR 0x00000692 = 0x00000000:0x00000000 (MSR_LASTBRANCH_18_FROM_IP)
 MSR 0x00000693 = 0x00000000:0x00000000 (MSR_LASTBRANCH_19_FROM_IP)
 MSR 0x00000694 = 0x00000000:0x00000000 (MSR_LASTBRANCH_20_FROM_IP)
 MSR 0x00000695 = 0x00000000:0x00000000 (MSR_LASTBRANCH_21_FROM_IP)
 MSR 0x00000696 = 0x00000000:0x00000000 (MSR_LASTBRANCH_22_FROM_IP)
 MSR 0x00000697 = 0x00000000:0x00000000 (MSR_LASTBRANCH_23_FROM_IP)
 MSR 0x00000698 = 0x00000000:0x00000000 (MSR_LASTBRANCH_24_FROM_IP)
 MSR 0x00000699 = 0x00000000:0x00000000 (MSR_LASTBRANCH_25_FROM_IP)
 MSR 0x0000069A = 0x00000000:0x00000000 (MSR_LASTBRANCH_26_FROM_IP)
 MSR 0x0000069B = 0x00000000:0x00000000 (MSR_LASTBRANCH_27_FROM_IP)
 MSR 0x0000069C = 0x00000000:0x00000000 (MSR_LASTBRANCH_28_FROM_IP)
 MSR 0x0000069D = 0x00000000:0x00000000 (MSR_LASTBRANCH_29_FROM_IP)
 MSR 0x0000069E = 0x00000000:0x00000000 (MSR_LASTBRANCH_30_FROM_IP)
 MSR 0x0000069F = 0x00000000:0x00000000 (MSR_LASTBRANCH_31_FROM_IP)
 MSR 0x000006D0 = 0x00000000:0x00000000 (MSR_LASTBRANCH_16_TO_IP)
 MSR 0x000006D1 = 0x00000000:0x00000000 (MSR_LASTBRANCH_17_TO_IP)
 MSR 0x000006D2 = 0x00000000:0x00000000 (MSR_LASTBRANCH_18_TO_IP)
 MSR 0x000006D3 = 0x00000000:0x00000000 (MSR_LASTBRANCH_19_TO_IP)
 MSR 0x000006D4 = 0x00000000:0x00000000 (MSR_LASTBRANCH_20_TO_IP)
 MSR 0x000006D5 = 0x00000000:0x00000000 (MSR_LASTBRANCH_21_TO_IP)
 MSR 0x000006D6 = 0x00000000:0x00000000 (MSR_LASTBRANCH_22_TO_IP)
 MSR 0x000006D7 = 0x00000000:0x00000000 (MSR_LASTBRANCH_23_TO_IP)
 MSR 0x000006D8 = 0x00000000:0x00000000 (MSR_LASTBRANCH_24_TO_IP)
 MSR 0x000006D9 = 0x00000000:0x00000000 (MSR_LASTBRANCH_25_TO_IP)
 MSR 0x000006DA = 0x00000000:0x00000000 (MSR_LASTBRANCH_26_TO_IP)
 MSR 0x000006DB = 0x00000000:0x00000000 (MSR_LASTBRANCH_27_TO_IP)
 MSR 0x000006DC = 0x00000000:0x00000000 (MSR_LASTBRANCH_28_TO_IP)
 MSR 0x000006DD = 0x00000000:0x00000000 (MSR_LASTBRANCH_29_TO_IP)
 MSR 0x000006DE = 0x00000000:0x00000000 (MSR_LASTBRANCH_30_TO_IP)
 MSR 0x000006DF = 0x00000000:0x00000000 (MSR_LASTBRANCH_31_TO_IP)
 MSR 0x000006E0 = 0x00000039:0x4C1E6650 (IA32_TSC_DEADLINE)
 MSR 0x00000771 = 0x00000000:0x010D1824 (IA32_HWP_CAPABILITIES)
 MSR 0x00000773 = 0x00000000:0x00000001 (IA32_HWP_INTERRUPT)
 MSR 0x00000774 = 0x00000000:0x00002408 (IA32_HWP_REQUEST)
 MSR 0x00000777 = 0x00000000:0x00000000 (IA32_HWP_STATUS)
 MSR 0x00000D90 = 0x00000000:0x00000000 (IA32_BNDCFGS)
 MSR 0x00000DA0 = 0x00000000:0x00000000 (IA32_XSS)
 MSR 0x00000DB1 = 0x00000000:0x00000001 (IA32_PM_CTL1)
 MSR 0x00000DB2 = 0x00000000:0x00000000 (IA32_THREAD_STALL)
 MSR 0x00000DC0 = 0x00000000:0x00000000 (IA32_LBR_INFO_0)
 MSR 0x00000DC1 = 0x00000000:0x00000000 (IA32_LBR_INFO_1)
 MSR 0x00000DC2 = 0x00000000:0x00000000 (IA32_LBR_INFO_2)
 MSR 0x00000DC3 = 0x00000000:0x00000000 (IA32_LBR_INFO_3)
 MSR 0x00000DC4 = 0x00000000:0x00000000 (IA32_LBR_INFO_4)
 MSR 0x00000DC5 = 0x00000000:0x00000000 (IA32_LBR_INFO_5)
 MSR 0x00000DC6 = 0x00000000:0x00000000 (IA32_LBR_INFO_6)
 MSR 0x00000DC7 = 0x00000000:0x00000000 (IA32_LBR_INFO_7)
 MSR 0x00000DC8 = 0x00000000:0x00000000 (IA32_LBR_INFO_8)
 MSR 0x00000DC9 = 0x00000000:0x00000000 (IA32_LBR_INFO_9)
 MSR 0x00000DCA = 0x00000000:0x00000000 (IA32_LBR_INFO_10)
 MSR 0x00000DCB = 0x00000000:0x00000000 (IA32_LBR_INFO_11)
 MSR 0x00000DCC = 0x00000000:0x00000000 (IA32_LBR_INFO_12)
 MSR 0x00000DCD = 0x00000000:0x00000000 (IA32_LBR_INFO_13)
 MSR 0x00000DCE = 0x00000000:0x00000000 (IA32_LBR_INFO_14)
 MSR 0x00000DCF = 0x00000000:0x00000000 (IA32_LBR_INFO_15)
 MSR 0x00000DD0 = 0x00000000:0x00000000 (IA32_LBR_INFO_16)
 MSR 0x00000DD1 = 0x00000000:0x00000000 (IA32_LBR_INFO_17)
 MSR 0x00000DD2 = 0x00000000:0x00000000 (IA32_LBR_INFO_18)
 MSR 0x00000DD3 = 0x00000000:0x00000000 (IA32_LBR_INFO_19)
 MSR 0x00000DD4 = 0x00000000:0x00000000 (IA32_LBR_INFO_20)
 MSR 0x00000DD5 = 0x00000000:0x00000000 (IA32_LBR_INFO_21)
 MSR 0x00000DD6 = 0x00000000:0x00000000 (IA32_LBR_INFO_22)
 MSR 0x00000DD7 = 0x00000000:0x00000000 (IA32_LBR_INFO_23)
 MSR 0x00000DD8 = 0x00000000:0x00000000 (IA32_LBR_INFO_24)
 MSR 0x00000DD9 = 0x00000000:0x00000000 (IA32_LBR_INFO_25)
 MSR 0x00000DDA = 0x00000000:0x00000000 (IA32_LBR_INFO_26)
 MSR 0x00000DDB = 0x00000000:0x00000000 (IA32_LBR_INFO_27)
 MSR 0x00000DDC = 0x00000000:0x00000000 (IA32_LBR_INFO_28)
 MSR 0x00000DDD = 0x00000000:0x00000000 (IA32_LBR_INFO_29)
 MSR 0x00000DDE = 0x00000000:0x00000000 (IA32_LBR_INFO_30)
 MSR 0x00000DDF = 0x00000000:0x00000000 (IA32_LBR_INFO_31)

====================== UNIQUE MSRs  (core 9) ======================
 MSR 0x00000000 = 0x00000000:0x00000FFF (IA32_P5_MC_ADDR)
 MSR 0x00000001 = 0x00000000:0x00000000 (IA32_P5_MC_TYPE)
 MSR 0x00000006 = 0x00000000:0x00000040 (IA32_MONITOR_FILTER_SIZE)
 MSR 0x00000010 = 0x00000039:0x4C1A78DE (IA32_TIME_STAMP_COUNTER)
 MSR 0x0000001B = 0x00000000:0xFEE00C00 (IA32_APIC_BASE)
 MSR 0x00000034 = 0x00000000:0x000001DD (MSR_SMI_COUNT)
 MSR 0x0000003A = 0x00000000:0x00000005 (IA32_FEATURE_CONTROL)
 MSR 0x0000008B = 0x000000F4:0x00000000 (IA32_BIOS_SIGN_ID)
 MSR 0x000000C1 = 0x00000000:0x00000000 (IA32_PMC0)
 MSR 0x000000C2 = 0x00000000:0x00000000 (IA32_PMC1)
 MSR 0x000000C3 = 0x00000000:0x00000000 (IA32_PMC2)
 MSR 0x000000C4 = 0x00000000:0x00000000 (IA32_PMC3)
 MSR 0x000000E2 = 0x00000000:0x1E008008 (MSR_PKG_CST_CONFIG_CONTROL)
 MSR 0x000000E4 = 0x00000000:0x00051814 (MSR_PMG_IO_CAPTURE_BASE)
 MSR 0x000000E7 = 0x00000002:0x4ABF772A (IA32_MPERF)
 MSR 0x000000E8 = 0x00000003:0x3622F3F1 (IA32_APERF)
 MSR 0x000000FE = 0x00000000:0x00001D0A (IA32_MTRRCAP)
 MSR 0x0000013C = 0x00000000:0x00000001 (MSR_FEATURE_CONFIG)
 MSR 0x00000174 = 0x00000000:0x00000010 (IA32_SYSENTER_CS)
 MSR 0x00000175 = 0xFFFFFE00:0x00216000 (IA32_SYSENTER_ESP)
 MSR 0x00000176 = 0xFFFFFFFF:0x8D6018A0 (IA32_SYSENTER_EIP)
 MSR 0x00000179 = 0x00000000:0x00000C0C (IA32_MCG_CAP)
 MSR 0x0000017A = 0x00000000:0x00000000 (IA32_MCG_STATUS)
 MSR 0x00000186 = 0x00000000:0x00000000 (IA32_PERFEVTSEL0)
 MSR 0x00000187 = 0x00000000:0x00000000 (IA32_PERFEVTSEL1)
 MSR 0x00000188 = 0x00000000:0x00000000 (IA32_PERFEVTSEL2)
 MSR 0x00000189 = 0x00000000:0x00000000 (IA32_PERFEVTSEL3)
 MSR 0x00000199 = 0x00000000:0x00000800 (IA32_PERF_CTL)
 MSR 0x0000019A = 0x00000000:0x00000000 (IA32_CLOCK_MODULATION)
 MSR 0x0000019B = 0x00000000:0x00000013 (IA32_THERM_INTERRUPT)
 MSR 0x0000019C = 0x00000000:0x88420800 (IA32_THERM_STATUS)
 MSR 0x000001A0 = 0x00000000:0x00850089 (IA32_MISC_ENABLE)
 MSR 0x000001A4 = 0x00000000:0x00000000 (IA32_MISC_FEATURE_CONTROL)
 MSR 0x000001A6 = 0x00000000:0x00000000 (MSR_OFFCORE_RSP_0)
 MSR 0x000001A7 = 0x00000000:0x00000000 (MSR_OFFCORE_RSP_1)
 MSR 0x000001C8 = 0x00000000:0x00000000 (MSR_LBR_SELECT)
 MSR 0x000001C9 = 0x00000000:0x00000000 (MSR_LASTBRANCH_TOS)
 MSR 0x000001D9 = 0x00000000:0x00004000 (IA32_DEBUGCTL)
 MSR 0x000001DD = 0x00000000:0x00000000 (MSR_LER_FROM_LIP)
 MSR 0x000001DE = 0x00000000:0x00000000 (MSR_LER_TO_LIP)
 MSR 0x000001F2 = 0x00000000:0xBF800006 (IA32_SMRR_PHYSBASE)
 MSR 0x000001F3 = 0x00000000:0xFF800800 (IA32_SMRR_PHYSMASK)
 MSR 0x000001F4 = 0x00000000:0x00000000 (MSR_PRMRR_PHYS_BASE)
 MSR 0x000001F5 = 0x00000000:0x00000000 (MSR_PRMRR_PHYS_MASK)
 MSR 0x000001FB = 0x00000000:0x000000E1 (MSR_PRMRR_VALID_CONFIG)
 MSR 0x000001FC = 0x00000000:0x002C005D (MSR_POWER_CTL)
 MSR 0x00000200 = 0x00000000:0xC0000000 (IA32_MTRR_PHYSBASE0)
 MSR 0x00000201 = 0x0000007F:0xC0000800 (IA32_MTRR_PHYSBASE0)
 MSR 0x00000202 = 0x00000000:0x00000000 (IA32_MTRR_PHYSBASE1)
 MSR 0x00000203 = 0x00000000:0x00000000 (IA32_MTRR_PHYSBASE1)
 MSR 0x00000204 = 0x00000000:0x00000000 (IA32_MTRR_PHYSBASE2)
 MSR 0x00000205 = 0x00000000:0x00000000 (IA32_MTRR_PHYSBASE2)
 MSR 0x00000206 = 0x00000000:0x00000000 (IA32_MTRR_PHYSBASE3)
 MSR 0x00000207 = 0x00000000:0x00000000 (IA32_MTRR_PHYSBASE3)
 MSR 0x00000208 = 0x00000000:0x00000000 (IA32_MTRR_PHYSBASE4)
 MSR 0x00000209 = 0x00000000:0x00000000 (IA32_MTRR_PHYSBASE4)
 MSR 0x0000020A = 0x00000000:0x00000000 (IA32_MTRR_PHYSBASE5)
 MSR 0x0000020B = 0x00000000:0x00000000 (IA32_MTRR_PHYSBASE5)
 MSR 0x0000020C = 0x00000000:0x00000000 (IA32_MTRR_PHYSBASE6)
 MSR 0x0000020D = 0x00000000:0x00000000 (IA32_MTRR_PHYSBASE6)
 MSR 0x0000020E = 0x00000000:0x00000000 (IA32_MTRR_PHYSBASE7)
 MSR 0x0000020F = 0x00000000:0x00000000 (IA32_MTRR_PHYSBASE7)
 MSR 0x00000210 = 0x00000000:0x00000000 (IA32_MTRR_PHYSBASE8)
 MSR 0x00000211 = 0x00000000:0x00000000 (IA32_MTRR_PHYSBASE8)
 MSR 0x00000212 = 0x00000000:0x00000000 (IA32_MTRR_PHYSBASE9)
 MSR 0x00000213 = 0x00000000:0x00000000 (IA32_MTRR_PHYSBASE9)
 MSR 0x00000250 = 0x06060606:0x06060606 (IA32_MTRR_FIX64K_00000)
 MSR 0x00000258 = 0x06060606:0x06060606 (IA32_MTRR_FIX16K_80000)
 MSR 0x00000259 = 0x00000000:0x00000000 (IA32_MTRR_FIX16K_A0000)
 MSR 0x00000268 = 0x05050505:0x05050505 (IA32_MTRR_FIX4K_C0000)
 MSR 0x00000269 = 0x05050505:0x05050505 (IA32_MTRR_FIX4K_C8000)
 MSR 0x0000026A = 0x05050505:0x05050505 (IA32_MTRR_FIX4K_D0000)
 MSR 0x0000026B = 0x05050505:0x05050505 (IA32_MTRR_FIX4K_D8000)
 MSR 0x0000026C = 0x05050505:0x05050505 (IA32_MTRR_FIX4K_E0000)
 MSR 0x0000026D = 0x05050505:0x05050505 (IA32_MTRR_FIX4K_E8000)
 MSR 0x0000026E = 0x05050505:0x05050505 (IA32_MTRR_FIX4K_F0000)
 MSR 0x0000026F = 0x05050505:0x05050505 (IA32_MTRR_FIX4K_F8000)
 MSR 0x00000277 = 0x04070506:0x00070106 (IA32_PAT)
 MSR 0x00000280 = 0x00000000:0x40000001 (IA32_MC0_CTL2)
 MSR 0x00000281 = 0x00000000:0x40000001 (IA32_MC1_CTL2)
 MSR 0x00000282 = 0x00000000:0x40000001 (IA32_MC2_CTL2)
 MSR 0x00000283 = 0x00000000:0x40000001 (IA32_MC3_CTL2)
 MSR 0x000002FF = 0x00000000:0x00000C06 (IA32_MTRR_DEF_TYPE)
 MSR 0x00000309 = 0x00000000:0x00000000 (IA32_FIXED_CTR0)
 MSR 0x0000030A = 0x0000FFFD:0x8CFD30DA (IA32_FIXED_CTR1)
 MSR 0x0000030B = 0x00000000:0x00000000 (IA32_FIXED_CTR2)
 MSR 0x00000345 = 0x00000000:0x000033C5 (IA32_PERF_CAPABILITIES)
 MSR 0x0000038D = 0x00000000:0x000000B0 (IA32_FIXED_CTR_CTRL)
 MSR 0x0000038E = 0x00000000:0x00000000 (IA32_PERF_GLOBAL_STATUS)
 MSR 0x0000038F = 0x00000007:0x0000000F (IA32_PERF_GLOBAL_CTRL)
 MSR 0x00000390 = 0x00000000:0x00000000 (IA32_PERF_GLOBAL_STATUS_RESET)
 MSR 0x00000391 = 0x00000000:0x00000000 (IA32_PERF_GLOBAL_STATUS_SET)
 MSR 0x000003F1 = 0x00000000:0x00000000 (MSR_PEBS_ENABLE)
 MSR 0x000003F6 = 0x00000000:0x0000FFFF (MSR_PEBS_LD_LAT)
 MSR 0x000003F7 = 0x00000000:0x00000800 (MSR_PEBS_FRONTEND)
 MSR 0x000003FC = 0x00000000:0x352E60C0 (MSR_CORE_C3_RESIDENCY)
 MSR 0x000003FD = 0x00000001:0x09196F28 (MSR_CORE_C6_RESIDENCY)
 MSR 0x000003FE = 0x00000027:0xA750BE40 (MSR_CORE_C7_RESIDENCY)
 MSR 0x00000400 = 0x00000000:0x00000FFF (IA32_MC0_CTL)
 MSR 0x00000401 = 0x00000000:0x00000000 (IA32_MC0_STATUS)
 MSR 0x00000402 = 0x00000000:0x00000000 (IA32_MC0_ADDR)
 MSR 0x00000403 = 0x00000000:0x00000000 (IA32_MC0_MISC)
 MSR 0x00000404 = 0x00000000:0x0000000F (IA32_MC1_CTL)
 MSR 0x00000405 = 0x00000000:0x00000000 (IA32_MC1_STATUS)
 MSR 0x00000406 = 0x00000000:0x00000000 (IA32_MC1_ADDR)
 MSR 0x00000407 = 0x00000000:0x00000000 (IA32_MC1_MISC)
 MSR 0x00000408 = 0x00000000:0x0000000F (IA32_MC2_CTL)
 MSR 0x00000409 = 0x00000000:0x00000000 (IA32_MC2_STATUS)
 MSR 0x0000040A = 0x00000000:0x00000000 (IA32_MC2_ADDR)
 MSR 0x0000040C = 0x00000000:0x0000001F (IA32_MC3_CTL)
 MSR 0x0000040D = 0x00000000:0x00000000 (IA32_MC3_STATUS)
 MSR 0x0000040E = 0x00000000:0x00000000 (IA32_MC3_ADDR)
 MSR 0x00000410 = 0x00000000:0x0000003F (IA32_MC4_CTL)
 MSR 0x00000411 = 0x00000000:0x00000000 (IA32_MC4_STATUS)
 MSR 0x00000480 = 0x00DA0400:0x00000004 (IA32_VMX_BASIC)
 MSR 0x00000481 = 0x0000007F:0x00000016 (IA32_VMX_PINBASED_CTLS)
 MSR 0x00000482 = 0xFFF9FFFE:0x0401E172 (IA32_VMX_PROCBASED_CTLS)
 MSR 0x00000483 = 0x01FFFFFF:0x00036DFF (IA32_VMX_EXIT_CTLS)
 MSR 0x00000484 = 0x0003FFFF:0x000011FF (IA32_VMX_ENTRY_CTLS)
 MSR 0x00000485 = 0x00000000:0x7004C1E7 (IA32_VMX_MISC)
 MSR 0x00000486 = 0x00000000:0x80000021 (IA32_VMX_CR0_FIXED0)
 MSR 0x00000487 = 0x00000000:0xFFFFFFFF (IA32_VMX_CR0_FIXED1)
 MSR 0x00000488 = 0x00000000:0x00002000 (IA32_VMX_CR4_FIXED0)
 MSR 0x00000489 = 0x00000000:0x003767FF (IA32_VMX_CR4_FIXED1)
 MSR 0x0000048A = 0x00000000:0x0000002E (IA32_VMX_VMCS_ENUM)
 MSR 0x0000048B = 0x005FFCFF:0x00000000 (IA32_VMX_PROCBASED_CTLS2)
 MSR 0x0000048C = 0x00000F01:0x06734141 (IA32_VMX_EPT_VPID_ENUM)
 MSR 0x0000048D = 0x0000007F:0x00000016 (IA32_VMX_TRUE_PINBASED_CTLS)
 MSR 0x0000048E = 0xFFF9FFFE:0x04006172 (IA32_VMX_TRUE_PROCBASED_CTLS)
 MSR 0x0000048F = 0x01FFFFFF:0x00036DFB (IA32_VMX_TRUE_EXIT_CTLS)
 MSR 0x00000490 = 0x0003FFFF:0x000011FB (IA32_VMX_TRUE_ENTRY_CTLS)
 MSR 0x000004C1 = 0x00000000:0x00000000 (IA32_A_PMC0)
 MSR 0x000004C2 = 0x00000000:0x00000000 (IA32_A_PMC1)
 MSR 0x000004C3 = 0x00000000:0x00000000 (IA32_A_PMC2)
 MSR 0x000004C4 = 0x00000000:0x00000000 (IA32_A_PMC3)
 MSR 0x00000500 = 0x00000000:0x00020000 (IA32_SGX_SVN_STATUS)
 MSR 0x00000560 = 0x00000000:0x00000000 (IA32_RTIT_OUTPUT_BASE)
 MSR 0x00000561 = 0x00000000:0x0000007F (IA32_RTIT_OUTPUT_MASK_PTRS)
 MSR 0x00000570 = 0x00000000:0x00000000 (IA32_RTIT_CTL)
 MSR 0x00000571 = 0x00000000:0x00000000 (IA32_RTIT_STATUS)
 MSR 0x00000572 = 0x00000000:0x00000000 (IA32_RTIT_CR3_MATCH)
 MSR 0x00000580 = 0x00000000:0x00000000 (IA32_RTIT_ADDR0_A)
 MSR 0x00000581 = 0x00000000:0x00000000 (IA32_RTIT_ADDR0_B)
 MSR 0x00000582 = 0x00000000:0x00000000 (IA32_RTIT_ADDR1_A)
 MSR 0x00000583 = 0x00000000:0x00000000 (IA32_RTIT_ADDR1_B)
 MSR 0x00000600 = 0xFFFFFE00:0x0022E000 (IA32_DS_AREA)
 MSR 0x0000064E = 0x00000002:0xF5472BAD (MSR_PPERF)
 MSR 0x00000653 = 0x00000000:0x00000000 (MSR_CORE_HDC_RESIDENCY)
 MSR 0x00000690 = 0x00000000:0x00000000 (MSR_LASTBRANCH_16_FROM_IP)
 MSR 0x00000691 = 0x00000000:0x00000000 (MSR_LASTBRANCH_17_FROM_IP)
 MSR 0x00000692 = 0x00000000:0x00000000 (MSR_LASTBRANCH_18_FROM_IP)
 MSR 0x00000693 = 0x00000000:0x00000000 (MSR_LASTBRANCH_19_FROM_IP)
 MSR 0x00000694 = 0x00000000:0x00000000 (MSR_LASTBRANCH_20_FROM_IP)
 MSR 0x00000695 = 0x00000000:0x00000000 (MSR_LASTBRANCH_21_FROM_IP)
 MSR 0x00000696 = 0x00000000:0x00000000 (MSR_LASTBRANCH_22_FROM_IP)
 MSR 0x00000697 = 0x00000000:0x00000000 (MSR_LASTBRANCH_23_FROM_IP)
 MSR 0x00000698 = 0x00000000:0x00000000 (MSR_LASTBRANCH_24_FROM_IP)
 MSR 0x00000699 = 0x00000000:0x00000000 (MSR_LASTBRANCH_25_FROM_IP)
 MSR 0x0000069A = 0x00000000:0x00000000 (MSR_LASTBRANCH_26_FROM_IP)
 MSR 0x0000069B = 0x00000000:0x00000000 (MSR_LASTBRANCH_27_FROM_IP)
 MSR 0x0000069C = 0x00000000:0x00000000 (MSR_LASTBRANCH_28_FROM_IP)
 MSR 0x0000069D = 0x00000000:0x00000000 (MSR_LASTBRANCH_29_FROM_IP)
 MSR 0x0000069E = 0x00000000:0x00000000 (MSR_LASTBRANCH_30_FROM_IP)
 MSR 0x0000069F = 0x00000000:0x00000000 (MSR_LASTBRANCH_31_FROM_IP)
 MSR 0x000006D0 = 0x00000000:0x00000000 (MSR_LASTBRANCH_16_TO_IP)
 MSR 0x000006D1 = 0x00000000:0x00000000 (MSR_LASTBRANCH_17_TO_IP)
 MSR 0x000006D2 = 0x00000000:0x00000000 (MSR_LASTBRANCH_18_TO_IP)
 MSR 0x000006D3 = 0x00000000:0x00000000 (MSR_LASTBRANCH_19_TO_IP)
 MSR 0x000006D4 = 0x00000000:0x00000000 (MSR_LASTBRANCH_20_TO_IP)
 MSR 0x000006D5 = 0x00000000:0x00000000 (MSR_LASTBRANCH_21_TO_IP)
 MSR 0x000006D6 = 0x00000000:0x00000000 (MSR_LASTBRANCH_22_TO_IP)
 MSR 0x000006D7 = 0x00000000:0x00000000 (MSR_LASTBRANCH_23_TO_IP)
 MSR 0x000006D8 = 0x00000000:0x00000000 (MSR_LASTBRANCH_24_TO_IP)
 MSR 0x000006D9 = 0x00000000:0x00000000 (MSR_LASTBRANCH_25_TO_IP)
 MSR 0x000006DA = 0x00000000:0x00000000 (MSR_LASTBRANCH_26_TO_IP)
 MSR 0x000006DB = 0x00000000:0x00000000 (MSR_LASTBRANCH_27_TO_IP)
 MSR 0x000006DC = 0x00000000:0x00000000 (MSR_LASTBRANCH_28_TO_IP)
 MSR 0x000006DD = 0x00000000:0x00000000 (MSR_LASTBRANCH_29_TO_IP)
 MSR 0x000006DE = 0x00000000:0x00000000 (MSR_LASTBRANCH_30_TO_IP)
 MSR 0x000006DF = 0x00000000:0x00000000 (MSR_LASTBRANCH_31_TO_IP)
 MSR 0x000006E0 = 0x00000039:0x4CB0E0EE (IA32_TSC_DEADLINE)
 MSR 0x00000771 = 0x00000000:0x010D1824 (IA32_HWP_CAPABILITIES)
 MSR 0x00000773 = 0x00000000:0x00000001 (IA32_HWP_INTERRUPT)
 MSR 0x00000774 = 0x00000000:0x00002408 (IA32_HWP_REQUEST)
 MSR 0x00000777 = 0x00000000:0x00000000 (IA32_HWP_STATUS)
 MSR 0x00000D90 = 0x00000000:0x00000000 (IA32_BNDCFGS)
 MSR 0x00000DA0 = 0x00000000:0x00000000 (IA32_XSS)
 MSR 0x00000DB1 = 0x00000000:0x00000001 (IA32_PM_CTL1)
 MSR 0x00000DB2 = 0x00000000:0x00000000 (IA32_THREAD_STALL)
 MSR 0x00000DC0 = 0x00000000:0x00000000 (IA32_LBR_INFO_0)
 MSR 0x00000DC1 = 0x00000000:0x00000000 (IA32_LBR_INFO_1)
 MSR 0x00000DC2 = 0x00000000:0x00000000 (IA32_LBR_INFO_2)
 MSR 0x00000DC3 = 0x00000000:0x00000000 (IA32_LBR_INFO_3)
 MSR 0x00000DC4 = 0x00000000:0x00000000 (IA32_LBR_INFO_4)
 MSR 0x00000DC5 = 0x00000000:0x00000000 (IA32_LBR_INFO_5)
 MSR 0x00000DC6 = 0x00000000:0x00000000 (IA32_LBR_INFO_6)
 MSR 0x00000DC7 = 0x00000000:0x00000000 (IA32_LBR_INFO_7)
 MSR 0x00000DC8 = 0x00000000:0x00000000 (IA32_LBR_INFO_8)
 MSR 0x00000DC9 = 0x00000000:0x00000000 (IA32_LBR_INFO_9)
 MSR 0x00000DCA = 0x00000000:0x00000000 (IA32_LBR_INFO_10)
 MSR 0x00000DCB = 0x00000000:0x00000000 (IA32_LBR_INFO_11)
 MSR 0x00000DCC = 0x00000000:0x00000000 (IA32_LBR_INFO_12)
 MSR 0x00000DCD = 0x00000000:0x00000000 (IA32_LBR_INFO_13)
 MSR 0x00000DCE = 0x00000000:0x00000000 (IA32_LBR_INFO_14)
 MSR 0x00000DCF = 0x00000000:0x00000000 (IA32_LBR_INFO_15)
 MSR 0x00000DD0 = 0x00000000:0x00000000 (IA32_LBR_INFO_16)
 MSR 0x00000DD1 = 0x00000000:0x00000000 (IA32_LBR_INFO_17)
 MSR 0x00000DD2 = 0x00000000:0x00000000 (IA32_LBR_INFO_18)
 MSR 0x00000DD3 = 0x00000000:0x00000000 (IA32_LBR_INFO_19)
 MSR 0x00000DD4 = 0x00000000:0x00000000 (IA32_LBR_INFO_20)
 MSR 0x00000DD5 = 0x00000000:0x00000000 (IA32_LBR_INFO_21)
 MSR 0x00000DD6 = 0x00000000:0x00000000 (IA32_LBR_INFO_22)
 MSR 0x00000DD7 = 0x00000000:0x00000000 (IA32_LBR_INFO_23)
 MSR 0x00000DD8 = 0x00000000:0x00000000 (IA32_LBR_INFO_24)
 MSR 0x00000DD9 = 0x00000000:0x00000000 (IA32_LBR_INFO_25)
 MSR 0x00000DDA = 0x00000000:0x00000000 (IA32_LBR_INFO_26)
 MSR 0x00000DDB = 0x00000000:0x00000000 (IA32_LBR_INFO_27)
 MSR 0x00000DDC = 0x00000000:0x00000000 (IA32_LBR_INFO_28)
 MSR 0x00000DDD = 0x00000000:0x00000000 (IA32_LBR_INFO_29)
 MSR 0x00000DDE = 0x00000000:0x00000000 (IA32_LBR_INFO_30)
 MSR 0x00000DDF = 0x00000000:0x00000000 (IA32_LBR_INFO_31)

====================== UNIQUE MSRs  (core 10) ======================
 MSR 0x00000000 = 0x00000000:0x00000FFF (IA32_P5_MC_ADDR)
 MSR 0x00000001 = 0x00000000:0x00000000 (IA32_P5_MC_TYPE)
 MSR 0x00000006 = 0x00000000:0x00000040 (IA32_MONITOR_FILTER_SIZE)
 MSR 0x00000010 = 0x00000039:0x4C4C5D98 (IA32_TIME_STAMP_COUNTER)
 MSR 0x0000001B = 0x00000000:0xFEE00C00 (IA32_APIC_BASE)
 MSR 0x00000034 = 0x00000000:0x000001DD (MSR_SMI_COUNT)
 MSR 0x0000003A = 0x00000000:0x00000005 (IA32_FEATURE_CONTROL)
 MSR 0x0000008B = 0x000000F4:0x00000000 (IA32_BIOS_SIGN_ID)
 MSR 0x000000C1 = 0x00000000:0x00000000 (IA32_PMC0)
 MSR 0x000000C2 = 0x00000000:0x00000000 (IA32_PMC1)
 MSR 0x000000C3 = 0x00000000:0x00000000 (IA32_PMC2)
 MSR 0x000000C4 = 0x00000000:0x00000000 (IA32_PMC3)
 MSR 0x000000E2 = 0x00000000:0x1E008008 (MSR_PKG_CST_CONFIG_CONTROL)
 MSR 0x000000E4 = 0x00000000:0x00051814 (MSR_PMG_IO_CAPTURE_BASE)
 MSR 0x000000E7 = 0x00000002:0x23418A3E (IA32_MPERF)
 MSR 0x000000E8 = 0x00000002:0xFACB7914 (IA32_APERF)
 MSR 0x000000FE = 0x00000000:0x00001D0A (IA32_MTRRCAP)
 MSR 0x0000013C = 0x00000000:0x00000001 (MSR_FEATURE_CONFIG)
 MSR 0x00000174 = 0x00000000:0x00000010 (IA32_SYSENTER_CS)
 MSR 0x00000175 = 0xFFFFFE00:0x00251000 (IA32_SYSENTER_ESP)
 MSR 0x00000176 = 0xFFFFFFFF:0x8D6018A0 (IA32_SYSENTER_EIP)
 MSR 0x00000179 = 0x00000000:0x00000C0C (IA32_MCG_CAP)
 MSR 0x0000017A = 0x00000000:0x00000000 (IA32_MCG_STATUS)
 MSR 0x00000186 = 0x00000000:0x00000000 (IA32_PERFEVTSEL0)
 MSR 0x00000187 = 0x00000000:0x00000000 (IA32_PERFEVTSEL1)
 MSR 0x00000188 = 0x00000000:0x00000000 (IA32_PERFEVTSEL2)
 MSR 0x00000189 = 0x00000000:0x00000000 (IA32_PERFEVTSEL3)
 MSR 0x00000199 = 0x00000000:0x00000800 (IA32_PERF_CTL)
 MSR 0x0000019A = 0x00000000:0x00000000 (IA32_CLOCK_MODULATION)
 MSR 0x0000019B = 0x00000000:0x00000013 (IA32_THERM_INTERRUPT)
 MSR 0x0000019C = 0x00000000:0x88470800 (IA32_THERM_STATUS)
 MSR 0x000001A0 = 0x00000000:0x00850089 (IA32_MISC_ENABLE)
 MSR 0x000001A4 = 0x00000000:0x00000000 (IA32_MISC_FEATURE_CONTROL)
 MSR 0x000001A6 = 0x00000000:0x00000000 (MSR_OFFCORE_RSP_0)
 MSR 0x000001A7 = 0x00000000:0x00000000 (MSR_OFFCORE_RSP_1)
 MSR 0x000001C8 = 0x00000000:0x00000000 (MSR_LBR_SELECT)
 MSR 0x000001C9 = 0x00000000:0x00000000 (MSR_LASTBRANCH_TOS)
 MSR 0x000001D9 = 0x00000000:0x00004000 (IA32_DEBUGCTL)
 MSR 0x000001DD = 0x00000000:0x00000000 (MSR_LER_FROM_LIP)
 MSR 0x000001DE = 0x00000000:0x00000000 (MSR_LER_TO_LIP)
 MSR 0x000001F2 = 0x00000000:0xBF800006 (IA32_SMRR_PHYSBASE)
 MSR 0x000001F3 = 0x00000000:0xFF800800 (IA32_SMRR_PHYSMASK)
 MSR 0x000001F4 = 0x00000000:0x00000000 (MSR_PRMRR_PHYS_BASE)
 MSR 0x000001F5 = 0x00000000:0x00000000 (MSR_PRMRR_PHYS_MASK)
 MSR 0x000001FB = 0x00000000:0x000000E1 (MSR_PRMRR_VALID_CONFIG)
 MSR 0x000001FC = 0x00000000:0x002C005D (MSR_POWER_CTL)
 MSR 0x00000200 = 0x00000000:0xC0000000 (IA32_MTRR_PHYSBASE0)
 MSR 0x00000201 = 0x0000007F:0xC0000800 (IA32_MTRR_PHYSBASE0)
 MSR 0x00000202 = 0x00000000:0x00000000 (IA32_MTRR_PHYSBASE1)
 MSR 0x00000203 = 0x00000000:0x00000000 (IA32_MTRR_PHYSBASE1)
 MSR 0x00000204 = 0x00000000:0x00000000 (IA32_MTRR_PHYSBASE2)
 MSR 0x00000205 = 0x00000000:0x00000000 (IA32_MTRR_PHYSBASE2)
 MSR 0x00000206 = 0x00000000:0x00000000 (IA32_MTRR_PHYSBASE3)
 MSR 0x00000207 = 0x00000000:0x00000000 (IA32_MTRR_PHYSBASE3)
 MSR 0x00000208 = 0x00000000:0x00000000 (IA32_MTRR_PHYSBASE4)
 MSR 0x00000209 = 0x00000000:0x00000000 (IA32_MTRR_PHYSBASE4)
 MSR 0x0000020A = 0x00000000:0x00000000 (IA32_MTRR_PHYSBASE5)
 MSR 0x0000020B = 0x00000000:0x00000000 (IA32_MTRR_PHYSBASE5)
 MSR 0x0000020C = 0x00000000:0x00000000 (IA32_MTRR_PHYSBASE6)
 MSR 0x0000020D = 0x00000000:0x00000000 (IA32_MTRR_PHYSBASE6)
 MSR 0x0000020E = 0x00000000:0x00000000 (IA32_MTRR_PHYSBASE7)
 MSR 0x0000020F = 0x00000000:0x00000000 (IA32_MTRR_PHYSBASE7)
 MSR 0x00000210 = 0x00000000:0x00000000 (IA32_MTRR_PHYSBASE8)
 MSR 0x00000211 = 0x00000000:0x00000000 (IA32_MTRR_PHYSBASE8)
 MSR 0x00000212 = 0x00000000:0x00000000 (IA32_MTRR_PHYSBASE9)
 MSR 0x00000213 = 0x00000000:0x00000000 (IA32_MTRR_PHYSBASE9)
 MSR 0x00000250 = 0x06060606:0x06060606 (IA32_MTRR_FIX64K_00000)
 MSR 0x00000258 = 0x06060606:0x06060606 (IA32_MTRR_FIX16K_80000)
 MSR 0x00000259 = 0x00000000:0x00000000 (IA32_MTRR_FIX16K_A0000)
 MSR 0x00000268 = 0x05050505:0x05050505 (IA32_MTRR_FIX4K_C0000)
 MSR 0x00000269 = 0x05050505:0x05050505 (IA32_MTRR_FIX4K_C8000)
 MSR 0x0000026A = 0x05050505:0x05050505 (IA32_MTRR_FIX4K_D0000)
 MSR 0x0000026B = 0x05050505:0x05050505 (IA32_MTRR_FIX4K_D8000)
 MSR 0x0000026C = 0x05050505:0x05050505 (IA32_MTRR_FIX4K_E0000)
 MSR 0x0000026D = 0x05050505:0x05050505 (IA32_MTRR_FIX4K_E8000)
 MSR 0x0000026E = 0x05050505:0x05050505 (IA32_MTRR_FIX4K_F0000)
 MSR 0x0000026F = 0x05050505:0x05050505 (IA32_MTRR_FIX4K_F8000)
 MSR 0x00000277 = 0x04070506:0x00070106 (IA32_PAT)
 MSR 0x00000280 = 0x00000000:0x40000001 (IA32_MC0_CTL2)
 MSR 0x00000281 = 0x00000000:0x40000001 (IA32_MC1_CTL2)
 MSR 0x00000282 = 0x00000000:0x40000001 (IA32_MC2_CTL2)
 MSR 0x00000283 = 0x00000000:0x40000001 (IA32_MC3_CTL2)
 MSR 0x000002FF = 0x00000000:0x00000C06 (IA32_MTRR_DEF_TYPE)
 MSR 0x00000309 = 0x00000000:0x00000000 (IA32_FIXED_CTR0)
 MSR 0x0000030A = 0x0000FFFD:0x506DC9D1 (IA32_FIXED_CTR1)
 MSR 0x0000030B = 0x00000000:0x00000000 (IA32_FIXED_CTR2)
 MSR 0x00000345 = 0x00000000:0x000033C5 (IA32_PERF_CAPABILITIES)
 MSR 0x0000038D = 0x00000000:0x000000B0 (IA32_FIXED_CTR_CTRL)
 MSR 0x0000038E = 0x00000000:0x00000000 (IA32_PERF_GLOBAL_STATUS)
 MSR 0x0000038F = 0x00000007:0x0000000F (IA32_PERF_GLOBAL_CTRL)
 MSR 0x00000390 = 0x00000000:0x00000000 (IA32_PERF_GLOBAL_STATUS_RESET)
 MSR 0x00000391 = 0x00000000:0x00000000 (IA32_PERF_GLOBAL_STATUS_SET)
 MSR 0x000003F1 = 0x00000000:0x00000000 (MSR_PEBS_ENABLE)
 MSR 0x000003F6 = 0x00000000:0x0000FFFF (MSR_PEBS_LD_LAT)
 MSR 0x000003F7 = 0x00000000:0x00000800 (MSR_PEBS_FRONTEND)
 MSR 0x000003FC = 0x00000000:0x2BE30678 (MSR_CORE_C3_RESIDENCY)
 MSR 0x000003FD = 0x00000000:0xC3BA9690 (MSR_CORE_C6_RESIDENCY)
 MSR 0x000003FE = 0x00000029:0x4D4FFDC0 (MSR_CORE_C7_RESIDENCY)
 MSR 0x00000400 = 0x00000000:0x00000FFF (IA32_MC0_CTL)
 MSR 0x00000401 = 0x00000000:0x00000000 (IA32_MC0_STATUS)
 MSR 0x00000402 = 0x00000000:0x00000000 (IA32_MC0_ADDR)
 MSR 0x00000403 = 0x00000000:0x00000000 (IA32_MC0_MISC)
 MSR 0x00000404 = 0x00000000:0x0000000F (IA32_MC1_CTL)
 MSR 0x00000405 = 0x00000000:0x00000000 (IA32_MC1_STATUS)
 MSR 0x00000406 = 0x00000000:0x00000000 (IA32_MC1_ADDR)
 MSR 0x00000407 = 0x00000000:0x00000000 (IA32_MC1_MISC)
 MSR 0x00000408 = 0x00000000:0x0000000F (IA32_MC2_CTL)
 MSR 0x00000409 = 0x00000000:0x00000000 (IA32_MC2_STATUS)
 MSR 0x0000040A = 0x00000000:0x00000000 (IA32_MC2_ADDR)
 MSR 0x0000040C = 0x00000000:0x0000001F (IA32_MC3_CTL)
 MSR 0x0000040D = 0x00000000:0x00000000 (IA32_MC3_STATUS)
 MSR 0x0000040E = 0x00000000:0x00000000 (IA32_MC3_ADDR)
 MSR 0x00000410 = 0x00000000:0x0000003F (IA32_MC4_CTL)
 MSR 0x00000411 = 0x00000000:0x00000000 (IA32_MC4_STATUS)
 MSR 0x00000480 = 0x00DA0400:0x00000004 (IA32_VMX_BASIC)
 MSR 0x00000481 = 0x0000007F:0x00000016 (IA32_VMX_PINBASED_CTLS)
 MSR 0x00000482 = 0xFFF9FFFE:0x0401E172 (IA32_VMX_PROCBASED_CTLS)
 MSR 0x00000483 = 0x01FFFFFF:0x00036DFF (IA32_VMX_EXIT_CTLS)
 MSR 0x00000484 = 0x0003FFFF:0x000011FF (IA32_VMX_ENTRY_CTLS)
 MSR 0x00000485 = 0x00000000:0x7004C1E7 (IA32_VMX_MISC)
 MSR 0x00000486 = 0x00000000:0x80000021 (IA32_VMX_CR0_FIXED0)
 MSR 0x00000487 = 0x00000000:0xFFFFFFFF (IA32_VMX_CR0_FIXED1)
 MSR 0x00000488 = 0x00000000:0x00002000 (IA32_VMX_CR4_FIXED0)
 MSR 0x00000489 = 0x00000000:0x003767FF (IA32_VMX_CR4_FIXED1)
 MSR 0x0000048A = 0x00000000:0x0000002E (IA32_VMX_VMCS_ENUM)
 MSR 0x0000048B = 0x005FFCFF:0x00000000 (IA32_VMX_PROCBASED_CTLS2)
 MSR 0x0000048C = 0x00000F01:0x06734141 (IA32_VMX_EPT_VPID_ENUM)
 MSR 0x0000048D = 0x0000007F:0x00000016 (IA32_VMX_TRUE_PINBASED_CTLS)
 MSR 0x0000048E = 0xFFF9FFFE:0x04006172 (IA32_VMX_TRUE_PROCBASED_CTLS)
 MSR 0x0000048F = 0x01FFFFFF:0x00036DFB (IA32_VMX_TRUE_EXIT_CTLS)
 MSR 0x00000490 = 0x0003FFFF:0x000011FB (IA32_VMX_TRUE_ENTRY_CTLS)
 MSR 0x000004C1 = 0x00000000:0x00000000 (IA32_A_PMC0)
 MSR 0x000004C2 = 0x00000000:0x00000000 (IA32_A_PMC1)
 MSR 0x000004C3 = 0x00000000:0x00000000 (IA32_A_PMC2)
 MSR 0x000004C4 = 0x00000000:0x00000000 (IA32_A_PMC3)
 MSR 0x00000500 = 0x00000000:0x00020000 (IA32_SGX_SVN_STATUS)
 MSR 0x00000560 = 0x00000000:0x00000000 (IA32_RTIT_OUTPUT_BASE)
 MSR 0x00000561 = 0x00000000:0x0000007F (IA32_RTIT_OUTPUT_MASK_PTRS)
 MSR 0x00000570 = 0x00000000:0x00000000 (IA32_RTIT_CTL)
 MSR 0x00000571 = 0x00000000:0x00000000 (IA32_RTIT_STATUS)
 MSR 0x00000572 = 0x00000000:0x00000000 (IA32_RTIT_CR3_MATCH)
 MSR 0x00000580 = 0x00000000:0x00000000 (IA32_RTIT_ADDR0_A)
 MSR 0x00000581 = 0x00000000:0x00000000 (IA32_RTIT_ADDR0_B)
 MSR 0x00000582 = 0x00000000:0x00000000 (IA32_RTIT_ADDR1_A)
 MSR 0x00000583 = 0x00000000:0x00000000 (IA32_RTIT_ADDR1_B)
 MSR 0x00000600 = 0xFFFFFE00:0x00269000 (IA32_DS_AREA)
 MSR 0x0000064E = 0x00000002:0x9A831D8A (MSR_PPERF)
 MSR 0x00000653 = 0x00000000:0x00000000 (MSR_CORE_HDC_RESIDENCY)
 MSR 0x00000690 = 0x00000000:0x00000000 (MSR_LASTBRANCH_16_FROM_IP)
 MSR 0x00000691 = 0x00000000:0x00000000 (MSR_LASTBRANCH_17_FROM_IP)
 MSR 0x00000692 = 0x00000000:0x00000000 (MSR_LASTBRANCH_18_FROM_IP)
 MSR 0x00000693 = 0x00000000:0x00000000 (MSR_LASTBRANCH_19_FROM_IP)
 MSR 0x00000694 = 0x00000000:0x00000000 (MSR_LASTBRANCH_20_FROM_IP)
 MSR 0x00000695 = 0x00000000:0x00000000 (MSR_LASTBRANCH_21_FROM_IP)
 MSR 0x00000696 = 0x00000000:0x00000000 (MSR_LASTBRANCH_22_FROM_IP)
 MSR 0x00000697 = 0x00000000:0x00000000 (MSR_LASTBRANCH_23_FROM_IP)
 MSR 0x00000698 = 0x00000000:0x00000000 (MSR_LASTBRANCH_24_FROM_IP)
 MSR 0x00000699 = 0x00000000:0x00000000 (MSR_LASTBRANCH_25_FROM_IP)
 MSR 0x0000069A = 0x00000000:0x00000000 (MSR_LASTBRANCH_26_FROM_IP)
 MSR 0x0000069B = 0x00000000:0x00000000 (MSR_LASTBRANCH_27_FROM_IP)
 MSR 0x0000069C = 0x00000000:0x00000000 (MSR_LASTBRANCH_28_FROM_IP)
 MSR 0x0000069D = 0x00000000:0x00000000 (MSR_LASTBRANCH_29_FROM_IP)
 MSR 0x0000069E = 0x00000000:0x00000000 (MSR_LASTBRANCH_30_FROM_IP)
 MSR 0x0000069F = 0x00000000:0x00000000 (MSR_LASTBRANCH_31_FROM_IP)
 MSR 0x000006D0 = 0x00000000:0x00000000 (MSR_LASTBRANCH_16_TO_IP)
 MSR 0x000006D1 = 0x00000000:0x00000000 (MSR_LASTBRANCH_17_TO_IP)
 MSR 0x000006D2 = 0x00000000:0x00000000 (MSR_LASTBRANCH_18_TO_IP)
 MSR 0x000006D3 = 0x00000000:0x00000000 (MSR_LASTBRANCH_19_TO_IP)
 MSR 0x000006D4 = 0x00000000:0x00000000 (MSR_LASTBRANCH_20_TO_IP)
 MSR 0x000006D5 = 0x00000000:0x00000000 (MSR_LASTBRANCH_21_TO_IP)
 MSR 0x000006D6 = 0x00000000:0x00000000 (MSR_LASTBRANCH_22_TO_IP)
 MSR 0x000006D7 = 0x00000000:0x00000000 (MSR_LASTBRANCH_23_TO_IP)
 MSR 0x000006D8 = 0x00000000:0x00000000 (MSR_LASTBRANCH_24_TO_IP)
 MSR 0x000006D9 = 0x00000000:0x00000000 (MSR_LASTBRANCH_25_TO_IP)
 MSR 0x000006DA = 0x00000000:0x00000000 (MSR_LASTBRANCH_26_TO_IP)
 MSR 0x000006DB = 0x00000000:0x00000000 (MSR_LASTBRANCH_27_TO_IP)
 MSR 0x000006DC = 0x00000000:0x00000000 (MSR_LASTBRANCH_28_TO_IP)
 MSR 0x000006DD = 0x00000000:0x00000000 (MSR_LASTBRANCH_29_TO_IP)
 MSR 0x000006DE = 0x00000000:0x00000000 (MSR_LASTBRANCH_30_TO_IP)
 MSR 0x000006DF = 0x00000000:0x00000000 (MSR_LASTBRANCH_31_TO_IP)
 MSR 0x000006E0 = 0x00000039:0x4CB0E0EE (IA32_TSC_DEADLINE)
 MSR 0x00000771 = 0x00000000:0x010D1824 (IA32_HWP_CAPABILITIES)
 MSR 0x00000773 = 0x00000000:0x00000001 (IA32_HWP_INTERRUPT)
 MSR 0x00000774 = 0x00000000:0x00002408 (IA32_HWP_REQUEST)
 MSR 0x00000777 = 0x00000000:0x00000000 (IA32_HWP_STATUS)
 MSR 0x00000D90 = 0x00000000:0x00000000 (IA32_BNDCFGS)
 MSR 0x00000DA0 = 0x00000000:0x00000000 (IA32_XSS)
 MSR 0x00000DB1 = 0x00000000:0x00000001 (IA32_PM_CTL1)
 MSR 0x00000DB2 = 0x00000000:0x00000000 (IA32_THREAD_STALL)
 MSR 0x00000DC0 = 0x00000000:0x00000000 (IA32_LBR_INFO_0)
 MSR 0x00000DC1 = 0x00000000:0x00000000 (IA32_LBR_INFO_1)
 MSR 0x00000DC2 = 0x00000000:0x00000000 (IA32_LBR_INFO_2)
 MSR 0x00000DC3 = 0x00000000:0x00000000 (IA32_LBR_INFO_3)
 MSR 0x00000DC4 = 0x00000000:0x00000000 (IA32_LBR_INFO_4)
 MSR 0x00000DC5 = 0x00000000:0x00000000 (IA32_LBR_INFO_5)
 MSR 0x00000DC6 = 0x00000000:0x00000000 (IA32_LBR_INFO_6)
 MSR 0x00000DC7 = 0x00000000:0x00000000 (IA32_LBR_INFO_7)
 MSR 0x00000DC8 = 0x00000000:0x00000000 (IA32_LBR_INFO_8)
 MSR 0x00000DC9 = 0x00000000:0x00000000 (IA32_LBR_INFO_9)
 MSR 0x00000DCA = 0x00000000:0x00000000 (IA32_LBR_INFO_10)
 MSR 0x00000DCB = 0x00000000:0x00000000 (IA32_LBR_INFO_11)
 MSR 0x00000DCC = 0x00000000:0x00000000 (IA32_LBR_INFO_12)
 MSR 0x00000DCD = 0x00000000:0x00000000 (IA32_LBR_INFO_13)
 MSR 0x00000DCE = 0x00000000:0x00000000 (IA32_LBR_INFO_14)
 MSR 0x00000DCF = 0x00000000:0x00000000 (IA32_LBR_INFO_15)
 MSR 0x00000DD0 = 0x00000000:0x00000000 (IA32_LBR_INFO_16)
 MSR 0x00000DD1 = 0x00000000:0x00000000 (IA32_LBR_INFO_17)
 MSR 0x00000DD2 = 0x00000000:0x00000000 (IA32_LBR_INFO_18)
 MSR 0x00000DD3 = 0x00000000:0x00000000 (IA32_LBR_INFO_19)
 MSR 0x00000DD4 = 0x00000000:0x00000000 (IA32_LBR_INFO_20)
 MSR 0x00000DD5 = 0x00000000:0x00000000 (IA32_LBR_INFO_21)
 MSR 0x00000DD6 = 0x00000000:0x00000000 (IA32_LBR_INFO_22)
 MSR 0x00000DD7 = 0x00000000:0x00000000 (IA32_LBR_INFO_23)
 MSR 0x00000DD8 = 0x00000000:0x00000000 (IA32_LBR_INFO_24)
 MSR 0x00000DD9 = 0x00000000:0x00000000 (IA32_LBR_INFO_25)
 MSR 0x00000DDA = 0x00000000:0x00000000 (IA32_LBR_INFO_26)
 MSR 0x00000DDB = 0x00000000:0x00000000 (IA32_LBR_INFO_27)
 MSR 0x00000DDC = 0x00000000:0x00000000 (IA32_LBR_INFO_28)
 MSR 0x00000DDD = 0x00000000:0x00000000 (IA32_LBR_INFO_29)
 MSR 0x00000DDE = 0x00000000:0x00000000 (IA32_LBR_INFO_30)
 MSR 0x00000DDF = 0x00000000:0x00000000 (IA32_LBR_INFO_31)

====================== UNIQUE MSRs  (core 11) ======================
 MSR 0x00000000 = 0x00000000:0x00000FFF (IA32_P5_MC_ADDR)
 MSR 0x00000001 = 0x00000000:0x00000000 (IA32_P5_MC_TYPE)
 MSR 0x00000006 = 0x00000000:0x00000040 (IA32_MONITOR_FILTER_SIZE)
 MSR 0x00000010 = 0x00000039:0x4C787ED0 (IA32_TIME_STAMP_COUNTER)
 MSR 0x0000001B = 0x00000000:0xFEE00C00 (IA32_APIC_BASE)
 MSR 0x00000034 = 0x00000000:0x000001DD (MSR_SMI_COUNT)
 MSR 0x0000003A = 0x00000000:0x00000005 (IA32_FEATURE_CONTROL)
 MSR 0x0000008B = 0x000000F4:0x00000000 (IA32_BIOS_SIGN_ID)
 MSR 0x000000C1 = 0x00000000:0x00000000 (IA32_PMC0)
 MSR 0x000000C2 = 0x00000000:0x00000000 (IA32_PMC1)
 MSR 0x000000C3 = 0x00000000:0x00000000 (IA32_PMC2)
 MSR 0x000000C4 = 0x00000000:0x00000000 (IA32_PMC3)
 MSR 0x000000E2 = 0x00000000:0x1E008008 (MSR_PKG_CST_CONFIG_CONTROL)
 MSR 0x000000E4 = 0x00000000:0x00051814 (MSR_PMG_IO_CAPTURE_BASE)
 MSR 0x000000E7 = 0x00000002:0x70349A90 (IA32_MPERF)
 MSR 0x000000E8 = 0x00000003:0x7088DF24 (IA32_APERF)
 MSR 0x000000FE = 0x00000000:0x00001D0A (IA32_MTRRCAP)
 MSR 0x0000013C = 0x00000000:0x00000001 (MSR_FEATURE_CONFIG)
 MSR 0x00000174 = 0x00000000:0x00000010 (IA32_SYSENTER_CS)
 MSR 0x00000175 = 0xFFFFFE00:0x0028C000 (IA32_SYSENTER_ESP)
 MSR 0x00000176 = 0xFFFFFFFF:0x8D6018A0 (IA32_SYSENTER_EIP)
 MSR 0x00000179 = 0x00000000:0x00000C0C (IA32_MCG_CAP)
 MSR 0x0000017A = 0x00000000:0x00000000 (IA32_MCG_STATUS)
 MSR 0x00000186 = 0x00000000:0x00000000 (IA32_PERFEVTSEL0)
 MSR 0x00000187 = 0x00000000:0x00000000 (IA32_PERFEVTSEL1)
 MSR 0x00000188 = 0x00000000:0x00000000 (IA32_PERFEVTSEL2)
 MSR 0x00000189 = 0x00000000:0x00000000 (IA32_PERFEVTSEL3)
 MSR 0x00000199 = 0x00000000:0x00000800 (IA32_PERF_CTL)
 MSR 0x0000019A = 0x00000000:0x00000000 (IA32_CLOCK_MODULATION)
 MSR 0x0000019B = 0x00000000:0x00000013 (IA32_THERM_INTERRUPT)
 MSR 0x0000019C = 0x00000000:0x88480800 (IA32_THERM_STATUS)
 MSR 0x000001A0 = 0x00000000:0x00850089 (IA32_MISC_ENABLE)
 MSR 0x000001A4 = 0x00000000:0x00000000 (IA32_MISC_FEATURE_CONTROL)
 MSR 0x000001A6 = 0x00000000:0x00000000 (MSR_OFFCORE_RSP_0)
 MSR 0x000001A7 = 0x00000000:0x00000000 (MSR_OFFCORE_RSP_1)
 MSR 0x000001C8 = 0x00000000:0x00000000 (MSR_LBR_SELECT)
 MSR 0x000001C9 = 0x00000000:0x00000000 (MSR_LASTBRANCH_TOS)
 MSR 0x000001D9 = 0x00000000:0x00004000 (IA32_DEBUGCTL)
 MSR 0x000001DD = 0x00000000:0x00000000 (MSR_LER_FROM_LIP)
 MSR 0x000001DE = 0x00000000:0x00000000 (MSR_LER_TO_LIP)
 MSR 0x000001F2 = 0x00000000:0xBF800006 (IA32_SMRR_PHYSBASE)
 MSR 0x000001F3 = 0x00000000:0xFF800800 (IA32_SMRR_PHYSMASK)
 MSR 0x000001F4 = 0x00000000:0x00000000 (MSR_PRMRR_PHYS_BASE)
 MSR 0x000001F5 = 0x00000000:0x00000000 (MSR_PRMRR_PHYS_MASK)
 MSR 0x000001FB = 0x00000000:0x000000E1 (MSR_PRMRR_VALID_CONFIG)
 MSR 0x000001FC = 0x00000000:0x002C005D (MSR_POWER_CTL)
 MSR 0x00000200 = 0x00000000:0xC0000000 (IA32_MTRR_PHYSBASE0)
 MSR 0x00000201 = 0x0000007F:0xC0000800 (IA32_MTRR_PHYSBASE0)
 MSR 0x00000202 = 0x00000000:0x00000000 (IA32_MTRR_PHYSBASE1)
 MSR 0x00000203 = 0x00000000:0x00000000 (IA32_MTRR_PHYSBASE1)
 MSR 0x00000204 = 0x00000000:0x00000000 (IA32_MTRR_PHYSBASE2)
 MSR 0x00000205 = 0x00000000:0x00000000 (IA32_MTRR_PHYSBASE2)
 MSR 0x00000206 = 0x00000000:0x00000000 (IA32_MTRR_PHYSBASE3)
 MSR 0x00000207 = 0x00000000:0x00000000 (IA32_MTRR_PHYSBASE3)
 MSR 0x00000208 = 0x00000000:0x00000000 (IA32_MTRR_PHYSBASE4)
 MSR 0x00000209 = 0x00000000:0x00000000 (IA32_MTRR_PHYSBASE4)
 MSR 0x0000020A = 0x00000000:0x00000000 (IA32_MTRR_PHYSBASE5)
 MSR 0x0000020B = 0x00000000:0x00000000 (IA32_MTRR_PHYSBASE5)
 MSR 0x0000020C = 0x00000000:0x00000000 (IA32_MTRR_PHYSBASE6)
 MSR 0x0000020D = 0x00000000:0x00000000 (IA32_MTRR_PHYSBASE6)
 MSR 0x0000020E = 0x00000000:0x00000000 (IA32_MTRR_PHYSBASE7)
 MSR 0x0000020F = 0x00000000:0x00000000 (IA32_MTRR_PHYSBASE7)
 MSR 0x00000210 = 0x00000000:0x00000000 (IA32_MTRR_PHYSBASE8)
 MSR 0x00000211 = 0x00000000:0x00000000 (IA32_MTRR_PHYSBASE8)
 MSR 0x00000212 = 0x00000000:0x00000000 (IA32_MTRR_PHYSBASE9)
 MSR 0x00000213 = 0x00000000:0x00000000 (IA32_MTRR_PHYSBASE9)
 MSR 0x00000250 = 0x06060606:0x06060606 (IA32_MTRR_FIX64K_00000)
 MSR 0x00000258 = 0x06060606:0x06060606 (IA32_MTRR_FIX16K_80000)
 MSR 0x00000259 = 0x00000000:0x00000000 (IA32_MTRR_FIX16K_A0000)
 MSR 0x00000268 = 0x05050505:0x05050505 (IA32_MTRR_FIX4K_C0000)
 MSR 0x00000269 = 0x05050505:0x05050505 (IA32_MTRR_FIX4K_C8000)
 MSR 0x0000026A = 0x05050505:0x05050505 (IA32_MTRR_FIX4K_D0000)
 MSR 0x0000026B = 0x05050505:0x05050505 (IA32_MTRR_FIX4K_D8000)
 MSR 0x0000026C = 0x05050505:0x05050505 (IA32_MTRR_FIX4K_E0000)
 MSR 0x0000026D = 0x05050505:0x05050505 (IA32_MTRR_FIX4K_E8000)
 MSR 0x0000026E = 0x05050505:0x05050505 (IA32_MTRR_FIX4K_F0000)
 MSR 0x0000026F = 0x05050505:0x05050505 (IA32_MTRR_FIX4K_F8000)
 MSR 0x00000277 = 0x04070506:0x00070106 (IA32_PAT)
 MSR 0x00000280 = 0x00000000:0x40000001 (IA32_MC0_CTL2)
 MSR 0x00000281 = 0x00000000:0x40000001 (IA32_MC1_CTL2)
 MSR 0x00000282 = 0x00000000:0x40000001 (IA32_MC2_CTL2)
 MSR 0x00000283 = 0x00000000:0x40000001 (IA32_MC3_CTL2)
 MSR 0x000002FF = 0x00000000:0x00000C06 (IA32_MTRR_DEF_TYPE)
 MSR 0x00000309 = 0x00000000:0x00000000 (IA32_FIXED_CTR0)
 MSR 0x0000030A = 0x0000FFFD:0xC61E813A (IA32_FIXED_CTR1)
 MSR 0x0000030B = 0x00000000:0x00000000 (IA32_FIXED_CTR2)
 MSR 0x00000345 = 0x00000000:0x000033C5 (IA32_PERF_CAPABILITIES)
 MSR 0x0000038D = 0x00000000:0x000000B0 (IA32_FIXED_CTR_CTRL)
 MSR 0x0000038E = 0x00000000:0x00000000 (IA32_PERF_GLOBAL_STATUS)
 MSR 0x0000038F = 0x00000007:0x0000000F (IA32_PERF_GLOBAL_CTRL)
 MSR 0x00000390 = 0x00000000:0x00000000 (IA32_PERF_GLOBAL_STATUS_RESET)
 MSR 0x00000391 = 0x00000000:0x00000000 (IA32_PERF_GLOBAL_STATUS_SET)
 MSR 0x000003F1 = 0x00000000:0x00000000 (MSR_PEBS_ENABLE)
 MSR 0x000003F6 = 0x00000000:0x0000FFFF (MSR_PEBS_LD_LAT)
 MSR 0x000003F7 = 0x00000000:0x00000800 (MSR_PEBS_FRONTEND)
 MSR 0x000003FC = 0x00000000:0x30BB1E68 (MSR_CORE_C3_RESIDENCY)
 MSR 0x000003FD = 0x00000001:0x010B0098 (MSR_CORE_C6_RESIDENCY)
 MSR 0x000003FE = 0x00000029:0xD6C1D370 (MSR_CORE_C7_RESIDENCY)
 MSR 0x00000400 = 0x00000000:0x00000FFF (IA32_MC0_CTL)
 MSR 0x00000401 = 0x00000000:0x00000000 (IA32_MC0_STATUS)
 MSR 0x00000402 = 0x00000000:0x00000000 (IA32_MC0_ADDR)
 MSR 0x00000403 = 0x00000000:0x00000000 (IA32_MC0_MISC)
 MSR 0x00000404 = 0x00000000:0x0000000F (IA32_MC1_CTL)
 MSR 0x00000405 = 0x00000000:0x00000000 (IA32_MC1_STATUS)
 MSR 0x00000406 = 0x00000000:0x00000000 (IA32_MC1_ADDR)
 MSR 0x00000407 = 0x00000000:0x00000000 (IA32_MC1_MISC)
 MSR 0x00000408 = 0x00000000:0x0000000F (IA32_MC2_CTL)
 MSR 0x00000409 = 0x00000000:0x00000000 (IA32_MC2_STATUS)
 MSR 0x0000040A = 0x00000000:0x00000000 (IA32_MC2_ADDR)
 MSR 0x0000040C = 0x00000000:0x0000001F (IA32_MC3_CTL)
 MSR 0x0000040D = 0x00000000:0x00000000 (IA32_MC3_STATUS)
 MSR 0x0000040E = 0x00000000:0x00000000 (IA32_MC3_ADDR)
 MSR 0x00000410 = 0x00000000:0x0000003F (IA32_MC4_CTL)
 MSR 0x00000411 = 0x00000000:0x00000000 (IA32_MC4_STATUS)
 MSR 0x00000480 = 0x00DA0400:0x00000004 (IA32_VMX_BASIC)
 MSR 0x00000481 = 0x0000007F:0x00000016 (IA32_VMX_PINBASED_CTLS)
 MSR 0x00000482 = 0xFFF9FFFE:0x0401E172 (IA32_VMX_PROCBASED_CTLS)
 MSR 0x00000483 = 0x01FFFFFF:0x00036DFF (IA32_VMX_EXIT_CTLS)
 MSR 0x00000484 = 0x0003FFFF:0x000011FF (IA32_VMX_ENTRY_CTLS)
 MSR 0x00000485 = 0x00000000:0x7004C1E7 (IA32_VMX_MISC)
 MSR 0x00000486 = 0x00000000:0x80000021 (IA32_VMX_CR0_FIXED0)
 MSR 0x00000487 = 0x00000000:0xFFFFFFFF (IA32_VMX_CR0_FIXED1)
 MSR 0x00000488 = 0x00000000:0x00002000 (IA32_VMX_CR4_FIXED0)
 MSR 0x00000489 = 0x00000000:0x003767FF (IA32_VMX_CR4_FIXED1)
 MSR 0x0000048A = 0x00000000:0x0000002E (IA32_VMX_VMCS_ENUM)
 MSR 0x0000048B = 0x005FFCFF:0x00000000 (IA32_VMX_PROCBASED_CTLS2)
 MSR 0x0000048C = 0x00000F01:0x06734141 (IA32_VMX_EPT_VPID_ENUM)
 MSR 0x0000048D = 0x0000007F:0x00000016 (IA32_VMX_TRUE_PINBASED_CTLS)
 MSR 0x0000048E = 0xFFF9FFFE:0x04006172 (IA32_VMX_TRUE_PROCBASED_CTLS)
 MSR 0x0000048F = 0x01FFFFFF:0x00036DFB (IA32_VMX_TRUE_EXIT_CTLS)
 MSR 0x00000490 = 0x0003FFFF:0x000011FB (IA32_VMX_TRUE_ENTRY_CTLS)
 MSR 0x000004C1 = 0x00000000:0x00000000 (IA32_A_PMC0)
 MSR 0x000004C2 = 0x00000000:0x00000000 (IA32_A_PMC1)
 MSR 0x000004C3 = 0x00000000:0x00000000 (IA32_A_PMC2)
 MSR 0x000004C4 = 0x00000000:0x00000000 (IA32_A_PMC3)
 MSR 0x00000500 = 0x00000000:0x00020000 (IA32_SGX_SVN_STATUS)
 MSR 0x00000560 = 0x00000000:0x00000000 (IA32_RTIT_OUTPUT_BASE)
 MSR 0x00000561 = 0x00000000:0x0000007F (IA32_RTIT_OUTPUT_MASK_PTRS)
 MSR 0x00000570 = 0x00000000:0x00000000 (IA32_RTIT_CTL)
 MSR 0x00000571 = 0x00000000:0x00000000 (IA32_RTIT_STATUS)
 MSR 0x00000572 = 0x00000000:0x00000000 (IA32_RTIT_CR3_MATCH)
 MSR 0x00000580 = 0x00000000:0x00000000 (IA32_RTIT_ADDR0_A)
 MSR 0x00000581 = 0x00000000:0x00000000 (IA32_RTIT_ADDR0_B)
 MSR 0x00000582 = 0x00000000:0x00000000 (IA32_RTIT_ADDR1_A)
 MSR 0x00000583 = 0x00000000:0x00000000 (IA32_RTIT_ADDR1_B)
 MSR 0x00000600 = 0xFFFFFE00:0x002A4000 (IA32_DS_AREA)
 MSR 0x0000064E = 0x00000003:0x316CF57C (MSR_PPERF)
 MSR 0x00000653 = 0x00000000:0x00000000 (MSR_CORE_HDC_RESIDENCY)
 MSR 0x00000690 = 0x00000000:0x00000000 (MSR_LASTBRANCH_16_FROM_IP)
 MSR 0x00000691 = 0x00000000:0x00000000 (MSR_LASTBRANCH_17_FROM_IP)
 MSR 0x00000692 = 0x00000000:0x00000000 (MSR_LASTBRANCH_18_FROM_IP)
 MSR 0x00000693 = 0x00000000:0x00000000 (MSR_LASTBRANCH_19_FROM_IP)
 MSR 0x00000694 = 0x00000000:0x00000000 (MSR_LASTBRANCH_20_FROM_IP)
 MSR 0x00000695 = 0x00000000:0x00000000 (MSR_LASTBRANCH_21_FROM_IP)
 MSR 0x00000696 = 0x00000000:0x00000000 (MSR_LASTBRANCH_22_FROM_IP)
 MSR 0x00000697 = 0x00000000:0x00000000 (MSR_LASTBRANCH_23_FROM_IP)
 MSR 0x00000698 = 0x00000000:0x00000000 (MSR_LASTBRANCH_24_FROM_IP)
 MSR 0x00000699 = 0x00000000:0x00000000 (MSR_LASTBRANCH_25_FROM_IP)
 MSR 0x0000069A = 0x00000000:0x00000000 (MSR_LASTBRANCH_26_FROM_IP)
 MSR 0x0000069B = 0x00000000:0x00000000 (MSR_LASTBRANCH_27_FROM_IP)
 MSR 0x0000069C = 0x00000000:0x00000000 (MSR_LASTBRANCH_28_FROM_IP)
 MSR 0x0000069D = 0x00000000:0x00000000 (MSR_LASTBRANCH_29_FROM_IP)
 MSR 0x0000069E = 0x00000000:0x00000000 (MSR_LASTBRANCH_30_FROM_IP)
 MSR 0x0000069F = 0x00000000:0x00000000 (MSR_LASTBRANCH_31_FROM_IP)
 MSR 0x000006D0 = 0x00000000:0x00000000 (MSR_LASTBRANCH_16_TO_IP)
 MSR 0x000006D1 = 0x00000000:0x00000000 (MSR_LASTBRANCH_17_TO_IP)
 MSR 0x000006D2 = 0x00000000:0x00000000 (MSR_LASTBRANCH_18_TO_IP)
 MSR 0x000006D3 = 0x00000000:0x00000000 (MSR_LASTBRANCH_19_TO_IP)
 MSR 0x000006D4 = 0x00000000:0x00000000 (MSR_LASTBRANCH_20_TO_IP)
 MSR 0x000006D5 = 0x00000000:0x00000000 (MSR_LASTBRANCH_21_TO_IP)
 MSR 0x000006D6 = 0x00000000:0x00000000 (MSR_LASTBRANCH_22_TO_IP)
 MSR 0x000006D7 = 0x00000000:0x00000000 (MSR_LASTBRANCH_23_TO_IP)
 MSR 0x000006D8 = 0x00000000:0x00000000 (MSR_LASTBRANCH_24_TO_IP)
 MSR 0x000006D9 = 0x00000000:0x00000000 (MSR_LASTBRANCH_25_TO_IP)
 MSR 0x000006DA = 0x00000000:0x00000000 (MSR_LASTBRANCH_26_TO_IP)
 MSR 0x000006DB = 0x00000000:0x00000000 (MSR_LASTBRANCH_27_TO_IP)
 MSR 0x000006DC = 0x00000000:0x00000000 (MSR_LASTBRANCH_28_TO_IP)
 MSR 0x000006DD = 0x00000000:0x00000000 (MSR_LASTBRANCH_29_TO_IP)
 MSR 0x000006DE = 0x00000000:0x00000000 (MSR_LASTBRANCH_30_TO_IP)
 MSR 0x000006DF = 0x00000000:0x00000000 (MSR_LASTBRANCH_31_TO_IP)
 MSR 0x000006E0 = 0x00000039:0x4CB0E0EC (IA32_TSC_DEADLINE)
 MSR 0x00000771 = 0x00000000:0x010D1824 (IA32_HWP_CAPABILITIES)
 MSR 0x00000773 = 0x00000000:0x00000001 (IA32_HWP_INTERRUPT)
 MSR 0x00000774 = 0x00000000:0x00002408 (IA32_HWP_REQUEST)
 MSR 0x00000777 = 0x00000000:0x00000000 (IA32_HWP_STATUS)
 MSR 0x00000D90 = 0x00000000:0x00000000 (IA32_BNDCFGS)
 MSR 0x00000DA0 = 0x00000000:0x00000000 (IA32_XSS)
 MSR 0x00000DB1 = 0x00000000:0x00000001 (IA32_PM_CTL1)
 MSR 0x00000DB2 = 0x00000000:0x00000000 (IA32_THREAD_STALL)
 MSR 0x00000DC0 = 0x00000000:0x00000000 (IA32_LBR_INFO_0)
 MSR 0x00000DC1 = 0x00000000:0x00000000 (IA32_LBR_INFO_1)
 MSR 0x00000DC2 = 0x00000000:0x00000000 (IA32_LBR_INFO_2)
 MSR 0x00000DC3 = 0x00000000:0x00000000 (IA32_LBR_INFO_3)
 MSR 0x00000DC4 = 0x00000000:0x00000000 (IA32_LBR_INFO_4)
 MSR 0x00000DC5 = 0x00000000:0x00000000 (IA32_LBR_INFO_5)
 MSR 0x00000DC6 = 0x00000000:0x00000000 (IA32_LBR_INFO_6)
 MSR 0x00000DC7 = 0x00000000:0x00000000 (IA32_LBR_INFO_7)
 MSR 0x00000DC8 = 0x00000000:0x00000000 (IA32_LBR_INFO_8)
 MSR 0x00000DC9 = 0x00000000:0x00000000 (IA32_LBR_INFO_9)
 MSR 0x00000DCA = 0x00000000:0x00000000 (IA32_LBR_INFO_10)
 MSR 0x00000DCB = 0x00000000:0x00000000 (IA32_LBR_INFO_11)
 MSR 0x00000DCC = 0x00000000:0x00000000 (IA32_LBR_INFO_12)
 MSR 0x00000DCD = 0x00000000:0x00000000 (IA32_LBR_INFO_13)
 MSR 0x00000DCE = 0x00000000:0x00000000 (IA32_LBR_INFO_14)
 MSR 0x00000DCF = 0x00000000:0x00000000 (IA32_LBR_INFO_15)
 MSR 0x00000DD0 = 0x00000000:0x00000000 (IA32_LBR_INFO_16)
 MSR 0x00000DD1 = 0x00000000:0x00000000 (IA32_LBR_INFO_17)
 MSR 0x00000DD2 = 0x00000000:0x00000000 (IA32_LBR_INFO_18)
 MSR 0x00000DD3 = 0x00000000:0x00000000 (IA32_LBR_INFO_19)
 MSR 0x00000DD4 = 0x00000000:0x00000000 (IA32_LBR_INFO_20)
 MSR 0x00000DD5 = 0x00000000:0x00000000 (IA32_LBR_INFO_21)
 MSR 0x00000DD6 = 0x00000000:0x00000000 (IA32_LBR_INFO_22)
 MSR 0x00000DD7 = 0x00000000:0x00000000 (IA32_LBR_INFO_23)
 MSR 0x00000DD8 = 0x00000000:0x00000000 (IA32_LBR_INFO_24)
 MSR 0x00000DD9 = 0x00000000:0x00000000 (IA32_LBR_INFO_25)
 MSR 0x00000DDA = 0x00000000:0x00000000 (IA32_LBR_INFO_26)
 MSR 0x00000DDB = 0x00000000:0x00000000 (IA32_LBR_INFO_27)
 MSR 0x00000DDC = 0x00000000:0x00000000 (IA32_LBR_INFO_28)
 MSR 0x00000DDD = 0x00000000:0x00000000 (IA32_LBR_INFO_29)
 MSR 0x00000DDE = 0x00000000:0x00000000 (IA32_LBR_INFO_30)
 MSR 0x00000DDF = 0x00000000:0x00000000 (IA32_LBR_INFO_31)



============= AMBs ============


============= SPI / BIOS CNTL =============

Error: Dumping SPI on this southbridge is not (yet) supported.

============= AHCI Registers ==============


============= AHCI Configuration Registers ==============


============= SATA Initialization Registers ==============


============= ABAR ==============

ABAR = 0xde22b000 (MEM)

Generic Host Control Registers:
0x000: 0xe334ff43 (CAP)
0x004: 0x80000002 (GHC)
0x008: 0x00000000 (IS)
0x00c: 0x0000000f (PI)
0x010: 0x00010301 (VS)
0x014: 0x00000000 (CCC_CTL)
0x018: 0x00000000 (CCC_PORTS)
0x01c: 0x01600002 (EM_LOC)
0x020: 0x07010000 (EM_CTL)
0x024: 0x0000003c (CAP2)
0x028: 0x00000000 (BOHC)
0x0a0: 0x00000048 (Reserved)
0x0a4: 0x000f0000 (Reserved)
0x0c0: 0x0031a282 (Reserved)
0x0c8: 0x000000c0 (Reserved)

Port 0 Control Registers:
0x100: 0xfffe0000 (PxCLB)
0x104: 0x00000000 (PxCLBU)
0x108: 0xfffe0400 (PxFB)
0x10c: 0x00000000 (PxFBU)
0x110: 0x00000000 (PxIS)
0x114: 0x7840007f (PxIE)
0x118: 0x0000cc17 (PxCMD)
0x11c: 0x00000000 (Reserved)
0x120: 0x00000040 (PxTFD)
0x124: 0x00000101 (PxSIG)
0x128: 0x00000133 (PxSSTS)
0x12c: 0x00000300 (PxSCTL)
0x130: 0x00000000 (PxSERR)
0x134: 0x00000000 (PxSACT)
0x138: 0x00000000 (PxCI)
0x13c: 0x00000000 (PxSNTF)
0x140: 0x00000000 (PxFBS)
0x144: 0x00000000 (PxDEVSLP)
0x148: 0x00000000 (Reserved)

Port 1 Control Registers:
0x180: 0xfffc0000 (PxCLB)
0x184: 0x00000000 (PxCLBU)
0x188: 0xfffc0400 (PxFB)
0x18c: 0x00000000 (PxFBU)
0x190: 0x00000000 (PxIS)
0x194: 0x7840007f (PxIE)
0x198: 0x00004016 (PxCMD)
0x19c: 0x00000000 (Reserved)
0x1a0: 0x0000007f (PxTFD)
0x1a4: 0xffffffff (PxSIG)
0x1a8: 0x00000004 (PxSSTS)
0x1ac: 0x00000300 (PxSCTL)
0x1b0: 0x00000000 (PxSERR)
0x1b4: 0x00000000 (PxSACT)
0x1b8: 0x00000000 (PxCI)
0x1bc: 0x00000000 (PxSNTF)
0x1c0: 0x00000000 (PxFBS)
0x1c4: 0x00000000 (PxDEVSLP)
0x1c8: 0x00000000 (Reserved)

Port 2 Control Registers:
0x200: 0xfffa0000 (PxCLB)
0x204: 0x00000000 (PxCLBU)
0x208: 0xfffa0400 (PxFB)
0x20c: 0x00000000 (PxFBU)
0x210: 0x00000000 (PxIS)
0x214: 0x7840007f (PxIE)
0x218: 0x00004016 (PxCMD)
0x21c: 0x00000000 (Reserved)
0x220: 0x0000007f (PxTFD)
0x224: 0xffffffff (PxSIG)
0x228: 0x00000004 (PxSSTS)
0x22c: 0x00000300 (PxSCTL)
0x230: 0x00000000 (PxSERR)
0x234: 0x00000000 (PxSACT)
0x238: 0x00000000 (PxCI)
0x23c: 0x00000000 (PxSNTF)
0x240: 0x00000000 (PxFBS)
0x244: 0x00000000 (PxDEVSLP)
0x248: 0x00000000 (Reserved)

Port 3 Control Registers:
0x280: 0xfff80000 (PxCLB)
0x284: 0x00000000 (PxCLBU)
0x288: 0xfff80400 (PxFB)
0x28c: 0x00000000 (PxFBU)
0x290: 0x00000000 (PxIS)
0x294: 0x7840007f (PxIE)
0x298: 0x00004016 (PxCMD)
0x29c: 0x00000000 (Reserved)
0x2a0: 0x0000007f (PxTFD)
0x2a4: 0xffffffff (PxSIG)
0x2a8: 0x00000004 (PxSSTS)
0x2ac: 0x00000300 (PxSCTL)
0x2b0: 0x00000000 (PxSERR)
0x2b4: 0x00000000 (PxSACT)
0x2b8: 0x00000000 (PxCI)
0x2bc: 0x00000000 (PxSNTF)
0x2c0: 0x00000000 (PxFBS)
0x2c4: 0x00000000 (PxDEVSLP)
0x2c8: 0x00000000 (Reserved)

Other registers:

============= Dumping INTEL SGX status =============
Number of CPUs = 12
------------- CPU 0 ----------------
SGX supported             : YES
SGX enabled               : NO
Feature Control locked    : YES
------------- CPU 1 ----------------
SGX supported             : YES
SGX enabled               : NO
Feature Control locked    : YES
------------- CPU 2 ----------------
SGX supported             : YES
SGX enabled               : NO
Feature Control locked    : YES
------------- CPU 3 ----------------
SGX supported             : YES
SGX enabled               : NO
Feature Control locked    : YES
------------- CPU 4 ----------------
SGX supported             : YES
SGX enabled               : NO
Feature Control locked    : YES
------------- CPU 5 ----------------
SGX supported             : YES
SGX enabled               : NO
Feature Control locked    : YES
------------- CPU 6 ----------------
SGX supported             : YES
SGX enabled               : NO
Feature Control locked    : YES
------------- CPU 7 ----------------
SGX supported             : YES
SGX enabled               : NO
Feature Control locked    : YES
------------- CPU 8 ----------------
SGX supported             : YES
SGX enabled               : NO
Feature Control locked    : YES
------------- CPU 9 ----------------
SGX supported             : YES
SGX enabled               : NO
Feature Control locked    : YES
------------- CPU 10 ----------------
SGX supported             : YES
SGX enabled               : NO
Feature Control locked    : YES
------------- CPU 11 ----------------
SGX supported             : YES
SGX enabled               : NO
Feature Control locked    : YES
====================================================

============= Dumping INTEL TME status =============
TME supported : NO
====================================================

============= Dumping INTEL Key Locker status =============
Key Locker supported : NO
===========================================================
